{"exp": 29, "commit": "c6cd975", "parent_best": "e915b81", "status": "keep", "rmse": 0.006742, "best_rmse_before": 0.006775, "delta_pct": -0.49, "description": "add prev_abs_bearing_delta (turning history)", "hypothesis": "Consistent with all other prev_* features; turning trajectory shape matters for cornering energy context.", "observation": "RMSE 0.006742 (-0.49%) in 87.7s. Real gain from turning history.", "reasoning": "The prev_* pattern holds for geometry-derived features too. Try sinuosity next (actual length / straight-line distance).", "tags": ["feature-engineering", "sequencing", "geometry"]}
{"exp": 30, "commit": "bdf12f6", "parent_best": "c6cd975", "status": "keep", "rmse": 0.006736, "best_rmse_before": 0.006742, "delta_pct": -0.09, "description": "add sinuosity = polyline length / chord length", "hypothesis": "Curvier links (sinuosity > 1) have more speed variation and energy loss than their bearing-delta alone suggests.", "observation": "RMSE 0.006736 (-0.09%) in 95.7s. Tiny gain - most of the within-link curvature signal was already in abs_bearing_delta.", "reasoning": "Bearing-delta captures the dominant cornering energy; sinuosity is a small complementary signal. Geometry axis appears mostly exhausted now. Pivot back to model side - try LGBM with slightly more iters now that feature set is richer, or try MLP.", "tags": ["feature-engineering", "geometry"]}
{"exp": 31, "commit": "d01f6fe", "parent_best": "bdf12f6", "status": "keep", "rmse": 0.006702, "best_rmse_before": 0.006736, "delta_pct": -0.5, "description": "LGBM n_estimators 100 -> 200", "hypothesis": "At 17 features (up from 10 when this failed at exp18), richer signal can absorb more boosting rounds without overfit.", "observation": "RMSE 0.006702 (-0.5%) in 96.4s. Richer features do absorb more iters - the overfit diagnosis in exp18 was capacity-vs-feature-count, not iters alone.", "reasoning": "Cross-cutting: boosting iter ceiling is a joint function of (tree width, feature count). More features stabilizes more iters. Try pushing further.", "tags": ["hypertuning"]}
{"exp": 32, "commit": "1e433e7", "parent_best": "d01f6fe", "status": "keep", "rmse": 0.006685, "best_rmse_before": 0.006702, "delta_pct": -0.25, "description": "LGBM n_estimators 200 -> 500", "hypothesis": "More boosting rounds still helping at 17 features.", "observation": "RMSE 0.006685 (-0.25%) in 105.5s. Still helping; haven't hit the overfit point yet.", "reasoning": "Likely diminishing returns soon. Try 1000 as one more probe, then pivot to MLP or regularization.", "tags": ["hypertuning"]}
{"exp": 33, "commit": "e2f99cb", "parent_best": "1e433e7", "status": "discard", "rmse": 0.006695, "best_rmse_before": 0.006685, "delta_pct": 0.15, "description": "LGBM n_estimators 500 -> 1000", "hypothesis": "Continue pushing iterations.", "observation": "RMSE 0.006695 (+0.15%) in 116s. Slight overfit - 500 was the sweet spot for this feature set.", "reasoning": "Overfit onset at ~500-1000 iters with num_leaves=255 and 17 features. Try regularization (min_child_samples or feature_fraction) to push further.", "tags": ["hypertuning", "overfitting"]}
{"exp": 34, "commit": "6eb7b71", "parent_best": "1e433e7", "status": "discard", "rmse": 0.006686, "best_rmse_before": 0.006685, "delta_pct": 0.01, "description": "LGBM feature_fraction 1.0 -> 0.9", "hypothesis": "Column subsampling regularizes and decorrelates trees.", "observation": "RMSE 0.006686 (tied) in 105s. No effect.", "reasoning": "feature_fraction=0.9 too mild to help. Try stronger regularization or switch tack to MLP.", "tags": ["hypertuning", "dead-end"]}
{"exp": 35, "commit": "de7a5d1", "parent_best": "1e433e7", "status": "keep", "rmse": 0.006673, "best_rmse_before": 0.006685, "delta_pct": -0.18, "description": "LGBM min_child_samples 20 -> 50", "hypothesis": "Raising min-leaf-size regularizes overfit-prone wide-tree splits.", "observation": "RMSE 0.006673 (-0.18%) in 104s. Gentle regularization helps.", "reasoning": "min_child_samples is a stronger lever than feature_fraction here. Try n_estimators=1000 now that we have more regularization.", "tags": ["hypertuning"]}
{"exp": 36, "commit": "34e609f", "parent_best": "de7a5d1", "status": "discard", "rmse": 0.006684, "best_rmse_before": 0.006673, "delta_pct": 0.16, "description": "LGBM n_estimators 1000 with min_child_samples=50", "hypothesis": "Regularization should allow more iterations.", "observation": "RMSE 0.006684 (+0.16%) in 114s. Still overfits.", "reasoning": "min_child_samples=50 alone isn't enough to support 1000 iters. LGBM on this problem is effectively saturated around n_estimators=500 with num_leaves=255 and min_child_samples=50.", "tags": ["hypertuning", "dead-end", "overfitting"]}
{"exp": 37, "commit": "fb6f344", "parent_best": "de7a5d1", "status": "keep", "rmse": 0.006656, "best_rmse_before": 0.006673, "delta_pct": -0.25, "description": "LGBM learning_rate 0.1 -> 0.05 at n_estimators=500 mcs=50", "hypothesis": "Smaller LR at same iter count = smoother fit, typically better RMSE.", "observation": "RMSE 0.006656 (-0.25%) in 107s. Lower LR helps when regularization is in place.", "reasoning": "Cross-cutting: LR reduction only helps when min_child_samples regularization is already tuned. Now can probably push n_estimators higher too.", "tags": ["hypertuning"]}
{"exp": 38, "commit": "a076168", "parent_best": "fb6f344", "status": "keep", "rmse": 0.006644, "best_rmse_before": 0.006656, "delta_pct": -0.18, "description": "LGBM n_estimators 500 -> 1000 at LR=0.05, min_child_samples=50", "hypothesis": "With smaller LR each step is less of an overfit risk, so more iters can help.", "observation": "RMSE 0.006644 (-0.18%) in 124s. LR=0.05 + mcs=50 bought the headroom for 1000 iters.", "reasoning": "Confirms cross-cutting: LR, n_estimators, and min_child_samples must be tuned jointly; lowering LR is the key that unlocks more iterations safely.", "tags": ["hypertuning"]}
