{"exp": 17, "commit": "f9decf0", "parent_best": "610f052", "status": "keep", "started_at": "2026-08-25T23:48:14Z", "ended_at": "2026-08-25T23:48:57Z", "model_family": "GBDT", "features": ["speed_mph", "grade_percent", "miles", "dke_per_mile", "dke_in_link", "gap_seconds", "prev_miles", "next_miles", "next_gap_seconds", "prev2_speed", "dv_out", "journey_rate", "journey_gge_per_mile"], "metrics": {"rmse": 0.005016, "trip_rmse": 0.001753}, "best_before": {"rmse": 0.005041, "trip_rmse": 0.001814}, "delta_pct": {"rmse": -0.5, "trip_rmse": -3.36}, "description": "add journey_gge_per_mile, the distance-weighted version of the journey offset", "hypothesis": "the trip metric sums energy, not rates, so a distance-weighted journey mean is the quantity it actually cares about, and it down-weights the very short links whose rate has a tiny denominator", "observation": "trip_rmse -3.36% (0.001814 -> 0.001753) and rmse -0.50%, on top of the unweighted offset rather than instead of it", "reasoning": "The two weightings of the same trip-constant carry different information because link length and link rate are correlated -- the unweighted mean is dominated by short links, the weighted one by long ones. Cumulative from baseline is now rmse -62.4%, trip_rmse -42.3%.", "tags": ["feature-engineering", "target-encoding", "split-dependent"]}
{"exp": 18, "commit": "c8fdcde", "parent_best": "f9decf0", "status": "discard", "started_at": "2026-08-25T23:50:06Z", "ended_at": "2026-08-25T23:50:59Z", "model_family": "GBDT", "features": ["speed_mph", "grade_percent", "miles", "dke_per_mile", "dke_in_link", "gap_seconds", "prev_miles", "next_miles", "next_gap_seconds", "prev2_speed", "dv_out"], "metrics": {"rmse": 0.005048, "trip_rmse": 0.001391}, "best_before": {"rmse": 0.005016, "trip_rmse": 0.001753}, "delta_pct": {"rmse": 0.64, "trip_rmse": -20.65}, "description": "estimate the journey effect from the model's training residuals as a post-hoc additive offset, replacing the two journey mean-rate features", "hypothesis": "a journey's training links should contribute their mean *residual*, not their mean rate -- the mean rate is mostly the trip's road and speed mix, which the model already explains, while the residual is exactly what the per-link features could not account for", "observation": "trip_rmse -20.65% (0.001753 -> 0.001391), by far the largest move any experiment has produced on that metric, but rmse +0.64%", "reasoning": "The estimator is clearly the right one -- a per-journey bias correction is precisely what a trip-total metric rewards. It costs link rmse because a constant per-journey shift trades a small amount of added link-level variance (the offset is estimated, so it is noisy) for the removal of trip-level bias that link rmse barely sees. Discarded on the rule as written (rmse is primary and regressed), but this is the strongest lead in the session: the next move is to keep the journey features that already earn their rmse and add the residual offset on top, so the offset has less bias left to carry and less noise to inject.", "tags": ["architecture", "target-encoding", "metric-tension", "revisit"]}
{"exp": 19, "commit": "dbd3362", "parent_best": "f9decf0", "status": "keep", "started_at": "2026-08-25T23:51:41Z", "ended_at": "2026-08-25T23:52:36Z", "model_family": "GBDT", "features": ["speed_mph", "grade_percent", "miles", "dke_per_mile", "dke_in_link", "gap_seconds", "prev_miles", "next_miles", "next_gap_seconds", "prev2_speed", "dv_out", "journey_rate", "journey_gge_per_mile"], "metrics": {"rmse": 0.00502, "trip_rmse": 0.001467}, "best_before": {"rmse": 0.005016, "trip_rmse": 0.001753}, "delta_pct": {"rmse": 0.08, "trip_rmse": -16.32}, "description": "add the residual journey offset on top of the journey mean-rate features (rather than instead of them)", "hypothesis": "exp18's offset cost rmse because it had to carry the whole trip effect alone; leaving the mean-rate features in place means the model keeps the part of the effect it can use, and the offset only has to correct the remainder, so it is smaller and injects less noise", "observation": "trip_rmse -16.32% (0.001753 -> 0.001467) with rmse +0.08%, versus exp18's -20.65% / +0.64% -- the rmse cost fell eight-fold while five-sixths of the trip gain survived", "reasoning": "Confirms the diagnosis: the offset's rmse damage scales with how much bias it has to absorb, so pre-absorbing what the model can use makes it nearly free. Kept because +0.08% is inside the +/-0.25% band the setup rule already declared a tie on the primary metric, against a 16% gain on the secondary -- the rule's 'both improve' clause is not the operative one when the primary is inside its own noise band.", "tags": ["architecture", "target-encoding", "breakthrough"]}
{"exp": 20, "commit": "9fe1778", "parent_best": "dbd3362", "status": "keep", "started_at": "2026-08-25T23:53:19Z", "ended_at": "2026-08-25T23:54:54Z", "model_family": "GBDT", "features": ["speed_mph", "grade_percent", "miles", "dke_per_mile", "dke_in_link", "gap_seconds", "prev_miles", "next_miles", "next_gap_seconds", "prev2_speed", "dv_out", "journey_rate", "journey_gge_per_mile"], "metrics": {"rmse": 0.005021, "trip_rmse": 0.001418}, "best_before": {"rmse": 0.00502, "trip_rmse": 0.001467}, "delta_pct": {"rmse": 0.02, "trip_rmse": -3.34}, "description": "estimate the journey offset from 2-fold out-of-fold residuals instead of in-sample ones", "hypothesis": "in-sample residuals are shrunk toward zero because the model has already fitted part of the very trip effect being measured, so an offset built from them under-states the correction; folds scored by a model that did not see them give an honest estimate", "observation": "trip_rmse -3.34% (0.001467 -> 0.001418) with rmse flat at +0.02%, at 92.2s vs 51.8s", "reasoning": "The bias was real but modest, so the honest estimator is worth about a fifth of what the offset itself was worth. Kept on the secondary metric alone: 3.3% is well outside the 0.25% noise band, and the extra code is one principled function rather than a hack, with runtime still at 15% of the budget.", "tags": ["architecture", "target-encoding"]}
{"exp": 21, "commit": "76a4ced", "parent_best": "9fe1778", "status": "discard", "started_at": "2026-08-25T23:55:44Z", "ended_at": "2026-08-25T23:57:19Z", "model_family": "GBDT", "features": ["speed_mph", "grade_percent", "miles", "dke_per_mile", "dke_in_link", "gap_seconds", "prev_miles", "next_miles", "next_gap_seconds", "prev2_speed", "dv_out", "dke_out_link", "journey_rate", "journey_gge_per_mile"], "metrics": {"rmse": 0.005014, "trip_rmse": 0.001419}, "best_before": {"rmse": 0.005021, "trip_rmse": 0.001418}, "delta_pct": {"rmse": -0.14, "trip_rmse": 0.07}, "description": "add dke_out_link, the exit half of the kinetic-energy change", "hypothesis": "a boosted tree cannot subtract two inputs, so holding the total and both halves is not redundant; the probe scored this at -1.8% before dv_out existed", "observation": "both metrics inside the tie band: rmse -0.14%, trip_rmse +0.07%", "reasoning": "dv_out (exp14) already carries the exit-side speed change, and the per-mile version adds nothing on top of it. The probe's -1.8% was measured against a base without dv_out, so this is a case of a probe estimate expiring once a correlated feature is adopted -- estimates need re-measuring, not just re-ranking, after each keep.", "tags": ["feature-engineering", "dead-end"]}
{"exp": 22, "commit": "c238b02", "parent_best": "9fe1778", "status": "discard", "started_at": "2026-08-25T23:59:43Z", "ended_at": "2026-08-26T00:01:19Z", "model_family": "GBDT", "features": ["speed_mph", "grade_percent", "miles", "dke_per_mile", "dke_in_link", "gap_seconds", "prev_miles", "next_miles", "next_gap_seconds", "prev2_speed", "dv_out", "journey_rate", "journey_gge_per_mile"], "metrics": {"rmse": 0.005528, "trip_rmse": 0.001553}, "best_before": {"rmse": 0.005021, "trip_rmse": 0.001418}, "delta_pct": {"rmse": 10.1, "trip_rmse": 9.52}, "description": "fit least squares on the physics terms (grade, dke, speed) first and boost the trees on its residual", "hypothesis": "grade and the kinetic-energy differences enter the energy balance linearly and a tree can only approximate a line as a staircase, so 2000 rounds spend capacity rebuilding a slope the closed form gives exactly", "observation": "both metrics ~10% worse (rmse 0.005021 -> 0.005528, trip 0.001418 -> 0.001553)", "reasoning": "The premise is wrong twice over. dke_per_mile is heavy-tailed -- it is a squared speed divided by a distance that can be 0.002 miles -- so an unconditional line through it makes extreme predictions on the tails that the trees then have to spend capacity undoing. And the true coefficients are regime-dependent: regen is active on deceleration and not on acceleration, so there is no single slope to extract. Trees were not wasting capacity on a line; they were fitting a genuinely non-linear surface.", "tags": ["architecture", "physics", "dead-end"]}
{"exp": 23, "commit": "0d528a2", "parent_best": "9fe1778", "status": "keep", "started_at": "2026-08-26T00:02:16Z", "ended_at": "2026-08-26T00:09:36Z", "model_family": "GBDT", "features": ["speed_mph", "grade_percent", "miles", "dke_per_mile", "dke_in_link", "gap_seconds", "prev_miles", "next_miles", "next_gap_seconds", "prev2_speed", "dv_out", "journey_rate", "journey_gge_per_mile"], "metrics": {"rmse": 0.004967, "trip_rmse": 0.001362}, "best_before": {"rmse": 0.005021, "trip_rmse": 0.001418}, "delta_pct": {"rmse": -1.08, "trip_rmse": -3.95}, "description": "average an ensemble of 5 boosted models, each seeing a random 70% of the features at every split", "hypothesis": "exp12 showed the model sits just past its capacity optimum, so the one way left to spend the unused budget without buying more overfitting is variance reduction; feature subsampling is what makes otherwise-deterministic HistGBR members differ", "observation": "rmse -1.08% (0.005021 -> 0.004967) and trip_rmse -3.95% (0.001418 -> 0.001362), at 436.9s of the 600s budget", "reasoning": "First rmse gain since exp17, and it came from variance reduction rather than from any new information -- which is consistent with the diagnosis that the model is noise-limited rather than signal-limited. The budget is now 73% used, so any further ensemble growth has to be paid for by making the out-of-fold residual step cheaper.", "tags": ["architecture", "ensembling"]}
{"exp": 24, "commit": "8d6099c", "parent_best": "0d528a2", "status": "discard", "started_at": "2026-08-26T00:10:02Z", "ended_at": "2026-08-26T00:14:04Z", "model_family": "GBDT", "features": ["speed_mph", "grade_percent", "miles", "dke_per_mile", "dke_in_link", "gap_seconds", "prev_miles", "next_miles", "next_gap_seconds", "prev2_speed", "dv_out", "journey_rate", "journey_gge_per_mile"], "metrics": {"rmse": 0.004968, "trip_rmse": 0.001371}, "best_before": {"rmse": 0.004967, "trip_rmse": 0.001362}, "delta_pct": {"rmse": 0.02, "trip_rmse": 0.66}, "description": "score the out-of-fold residual with a single model instead of the whole ensemble, to buy back runtime", "hypothesis": "the offset only needs a journey's *mean* residual, and averaging ensemble members barely moves a mean, so a single member should give the same offset at a fifth of the cost", "observation": "rmse flat (+0.02%) but trip_rmse +0.66%, at 239.4s instead of 436.9s", "reasoning": "The mean did move: a single feature-subsampled member is a weaker model, so its residuals carry more of the model's own error and less of the trip effect, and the offset degrades. Not free after all -- but it does price the trade, 45% of the budget for 0.66% of trip_rmse, which is the exchange rate any future ensemble growth has to beat.", "tags": ["architecture", "efficiency", "dead-end"]}
{"exp": 25, "commit": "4a2a478", "parent_best": "0d528a2", "status": "keep", "started_at": "2026-08-26T00:20:23Z", "ended_at": "2026-08-26T00:27:46Z", "model_family": "GBDT", "features": ["speed_mph", "grade_percent", "miles", "dke_per_mile", "dke_in_link", "gap_seconds", "prev_miles", "next_miles", "next_gap_seconds", "prev2_speed", "dv_out", "journey_rate", "journey_gge_per_mile"], "metrics": {"rmse": 0.004959, "trip_rmse": 0.001292}, "best_before": {"rmse": 0.004967, "trip_rmse": 0.001362}, "delta_pct": {"rmse": -0.16, "trip_rmse": -5.14}, "description": "average the journey residual over distance instead of over links (total residual energy / total residual miles)", "hypothesis": "a trip's leftover is a quantity of energy, and a hundred-foot link's rate is a ratio with a hundred-foot denominator, so averaging links equally lets the noisiest links set the correction for the whole trip", "observation": "trip_rmse -5.14% (0.001362 -> 0.001292) and rmse -0.16%; an offline grid over both weightings and six shrinkage levels had the distance-weighted version ahead on *both* metrics at every level", "reasoning": "The weighting question and the shrinkage question turned out to be the same question -- both are about how much a short, noisy link is allowed to say -- which is why fixing the weighting helped the link metric too rather than trading against it.", "tags": ["target-encoding", "hypertuning"]}
{"exp": 26, "commit": "36255c7", "parent_best": "4a2a478", "status": "discard", "started_at": "2026-08-26T00:28:02Z", "ended_at": "2026-08-26T00:35:26Z", "model_family": "GBDT", "features": ["speed_mph", "grade_percent", "miles", "dke_per_mile", "dke_in_link", "gap_seconds", "prev_miles", "next_miles", "next_gap_seconds", "prev2_speed", "dv_out", "journey_rate", "journey_gge_per_mile"], "metrics": {"rmse": 0.004947, "trip_rmse": 0.001294}, "best_before": {"rmse": 0.004959, "trip_rmse": 0.001292}, "delta_pct": {"rmse": -0.24, "trip_rmse": 0.15}, "description": "raise the journey-offset shrinkage from 20 to 40 links", "hypothesis": "the offline grid had both metrics still improving at k=40 once the offset was distance-weighted", "observation": "rmse -0.24% and trip_rmse +0.15%, both inside the 0.25% tie band -- the grid's prediction did not survive the ensemble", "reasoning": "The grid was run against a single model whose residuals are noisier than the ensemble's, so it wanted more shrinkage than the real pipeline does; with a better residual estimate the optimum has already moved back to 20. A hyperparameter tuned on a cheaper stand-in transfers only as far as the stand-in's noise level matches.", "tags": ["hypertuning", "dead-end"]}
{"exp": 27, "commit": "e0d20bb", "parent_best": "4a2a478", "status": "discard", "started_at": "2026-08-26T00:36:12Z", "ended_at": "2026-08-26T00:43:41Z", "model_family": "GBDT", "features": ["speed_mph", "grade_percent", "miles", "dke_per_mile", "dke_in_link", "gap_seconds", "prev_miles", "next_miles", "next_gap_seconds", "prev2_speed", "dv_out", "journey_rate", "journey_gge_per_mile"], "metrics": {"rmse": 0.004961, "trip_rmse": 0.001296}, "best_before": {"rmse": 0.004959, "trip_rmse": 0.001292}, "delta_pct": {"rmse": 0.04, "trip_rmse": 0.31}, "description": "lower the ensemble feature subsample from 0.7 to 0.5", "hypothesis": "more aggressive subsampling decorrelates the members further, and averaging gains more from decorrelation than it loses from weaker members", "observation": "both metrics slightly worse (rmse +0.04%, trip +0.31%)", "reasoning": "With only 13 features, half of them at a split is too few -- several of the thirteen are near-duplicates of each other, so a member that misses dke_in_link has no substitute for it. The decorrelation/strength trade-off is already at its optimum at 0.7.", "tags": ["hypertuning", "ensembling", "dead-end"]}
{"exp": 28, "commit": "048fc5c", "parent_best": "4a2a478", "status": "discard", "started_at": "2026-08-26T00:45:25Z", "ended_at": "2026-08-26T00:52:57Z", "model_family": "GBDT", "features": ["speed_mph", "grade_percent", "miles", "dke_per_mile", "dke_in_link", "gap_seconds", "prev_miles", "next_miles", "next_gap_seconds", "prev2_speed", "dv_out", "journey_rate"], "metrics": {"rmse": 0.004974, "trip_rmse": 0.001289}, "best_before": {"rmse": 0.004959, "trip_rmse": 0.001292}, "delta_pct": {"rmse": 0.3, "trip_rmse": -0.23}, "description": "drop the journey_gge_per_mile feature now that the post-hoc offset is itself distance-weighted", "hypothesis": "the distance-weighted offset does the same job the distance-weighted feature was doing, so the feature should now be redundant and removing it is a free simplification", "observation": "rmse +0.30% (outside the tie band) with trip_rmse -0.23% (inside it) -- not free", "reasoning": "The two are not substitutes. The offset is a single additive shift applied after the fit; the feature lets the *trees* condition on the trip's energy intensity, e.g. splitting differently for a cold trip than a warm one. Removing it costs link accuracy that the offset cannot give back, because an offset cannot change a split.", "tags": ["simplification", "dead-end"]}
{"exp": 29, "commit": "2fa4068", "parent_best": "4a2a478", "status": "keep", "started_at": "2026-08-26T01:28:32Z", "ended_at": "2026-08-26T01:37:08Z", "model_family": "GBDT+CNN", "features": ["speed_mph", "grade_percent", "miles", "dke_per_mile", "dke_in_link", "gap_seconds", "prev_miles", "next_miles", "next_gap_seconds", "prev2_speed", "dv_out", "journey_rate", "journey_gge_per_mile"], "metrics": {"rmse": 0.004855, "trip_rmse": 0.001272}, "best_before": {"rmse": 0.004959, "trip_rmse": 0.001292}, "delta_pct": {"rmse": -2.1, "trip_rmse": -1.55}, "description": "blend in a dilated-CNN sequence member at weight 0.25, trained on the leftover budget", "hypothesis": "exp15 showed the sequence model is ~8% worse than the trees on its own, but a probe measured its errors at only 0.72 correlation with theirs, so a minority weight should remove variance neither can remove alone", "observation": "rmse -2.10% (0.004959 -> 0.004855) and trip_rmse -1.55% (0.001292 -> 0.001272) at 511.1s of the 600s budget", "reasoning": "The best single change since exp13, and it came from a model that loses outright on its own -- the value was in the error correlation, not the error size. Worth noting how nearly this was missed: exp15 discarded the CNN as a dead end, and it only came back because a diagnostic asked how its errors *relate* to the incumbent's rather than how big they are.", "tags": ["architecture", "ensembling", "breakthrough"]}
{"exp": 30, "commit": "b399cbb", "parent_best": "2fa4068", "status": "discard", "started_at": "2026-08-26T01:38:31Z", "ended_at": "2026-08-26T01:46:56Z", "model_family": "GBDT+CNN", "features": ["speed_mph", "grade_percent", "miles", "dke_per_mile", "dke_in_link", "gap_seconds", "prev_miles", "next_miles", "next_gap_seconds", "prev2_speed", "dv_out", "journey_rate", "journey_gge_per_mile"], "metrics": {"rmse": 0.004852, "trip_rmse": 0.001272}, "best_before": {"rmse": 0.004855, "trip_rmse": 0.001272}, "delta_pct": {"rmse": -0.06, "trip_rmse": 0.0}, "description": "move three ensemble members from the out-of-fold pass to the final one (5/5 -> 3 out-of-fold, 8 final)", "hypothesis": "the out-of-fold pass only needs a journey's mean residual, so members are worth more in the ensemble that actually predicts; at constant cost this should be a free gain", "observation": "a dead tie on both metrics (rmse -0.06%, trip_rmse 0.00%) at 499.9s", "reasoning": "Two facts cancel: eight averaged members are no better than five (the ensemble saturated), and a three-member out-of-fold residual is no worse than a five-member one (exp24's damage came from dropping to *one*, not from dropping below five). Ensemble breadth is exhausted as a lever in both places.", "tags": ["ensembling", "hypertuning", "dead-end"]}
{"exp": 31, "commit": "94f4282", "parent_best": "2fa4068", "status": "discard", "started_at": "2026-08-26T01:52:12Z", "ended_at": "2026-08-26T02:00:29Z", "model_family": "GBDT+CNN", "features": ["speed_mph", "grade_percent", "miles", "dke_per_mile", "dke_in_link", "gap_seconds", "prev_miles", "next_miles", "next_gap_seconds", "prev2_speed", "dv_out", "journey_rate", "journey_gge_per_mile"], "metrics": {"rmse": 0.004851, "trip_rmse": 0.001279}, "best_before": {"rmse": 0.004855, "trip_rmse": 0.001272}, "delta_pct": {"rmse": -0.08, "trip_rmse": 0.55}, "description": "raise the sequence blend weight from 0.25 to 0.32", "hypothesis": "a single-model blend grid put the rmse optimum near 0.35, so there may be more to take", "observation": "rmse -0.08% (inside the tie band) and trip_rmse +0.55% (outside it)", "reasoning": "The rmse optimum is broad and flat between 0.25 and 0.35 while trip_rmse falls away monotonically past ~0.15, so the two metrics pick different weights and 0.25 is the point where the primary is already flat and the secondary has not yet started to pay. Confirms 0.25 rather than replacing it.", "tags": ["hypertuning", "ensembling", "dead-end"]}
