{"exp": 0, "commit": "cc06c6e", "parent_best": null, "status": "keep", "started_at": "2026-08-26T17:04:38Z", "ended_at": "2026-08-26T17:04:53Z", "model_family": "RandomForest", "features": ["speed_mph", "grade_percent", "miles"], "metrics": {"rmse": 0.013345, "trip_rmse": 0.003037}, "best_before": null, "delta_pct": null, "description": "baseline: RandomForest(20 trees, depth 10) on speed_mph, grade_percent, miles", "hypothesis": "establishes the reference point every later experiment is measured against; no prior session exists in this tree", "observation": "rmse=0.013345, trip_rmse=0.003037 in 7.3s of the 600s budget", "reasoning": "the run uses ~1% of the time budget, so the baseline is almost certainly capacity-limited rather than data-limited — there is room for far larger models and richer features before the budget binds", "tags": ["baseline"]}
{"exp": 1, "commit": "f1675e3", "parent_best": "cc06c6e", "status": "discard", "started_at": "2026-08-26T17:06:05Z", "ended_at": "2026-08-26T17:06:17Z", "model_family": "RandomForest", "features": ["speed_mph", "grade_percent", "miles"], "metrics": {"rmse": 0.01348, "trip_rmse": 0.003043}, "best_before": {"rmse": 0.013345, "trip_rmse": 0.003037}, "delta_pct": {"rmse": 1.012, "trip_rmse": 0.198}, "description": "max_depth 10 -> 20", "hypothesis": "the baseline forest is capacity-limited (it uses 1% of the time budget), so deeper trees should fit the heavy-tailed target better and lower both metrics", "observation": "both metrics regressed: rmse +1.01% (0.013345 -> 0.013480) and trip_rmse +0.20% (0.003037 -> 0.003043)", "reasoning": "depth 10 was already past the useful point for 3 features \u2014 the extra depth memorizes noise in the regen tail rather than signal, so the baseline is feature-limited, not depth-limited; unused time budget is not evidence of under-capacity", "tags": ["hypertuning", "dead-end"]}
{"exp": 2, "commit": "62ee281", "parent_best": "cc06c6e", "status": "discard", "started_at": "2026-08-26T17:06:54Z", "ended_at": "2026-08-26T17:07:12Z", "model_family": "RandomForest", "features": ["speed_mph", "grade_percent", "miles"], "metrics": {"rmse": 0.013341, "trip_rmse": 0.003036}, "best_before": {"rmse": 0.013345, "trip_rmse": 0.003037}, "delta_pct": {"rmse": -0.03, "trip_rmse": -0.033}, "description": "n_estimators 20 -> 100 (Pareto-better but discarded on inference cost)", "hypothesis": "more trees is variance reduction rather than capacity, a different knob from exp1 depth, so it should help or tie on both metrics", "observation": "both metrics improved but only by 0.03% (rmse 0.013345 -> 0.013341, trip_rmse 0.003037 -> 0.003036) at 5x the trees and 2x the fit time", "reasoning": "technically Pareto-dominant but the gain is noise-level while the inference cost is 5x per link traversal, which domain.md names as a competing objective \u2014 rejected on the cost/simplicity criterion, and it confirms exp1 that the 3-feature model is feature-limited, not model-limited", "tags": ["hypertuning", "inference-cost", "dead-end"]}
{"exp": 3, "commit": "f28267d", "parent_best": "cc06c6e", "status": "keep", "started_at": "2026-08-26T17:08:01Z", "ended_at": "2026-08-26T17:08:12Z", "model_family": "RandomForest", "features": ["speed_mph", "grade_percent", "miles", "prev_speed_mph"], "metrics": {"rmse": 0.009164, "trip_rmse": 0.00299}, "best_before": {"rmse": 0.013345, "trip_rmse": 0.003037}, "delta_pct": {"rmse": -31.33, "trip_rmse": -1.548}, "description": "add one-link lookback feature prev_speed_mph (first link of journey filled with 0)", "hypothesis": "domain.md names acceleration as the dominant unmeasured driver of energy use and permits one backward link; the previous links speed is the only available proxy, so it should cut link error substantially", "observation": "rmse fell 31.3% (0.013345 -> 0.009164) while trip_rmse fell only 1.55% (0.003037 -> 0.002990); both improved so this Pareto-dominates", "reasoning": "the lookback is by far the biggest lever found so far, confirming acceleration was the missing signal; the lopsided split is the key insight \u2014 acceleration and braking errors largely cancel when summed along a journey, so trip totals were already near-right and the gain is almost entirely link-level precision", "tags": ["feature-engineering", "lookback", "breakthrough"]}
{"exp": 4, "commit": "8e738d3", "parent_best": "f28267d", "status": "keep", "started_at": "2026-08-26T17:08:45Z", "ended_at": "2026-08-26T17:08:57Z", "model_family": "RandomForest", "features": ["speed_mph", "grade_percent", "miles", "prev_speed_mph", "speed_delta"], "metrics": {"rmse": 0.008293, "trip_rmse": 0.002819}, "best_before": {"rmse": 0.009164, "trip_rmse": 0.00299}, "delta_pct": {"rmse": -9.505, "trip_rmse": -5.719}, "description": "add explicit speed_delta = speed_mph - prev_speed_mph", "hypothesis": "a tree splits one axis at a time and cannot express a difference of two columns, so handing it the acceleration proxy explicitly should beat making it reconstruct the difference from the raw pair", "observation": "rmse fell 9.5% (0.009164 -> 0.008293) and trip_rmse fell 5.7% (0.002990 -> 0.002819) \u2014 both improved, and trip_rmse moved much more than it did in exp3", "reasoning": "representation matters as much as information for axis-aligned models: the raw pair was already present in exp3 yet the explicit difference still bought 9.5%; the larger trip_rmse move suggests the delta corrects a directional bias that accumulates along a journey rather than cancelling like exp3s gain did", "tags": ["feature-engineering", "lookback", "data-representation", "breakthrough"]}
{"exp": 5, "commit": "d368d8f", "parent_best": "8e738d3", "status": "keep", "started_at": "2026-08-26T17:09:43Z", "ended_at": "2026-08-26T17:09:56Z", "model_family": "RandomForest", "features": ["speed_mph", "grade_percent", "miles", "prev_speed_mph", "speed_delta", "ke_delta_per_mile"], "metrics": {"rmse": 0.00821, "trip_rmse": 0.002789}, "best_before": {"rmse": 0.008293, "trip_rmse": 0.002819}, "delta_pct": {"rmse": -1.001, "trip_rmse": -1.064}, "description": "add ke_delta_per_mile = (v^2 - v_prev^2)/(2*miles), the physics form of the acceleration term", "hypothesis": "specific kinetic energy change per unit distance carries the same units as the target (energy per mile), so it should map onto the target more directly than the raw speed difference from exp4", "observation": "rmse fell 1.0% (0.008293 -> 0.008210) and trip_rmse fell 1.06% (0.002819 -> 0.002789) \u2014 both improved, in near lockstep this time", "reasoning": "a real but much smaller gain than exp4, so most of the acceleration signal was already captured by the raw delta and the division by distance adds only a little; the symmetric movement of the two metrics suggests this term corrects link and trip error in the same proportion rather than targeting either tail", "tags": ["feature-engineering", "physics", "lookback"]}
{"exp": 6, "commit": "be6ccd2", "parent_best": "d368d8f", "status": "keep", "started_at": "2026-08-26T17:11:14Z", "ended_at": "2026-08-26T17:11:51Z", "model_family": "RandomForest", "features": ["speed_mph", "grade_percent", "miles", "prev_speed_mph", "speed_delta", "ke_delta_per_mile", "sinuosity"], "metrics": {"rmse": 0.008093, "trip_rmse": 0.002757}, "best_before": {"rmse": 0.00821, "trip_rmse": 0.002789}, "delta_pct": {"rmse": -1.425, "trip_rmse": -1.147}, "description": "add geometry-derived sinuosity = miles / straight-line endpoint distance", "hypothesis": "a curvier link forces cornering and therefore braking and reacceleration at a given average speed, which the average-speed feature hides; it is also a static road attribute so it costs nothing at inference", "observation": "rmse fell 1.43% (0.008210 -> 0.008093) and trip_rmse fell 1.15% (0.002789 -> 0.002757); WKB decode added 23s, total run 33.8s of the 600s budget", "reasoning": "the geometry column carries real signal that the three scalar attributes do not, which opens the whole focus area; the gain is modest partly because links average only 3.7 vertices, so shape resolution is coarse and turn-angle style features may be limited by the same ceiling", "tags": ["feature-engineering", "geometry"]}
{"exp": 7, "commit": "1721b51", "parent_best": "be6ccd2", "status": "discard", "started_at": "2026-08-26T17:12:48Z", "ended_at": "2026-08-26T17:13:27Z", "model_family": "RandomForest", "features": ["speed_mph", "grade_percent", "miles", "prev_speed_mph", "speed_delta", "ke_delta_per_mile", "sinuosity", "total_turn_degrees"], "metrics": {"rmse": 0.008088, "trip_rmse": 0.002756}, "best_before": {"rmse": 0.008093, "trip_rmse": 0.002757}, "delta_pct": {"rmse": -0.062, "trip_rmse": -0.036}, "description": "add total_turn_degrees, summed absolute heading change across interior vertices (Pareto-better but discarded on simplicity)", "hypothesis": "sinuosity says a path is longer than the straight line but not how sharply it bends; summed turn angle should isolate the cornering that forces braking and reacceleration", "observation": "both metrics moved only 0.05% (rmse 0.008093 -> 0.008088, trip_rmse 0.002757 -> 0.002756) for roughly 25 lines of spherical heading math", "reasoning": "turn angle is almost entirely subsumed by sinuosity \u2014 with links averaging just 3.7 vertices there is little shape signal left once path-vs-straight-line ratio is known, so the coarse geometry resolution flagged in exp6 is a real ceiling on this whole feature family", "tags": ["feature-engineering", "geometry", "dead-end"]}
{"exp": 8, "commit": "55b4a0e", "parent_best": "be6ccd2", "status": "keep", "started_at": "2026-08-26T17:14:08Z", "ended_at": "2026-08-26T17:14:46Z", "model_family": "RandomForest", "features": ["speed_mph", "grade_percent", "miles", "prev_speed_mph", "speed_delta", "ke_delta_per_mile", "sinuosity", "prev_grade_percent"], "metrics": {"rmse": 0.00808, "trip_rmse": 0.002757}, "best_before": {"rmse": 0.008093, "trip_rmse": 0.002757}, "delta_pct": {"rmse": -0.161, "trip_rmse": 0.0}, "description": "add one-link lookback feature prev_grade_percent", "hypothesis": "the grade the vehicle entered the link on sets its momentum and whether it was already regenerating, completing the lookback pair alongside prev_speed_mph", "observation": "rmse fell 0.16% (0.008093 -> 0.008080) while trip_rmse was unchanged at 0.002757 to the harness six-decimal precision", "reasoning": "a genuine but small win \u2014 kept because these runs are deterministic (fixed random_state and fixed split) so 0.16% is real signal rather than noise, and the cost is 3 lines plus one precomputable feature; the flat trip_rmse says entry grade corrects individual link estimates in ways that cancel along a journey, the same cancelling dynamic seen in exp3", "tags": ["feature-engineering", "lookback"]}
{"exp": 9, "commit": "dd8f7e7", "parent_best": "55b4a0e", "status": "keep", "started_at": "2026-08-26T17:16:35Z", "ended_at": "2026-08-26T17:19:05Z", "model_family": "MLP", "features": ["speed_mph", "grade_percent", "miles", "prev_speed_mph", "speed_delta", "ke_delta_per_mile", "sinuosity", "prev_grade_percent"], "metrics": {"rmse": 0.007811, "trip_rmse": 0.002419}, "best_before": {"rmse": 0.00808, "trip_rmse": 0.002757}, "delta_pct": {"rmse": -3.329, "trip_rmse": -12.26}, "description": "swap RandomForest for a GPU MLP (8 -> 256 -> 256 -> 1, Adam 1e-3, batch 8192, 200 epochs)", "hypothesis": "energy as a function of speed, grade and acceleration is smooth and continuous, which a piecewise-constant forest approximates badly; a network should fit it better and the P100 makes it affordable", "observation": "rmse fell 3.3% (0.008080 -> 0.007811) but trip_rmse fell 12.3% (0.002757 -> 0.002419) \u2014 by far the largest trip-level move of the session; 200 epochs finished in 110s, well inside the 400s training allowance", "reasoning": "the disproportionate trip gain is the real finding: a tree gives every row in a leaf the same prediction, so its per-leaf bias is systematic and accumulates when links are summed along a journey, while a smooth fit spreads error more randomly and lets it cancel \u2014 this makes smoothness, not capacity, the lever for trip_rmse; inference is now ~68k FLOPs per link versus a few hundred for the forest, so shrinking the network is worth testing as a cost reduction", "tags": ["architecture", "breakthrough", "inference-cost"]}
{"exp": 10, "commit": "ea00a2e", "parent_best": "dd8f7e7", "status": "discard", "started_at": "2026-08-26T17:19:38Z", "ended_at": "2026-08-26T17:24:39Z", "model_family": "MLP", "features": ["speed_mph", "grade_percent", "miles", "prev_speed_mph", "speed_delta", "ke_delta_per_mile", "sinuosity", "prev_grade_percent"], "metrics": {"rmse": 0.007837, "trip_rmse": 0.002453}, "best_before": {"rmse": 0.007811, "trip_rmse": 0.002419}, "delta_pct": {"rmse": 0.333, "trip_rmse": 1.406}, "description": "MAX_EPOCHS 200 -> 600", "hypothesis": "exp9 ran all 200 epochs in 110s of a 400s allowance, so the network may not have converged and the spare budget should buy more fitting", "observation": "both metrics regressed: rmse +0.33% (0.007811 -> 0.007837) and trip_rmse +1.41% (0.002419 -> 0.002453); all 600 epochs completed in 262s so the time cap never bound", "reasoning": "200 epochs was already past the optimum and the extra fitting overfits; trip_rmse degrades four times faster than rmse, which is the exp9 smoothness insight running in reverse \u2014 overtraining makes the fit locally bumpy, and bumpiness is exactly what accumulates when links are summed along a journey", "tags": ["hypertuning", "overfitting", "dead-end"]}
{"exp": 11, "commit": "b28a0ac", "parent_best": "dd8f7e7", "status": "keep", "started_at": "2026-08-26T17:26:07Z", "ended_at": "2026-08-26T17:27:35Z", "model_family": "MLP", "features": ["speed_mph", "grade_percent", "miles", "prev_speed_mph", "speed_delta", "ke_delta_per_mile", "sinuosity", "prev_grade_percent"], "metrics": {"rmse": 0.007736, "trip_rmse": 0.00235}, "best_before": {"rmse": 0.007811, "trip_rmse": 0.002419}, "delta_pct": {"rmse": -0.96, "trip_rmse": -2.852}, "description": "cosine-anneal the learning rate to zero over the 200 epochs", "hypothesis": "a constant lr leaves the weights oscillating around the minimum when the loop stops; annealing to zero should settle them, and per exp10 a settled fit should pay off in trip_rmse more than in link rmse", "observation": "rmse fell 0.96% (0.007811 -> 0.007736) and trip_rmse fell 2.85% (0.002419 -> 0.002350) \u2014 trip moved three times further than link, as predicted", "reasoning": "confirms the smoothness rule from exp9/exp10 as a usable predictor rather than a post-hoc story: this was the first experiment designed from it and the metric split came out in the predicted direction and ratio; optimizer settling is cheap trip_rmse and there is likely more of it available in schedule and averaging tricks", "tags": ["hypertuning", "optimizer", "smoothness"]}
{"exp": 12, "commit": "5508202", "parent_best": "b28a0ac", "status": "discard", "started_at": "2026-08-26T17:28:00Z", "ended_at": "2026-08-26T17:32:23Z", "model_family": "MLP", "features": ["speed_mph", "grade_percent", "miles", "prev_speed_mph", "speed_delta", "ke_delta_per_mile", "sinuosity", "prev_grade_percent"], "metrics": {"rmse": 0.007751, "trip_rmse": 0.002357}, "best_before": {"rmse": 0.007736, "trip_rmse": 0.00235}, "delta_pct": {"rmse": 0.194, "trip_rmse": 0.298}, "description": "MAX_EPOCHS 200 -> 400 under the cosine schedule", "hypothesis": "exp10s longer-training failure was diagnosed as end-of-run oscillation, which the exp11 schedule removes, so the extra epochs should now pay off instead of hurting", "observation": "both metrics still regressed slightly, rmse +0.19% (0.007736 -> 0.007751) and trip_rmse +0.30% (0.002350 -> 0.002357), a much smaller regression than exp10s but the same sign", "reasoning": "the diagnosis was wrong: 200 epochs is a genuine optimum rather than an artifact of the constant learning rate, so this network saturates on the data it has and not on fitting time \u2014 the frontier is capacity, regularization or features, and further training-length experiments are a closed direction", "tags": ["hypertuning", "overfitting", "dead-end"]}
{"exp": 13, "commit": "5291e75", "parent_best": "b28a0ac", "status": "keep", "started_at": "2026-08-26T17:33:01Z", "ended_at": "2026-08-26T17:35:13Z", "model_family": "MLP", "features": ["speed_mph", "grade_percent", "miles", "prev_speed_mph", "ke_delta_per_mile", "sinuosity", "prev_grade_percent"], "metrics": {"rmse": 0.00773, "trip_rmse": 0.002344}, "best_before": {"rmse": 0.007736, "trip_rmse": 0.00235}, "delta_pct": {"rmse": -0.078, "trip_rmse": -0.255}, "description": "drop speed_delta \u2014 a linear layer can form the difference itself", "hypothesis": "speed_delta earned 9.5% for the forest only because axis-aligned splits cannot express a difference; an MLPs first linear layer forms it exactly, so the feature should now be redundant and removable at no cost", "observation": "both metrics improved slightly while a feature was removed: rmse -0.08% (0.007736 -> 0.007730) and trip_rmse -0.26% (0.002350 -> 0.002344)", "reasoning": "a simplification win \u2014 fewer inputs, cheaper inference, better numbers; the lesson generalizes past this one feature: hand-built linear combinations are crutches for axis-aligned models and become dead weight or mild noise under a network, so every remaining tree-era feature deserves the same removal test", "tags": ["simplification", "data-representation", "architecture"]}
{"exp": 14, "commit": "0d09d7f", "parent_best": "5291e75", "status": "discard", "started_at": "2026-08-26T17:35:39Z", "ended_at": "2026-08-26T17:38:05Z", "model_family": "MLP", "features": ["speed_mph", "grade_percent", "miles", "prev_speed_mph", "sinuosity", "prev_grade_percent"], "metrics": {"rmse": 0.007739, "trip_rmse": 0.002353}, "best_before": {"rmse": 0.00773, "trip_rmse": 0.002344}, "delta_pct": {"rmse": 0.116, "trip_rmse": 0.384}, "description": "drop ke_delta_per_mile, testing whether the exp13 removal lesson extends to nonlinear features", "hypothesis": "if hand-built features are crutches an MLP does not need, the physics term should also be removable \u2014 but it is nonlinear in three inputs, so it may be the exception", "observation": "both metrics regressed, rmse +0.12% (0.007730 -> 0.007739) and trip_rmse +0.38% (0.002344 -> 0.002353), the mirror image of exp13", "reasoning": "draws a clean boundary on the exp13 lesson: the network absorbs linear combinations of its inputs for free but does not spontaneously learn (v^2 - v_prev^2)/(2d) from speed, prev_speed and miles, so nonlinear physics terms stay valuable while linear ones become dead weight \u2014 this is the rule for choosing what to hand-engineer from here", "tags": ["simplification", "physics", "feature-engineering"]}
{"exp": 15, "commit": "665761c", "parent_best": "5291e75", "status": "discard", "started_at": "2026-08-26T17:38:49Z", "ended_at": "2026-08-26T17:40:58Z", "model_family": "MLP", "features": ["speed_mph", "grade_percent", "miles", "prev_speed_mph", "ke_delta_per_mile", "sinuosity", "hours_per_mile", "prev_grade_percent"], "metrics": {"rmse": 0.007729, "trip_rmse": 0.002344}, "best_before": {"rmse": 0.00773, "trip_rmse": 0.002344}, "delta_pct": {"rmse": -0.013, "trip_rmse": 0.0}, "description": "add hours_per_mile = 1/speed, the auxiliary-load physics term", "hypothesis": "HVAC and electronics draw constant power so their per-mile cost scales with time per mile, and 1/v is a sharp nonlinearity that ReLU approximates badly near zero, so handing it over explicitly should pay under the exp14 rule", "observation": "a dead tie \u2014 rmse 0.007730 -> 0.007729 and trip_rmse unchanged at 0.002344 \u2014 for one extra input", "reasoning": "refines the exp14 rule: what matters is not nonlinearity as such but whether the term is a nonlinear *interaction across several inputs*; ke_delta_per_mile combines three columns and pays, while 1/v is a one-dimensional warp of a single input that 256 ReLU units reproduce on their own, so single-variable transforms are a closed direction", "tags": ["feature-engineering", "physics", "dead-end"]}
{"exp": 16, "commit": "8afaccc", "parent_best": "5291e75", "status": "discard", "started_at": "2026-08-26T17:41:22Z", "ended_at": "2026-08-26T17:43:39Z", "model_family": "MLP", "features": ["speed_mph", "grade_percent", "miles", "prev_speed_mph", "ke_delta_per_mile", "sinuosity", "prev_grade_percent"], "metrics": {"rmse": 0.007735, "trip_rmse": 0.002358}, "best_before": {"rmse": 0.00773, "trip_rmse": 0.002344}, "delta_pct": {"rmse": 0.065, "trip_rmse": 0.597}, "description": "HIDDEN 256 -> 512", "hypothesis": "exp12 ruled out training time as the limit, leaving capacity as the frontier, so doubling the width should buy accuracy", "observation": "both metrics regressed, rmse +0.06% (0.007730 -> 0.007735) and trip_rmse +0.60% (0.002344 -> 0.002358), with trip again degrading ten times faster than link", "reasoning": "with time (exp12) and width both ruled out, the model is information-limited rather than model-limited, so architecture tuning is a closed direction and feature work is the only frontier left; the lopsided trip damage is the smoothness rule again \u2014 surplus capacity buys bumpiness, which trip_rmse punishes", "tags": ["architecture", "dead-end", "smoothness"]}
