{"exp": 47, "commit": "ddc622b", "parent_best": "08abeef", "status": "discard", "started_at": "2026-08-26T19:24:08Z", "ended_at": "2026-08-26T19:28:22Z", "model_family": "MLP", "features": ["speed_mph", "grade_percent", "miles", "prev_speed_mph", "ke_delta_per_mile", "sinuosity", "junction_turn_degrees", "prev_grade_percent", "prev_miles", "prev_sinuosity", "vertices_per_mile"], "metrics": {"rmse": 0.006824, "trip_rmse": 0.00224}, "best_before": {"rmse": 0.006836, "trip_rmse": 0.002242}, "delta_pct": {"rmse": -0.176, "trip_rmse": -0.089}, "description": "2x160 ensemble instead of 2x128 (Pareto-better but discarded on inference cost)", "hypothesis": "exp46 found a width floor per member, so pushing width up rather than down should buy accuracy while 2x160 still costs less than the original single 256-wide net", "observation": "both metrics improved, rmse -0.18% (0.006836 -> 0.006824) and trip_rmse -0.09% (0.002242 -> 0.002240), for 55,040 multiply-accumulates against the incumbents 35,840", "reasoning": "Pareto-dominant but a 54% cost increase for a 0.18% gain, which is worse value than the exp26 ensemble already rejected at 0.6% for 3x, so consistency requires discarding it; the useful output is the shape of the frontier \u2014 2x128 sits at the knee, with 96 below the width floor and 160 past the point where extra cost stops paying", "tags": ["architecture", "ensembling", "inference-cost"]}
{"exp": 48, "commit": "7820e9d", "parent_best": "08abeef", "status": "discard", "started_at": "2026-08-26T19:29:01Z", "ended_at": "2026-08-26T19:33:26Z", "model_family": "MLP", "features": ["speed_mph", "grade_percent", "miles", "prev_speed_mph", "ke_delta_per_mile", "sinuosity", "junction_turn_degrees", "prev_grade_percent", "prev_miles", "prev_sinuosity", "vertices_per_mile"], "metrics": {"rmse": 0.006845, "trip_rmse": 0.002246}, "best_before": {"rmse": 0.006836, "trip_rmse": 0.002242}, "delta_pct": {"rmse": 0.132, "trip_rmse": 0.178}, "description": "2x112 ensemble, probing where the per-member width floor sits", "hypothesis": "exp46 put the floor somewhere between 96 and 128, so 112 tests whether a further 22% cost saving is available without losing accuracy", "observation": "both metrics regressed, rmse +0.13% (0.006836 -> 0.006845) and trip_rmse +0.18% (0.002242 -> 0.002246), almost exactly matching the 3x96 result", "reasoning": "the floor is at 128 rather than between it and 96, so 2x128 is confirmed as the knee of the cost/accuracy curve with 112 and 96 below it and 160 past it; the cost axis is now fully mapped and settled", "tags": ["architecture", "ensembling", "inference-cost", "dead-end"]}
{"exp": 49, "commit": "59174a6", "parent_best": "08abeef", "status": "keep", "started_at": "2026-08-26T19:33:52Z", "ended_at": "2026-08-26T19:39:40Z", "model_family": "MLP", "features": ["speed_mph", "grade_percent", "miles", "prev_speed_mph", "ke_delta_per_mile", "sinuosity", "junction_turn_degrees", "prev_grade_percent", "prev_miles", "prev_sinuosity", "vertices_per_mile"], "metrics": {"rmse": 0.006828, "trip_rmse": 0.002239}, "best_before": {"rmse": 0.006836, "trip_rmse": 0.002242}, "delta_pct": {"rmse": -0.117, "trip_rmse": -0.134}, "description": "MAX_EPOCHS 200 -> 280 for the narrower ensemble members", "hypothesis": "200 epochs was established as optimal for a single 256-wide net in exp12 and exp42, but a 128-wide member has less capacity and should overfit later, so the optimum ought to move with model size", "observation": "both metrics improved, rmse -0.12% (0.006836 -> 0.006828) and trip_rmse -0.13% (0.002242 -> 0.002239), at no inference cost and 345s of the 600s budget", "reasoning": "reopens a direction that had been closed twice, and the lesson is that exp12 and exp42 established the optimum *for that architecture* rather than for the problem; when exp45 halved the model the setting became stale, so a settled hyperparameter should be re-tested whenever the thing it was tuned against changes \u2014 the same lesson exp31 taught for features, now for hyperparameters", "tags": ["hypertuning", "ensembling"]}
