{"exp": 17, "commit": "f9d1444", "parent_best": "5291e75", "status": "discard", "started_at": "2026-08-26T17:43:56Z", "ended_at": "2026-08-26T17:45:26Z", "model_family": "MLP", "features": ["speed_mph", "grade_percent", "miles", "prev_speed_mph", "ke_delta_per_mile", "sinuosity", "prev_grade_percent"], "metrics": {"rmse": 0.007741, "trip_rmse": 0.002348}, "best_before": {"rmse": 0.00773, "trip_rmse": 0.002344}, "delta_pct": {"rmse": 0.142, "trip_rmse": 0.171}, "description": "HIDDEN 256 -> 128, testing whether a cheaper network holds the metrics", "hypothesis": "if the model is information-limited rather than capacity-limited, halving the width should cost nothing and would be a large inference-cost win under domain.mds competing-objectives clause", "observation": "both metrics regressed slightly and symmetrically, rmse +0.14% (0.007730 -> 0.007741) and trip_rmse +0.17% (0.002344 -> 0.002348)", "reasoning": "256 is a real optimum with 512 (exp16) and 128 both worse either side of it, so width is settled and closed; worth recording that 128 costs only 0.15% for roughly a quarter of the hidden-layer FLOPs, which is the operating point to fall back to if inference cost ever binds in RouteE Compass", "tags": ["architecture", "inference-cost", "dead-end"]}
{"exp": 18, "commit": "37e22d2", "parent_best": "5291e75", "status": "keep", "started_at": "2026-08-26T17:46:23Z", "ended_at": "2026-08-26T17:48:44Z", "model_family": "MLP", "features": ["speed_mph", "grade_percent", "miles", "prev_speed_mph", "ke_delta_per_mile", "sinuosity", "junction_turn_degrees", "prev_grade_percent"], "metrics": {"rmse": 0.007399, "trip_rmse": 0.002308}, "best_before": {"rmse": 0.00773, "trip_rmse": 0.002344}, "delta_pct": {"rmse": -4.282, "trip_rmse": -1.536}, "description": "add junction_turn_degrees, the heading change from the previous links exit into this links entry", "hypothesis": "exp7 killed the turning *inside* a link as subsumed by sinuosity, but the turn *between* links is a different physical event \u2014 an intersection is where a driver actually brakes and reaccelerates \u2014 so it should carry signal sinuosity cannot", "observation": "rmse fell 4.28% (0.007730 -> 0.007399) and trip_rmse fell 1.54% (0.002344 -> 0.002308), the largest feature gain since exp5", "reasoning": "vindicates the exp7 post-mortem: the earlier failure was the wrong turn, not a dead geometry column, and the 3.7-vertex resolution ceiling only limits intra-link shape while junction geometry needs just two headings; it also confirms the exp16 information-limited diagnosis, since the same network that could not use more width immediately used more information", "tags": ["feature-engineering", "geometry", "lookback", "breakthrough"]}
{"exp": 19, "commit": "8660022", "parent_best": "37e22d2", "status": "keep", "started_at": "2026-08-26T17:49:17Z", "ended_at": "2026-08-26T17:51:16Z", "model_family": "MLP", "features": ["speed_mph", "grade_percent", "miles", "prev_speed_mph", "ke_delta_per_mile", "sinuosity", "junction_turn_degrees", "prev_grade_percent", "prev_miles"], "metrics": {"rmse": 0.006954, "trip_rmse": 0.002266}, "best_before": {"rmse": 0.007399, "trip_rmse": 0.002308}, "delta_pct": {"rmse": -6.014, "trip_rmse": -1.82}, "description": "add one-link lookback feature prev_miles", "hypothesis": "a short preceding link means dense urban context with closely spaced intersections, changing how much of this link is spent accelerating away from the last one", "observation": "rmse fell 6.02% (0.007399 -> 0.006954) and trip_rmse fell 1.82% (0.002308 -> 0.002266) \u2014 a larger gain than junction_turn_degrees and the second biggest feature win of the session", "reasoning": "the urban-density story understates it; the better reading is that prev_miles tells the model how much to *trust* prev_speed_mph, because an average speed over a long previous link is a poor estimate of the speed at its end while over a short one it is a good one \u2014 the feature is a confidence weight on the lookback rather than a signal in its own right, which suggests pairing every lookback value with its own reliability context", "tags": ["feature-engineering", "lookback", "breakthrough"]}
{"exp": 20, "commit": "afd7677", "parent_best": "8660022", "status": "discard", "started_at": "2026-08-26T17:51:44Z", "ended_at": "2026-08-26T17:54:07Z", "model_family": "MLP", "features": ["speed_mph", "grade_percent", "miles", "prev_speed_mph", "ke_delta_per_mile", "sinuosity", "junction_turn_degrees", "prev_grade_percent", "prev_miles", "prev_hours"], "metrics": {"rmse": 0.006952, "trip_rmse": 0.002266}, "best_before": {"rmse": 0.006954, "trip_rmse": 0.002266}, "delta_pct": {"rmse": -0.029, "trip_rmse": 0.0}, "description": "add prev_hours = prev_miles / prev_speed_mph, the duration of the previous link", "hypothesis": "if exp19 worked because prev_miles tells the model how stale prev_speed_mph is, then duration is the sharper form of the same idea and should beat it", "observation": "a tie \u2014 rmse 0.006954 -> 0.006952 and trip_rmse unchanged at 0.002266 \u2014 for one more input", "reasoning": "the network forms this two-input ratio on its own once both parts are present, so the exp15 boundary is now firm and general: hand-engineering pays only where the term is hard to *approximate* (ke_delta_per_mile divides a squared difference by a third input), not merely where it is nonlinear; ratios of two existing inputs are a closed direction", "tags": ["feature-engineering", "lookback", "dead-end"]}
{"exp": 21, "commit": "044c161", "parent_best": "8660022", "status": "discard", "started_at": "2026-08-26T17:55:21Z", "ended_at": "2026-08-26T17:57:46Z", "model_family": "MLP", "features": ["speed_mph", "grade_percent", "miles", "prev_speed_mph", "ke_delta_per_mile", "sinuosity", "junction_turn_degrees", "prev_grade_percent", "prev_miles"], "metrics": {"rmse": 0.006956, "trip_rmse": 0.002262}, "best_before": {"rmse": 0.006954, "trip_rmse": 0.002266}, "delta_pct": {"rmse": 0.029, "trip_rmse": -0.177}, "description": "signed junction turn instead of absolute", "hypothesis": "a left turn crosses oncoming traffic and a right turn does not, so handedness should matter; and nothing is lost by keeping the sign since a ReLU pair reconstructs the magnitude", "observation": "the metrics split \u2014 rmse +0.03% (0.006954 -> 0.006956) while trip_rmse fell 0.18% (0.002266 -> 0.002262) \u2014 so it fails the Pareto test despite being strictly more information", "reasoning": "the split is noise-level in both directions, so the honest reading is that handedness carries no usable signal; that makes sense for this data because the target is simulated over real drive-cycle traces, so any waiting at a left turn is already expressed in the traces speed profile and the sign adds nothing beyond what speed_mph and the lookback already say", "tags": ["feature-engineering", "geometry", "dead-end"]}
{"exp": 22, "commit": "dcf3c08", "parent_best": "8660022", "status": "discard", "started_at": "2026-08-26T17:58:40Z", "ended_at": "2026-08-26T18:00:44Z", "model_family": "MLP", "features": ["speed_mph", "grade_percent", "miles", "prev_speed_mph", "ke_delta_per_mile", "sinuosity", "junction_turn_degrees", "prev_grade_percent", "prev_miles"], "metrics": {"rmse": 0.007064, "trip_rmse": 0.002276}, "best_before": {"rmse": 0.006954, "trip_rmse": 0.002266}, "delta_pct": {"rmse": 1.582, "trip_rmse": 0.441}, "description": "weight the training loss by miles^2 to match the trip metric (train rows only; scoring untouched)", "hypothesis": "trip_rmse scores sums of rate*miles, so a links share of trip error goes as miles^2 while plain MSE treats every link alike; aligning the loss with the metric should buy trip_rmse", "observation": "both metrics regressed and trip_rmse got *worse* (+0.44%, 0.002266 -> 0.002276) even though it was the target of the change, with rmse +1.58%", "reasoning": "the miles^2 decomposition assumes link errors within a trip are independent, and they are not \u2014 per the structural insight they largely cancel, so trip error is driven by systematic bias rather than by summed variance, and reweighting shrinks the effective sample without touching the bias; this also rules out predicting energy_gge instead of the rate without testing it, since MSE on rate*miles is exactly this miles^2-weighted loss", "tags": ["loss-shaping", "dead-end", "smoothness"]}
{"exp": 23, "commit": "4fffafa", "parent_best": "8660022", "status": "keep", "started_at": "2026-08-26T18:01:33Z", "ended_at": "2026-08-26T18:04:04Z", "model_family": "MLP", "features": ["speed_mph", "grade_percent", "miles", "prev_speed_mph", "ke_delta_per_mile", "sinuosity", "junction_turn_degrees", "prev_grade_percent", "prev_miles", "prev_sinuosity"], "metrics": {"rmse": 0.006859, "trip_rmse": 0.002252}, "best_before": {"rmse": 0.006954, "trip_rmse": 0.002266}, "delta_pct": {"rmse": -1.366, "trip_rmse": -0.618}, "description": "add prev_sinuosity, the shape of the preceding link", "hypothesis": "a curvy preceding link means the vehicle was already cornering on entry, which bears on how much of prev_speed_mph actually carried through \u2014 the exp19 reliability idea applied to shape", "observation": "rmse fell 1.37% (0.006954 -> 0.006859) and trip_rmse fell 0.62% (0.002266 -> 0.002252)", "reasoning": "the lookback family keeps paying and is now complete \u2014 speed, grade, miles and sinuosity are all shifted, and the junction turn consumes the previous links exit heading, so with a strict one-link limit there is nothing left to shift; further feature gains have to come from a new source rather than from more lookback", "tags": ["feature-engineering", "lookback", "geometry"]}
{"exp": 24, "commit": "39f8526", "parent_best": "4fffafa", "status": "discard", "started_at": "2026-08-26T18:04:36Z", "ended_at": "2026-08-26T18:06:30Z", "model_family": "MLP", "features": ["speed_mph", "grade_percent", "miles", "prev_speed_mph", "ke_delta_per_mile", "sinuosity", "junction_turn_degrees", "prev_grade_percent", "prev_miles", "prev_sinuosity"], "metrics": {"rmse": 0.006884, "trip_rmse": 0.002256}, "best_before": {"rmse": 0.006859, "trip_rmse": 0.002252}, "delta_pct": {"rmse": 0.364, "trip_rmse": 0.178}, "description": "ReLU -> SiLU for a smoother fit", "hypothesis": "a ReLU network is piecewise linear so its fit has kinks, and if local bumpiness is what trip_rmse punishes then a smooth activation should buy trip_rmse more than link rmse", "observation": "both metrics regressed, rmse +0.36% (0.006859 -> 0.006884) and trip_rmse +0.18% (0.002252 -> 0.002256) \u2014 and trip moved *less* than link, the opposite of the predicted signature", "reasoning": "an important correction to the smoothness rule: what mattered in exp9 and exp11 was systematic bias over a *region* of feature space, which is what accumulates when a journeys links are summed, not the analytic smoothness of the fit at a point; ReLU kinks sit far below the scale at which that bias operates, so the rule should be read as about regional bias and not applied to activation choice", "tags": ["architecture", "smoothness", "dead-end"]}
{"exp": 25, "commit": "14026eb", "parent_best": "4fffafa", "status": "discard", "started_at": "2026-08-26T18:06:54Z", "ended_at": "2026-08-26T18:09:53Z", "model_family": "MLP", "features": ["speed_mph", "grade_percent", "miles", "prev_speed_mph", "ke_delta_per_mile", "sinuosity", "junction_turn_degrees", "prev_grade_percent", "prev_miles", "prev_sinuosity"], "metrics": {"rmse": 0.006951, "trip_rmse": 0.00227}, "best_before": {"rmse": 0.006859, "trip_rmse": 0.002252}, "delta_pct": {"rmse": 1.341, "trip_rmse": 0.799}, "description": "add a third hidden layer", "hypothesis": "width is settled either side of 256 but depth was never tested, and depth changes the inductive bias rather than just the parameter count", "observation": "both metrics regressed, rmse +1.34% (0.006859 -> 0.006951) and trip_rmse +0.80% (0.002252 -> 0.002270)", "reasoning": "depth joins width and training length as closed, so the architecture is fully settled at 2x256 ReLU and every remaining knob on the model itself has now been tested and rejected; with guesswork exhausted the next move should be diagnostic \u2014 find where the residual error actually concentrates rather than proposing more features blind", "tags": ["architecture", "dead-end"]}
{"exp": 26, "commit": "96f4bfc", "parent_best": "4fffafa", "status": "discard", "started_at": "2026-08-26T18:14:19Z", "ended_at": "2026-08-26T18:20:26Z", "model_family": "MLP", "features": ["speed_mph", "grade_percent", "miles", "prev_speed_mph", "ke_delta_per_mile", "sinuosity", "junction_turn_degrees", "prev_grade_percent", "prev_miles", "prev_sinuosity"], "metrics": {"rmse": 0.006822, "trip_rmse": 0.002235}, "best_before": {"rmse": 0.006859, "trip_rmse": 0.002252}, "delta_pct": {"rmse": -0.539, "trip_rmse": -0.755}, "description": "average an ensemble of 3 independently fit MLPs (Pareto-better but discarded on inference cost)", "hypothesis": "the exp25 diagnostic found no systematic bias left in feature space, so the remaining error is fitting variance plus irreducible noise, and averaging independent fits attacks the variance part", "observation": "both metrics improved \u2014 rmse -0.54% (0.006859 -> 0.006822) and trip_rmse -0.75% (0.002252 -> 0.002235) \u2014 for 3x the inference cost and a 363s run", "reasoning": "discarded on the same inference-cost grounds as exp2, since energy is evaluated at every link traversal in a shortest-path search and tripling that for 0.6% is a poor trade; the scientifically important part is how *small* the gain was \u2014 if fitting variance were a real share of the remaining error, averaging three fits would have bought far more than 0.6%, so this confirms the model is close to the information ceiling available under the one-link-lookback inference constraints", "tags": ["architecture", "inference-cost", "ensembling"]}
{"exp": 27, "commit": "3c5b23a", "parent_best": "4fffafa", "status": "discard", "started_at": "2026-08-26T18:21:30Z", "ended_at": "2026-08-26T18:25:42Z", "model_family": "MLP", "features": ["speed_mph", "grade_percent", "miles", "prev_speed_mph", "ke_delta_per_mile", "sinuosity", "junction_turn_degrees", "prev_grade_percent", "prev_miles", "prev_sinuosity"], "metrics": {"rmse": 0.006886, "trip_rmse": 0.002249}, "best_before": {"rmse": 0.006859, "trip_rmse": 0.002252}, "delta_pct": {"rmse": 0.394, "trip_rmse": -0.133}, "description": "BATCH_SIZE 8192 -> 4096", "hypothesis": "8192 is a large batch for 1.3M rows and smaller batches carry more gradient noise, which acts as implicit regularization and often generalizes better", "observation": "the metrics split \u2014 rmse +0.39% (0.006859 -> 0.006886) against trip_rmse -0.13% (0.002252 -> 0.002249) \u2014 and the run took 249s against 148s", "reasoning": "fails the Pareto test, and the direction of the split is the informative part: extra gradient noise slightly helped the trip metric while hurting link accuracy, which fits the pattern that the two metrics respond to different things rather than to overall fit quality", "tags": ["hypertuning", "optimizer", "dead-end"]}
{"exp": 28, "commit": "64076da", "parent_best": "4fffafa", "status": "discard", "started_at": "2026-08-26T18:25:58Z", "ended_at": "2026-08-26T18:27:31Z", "model_family": "MLP", "features": ["speed_mph", "grade_percent", "miles", "prev_speed_mph", "ke_delta_per_mile", "sinuosity", "junction_turn_degrees", "prev_grade_percent", "prev_miles", "prev_sinuosity"], "metrics": {"rmse": 0.006871, "trip_rmse": 0.002248}, "best_before": {"rmse": 0.006859, "trip_rmse": 0.002252}, "delta_pct": {"rmse": 0.175, "trip_rmse": -0.178}, "description": "BATCH_SIZE 8192 -> 16384", "hypothesis": "exp27 showed smaller batches hurt link rmse, so the gradient-noise argument runs the other way and a larger batch giving a cleaner gradient should help it", "observation": "the metrics split in the same shape as exp27 \u2014 rmse +0.17% (0.006859 -> 0.006871) against trip_rmse -0.18% (0.002252 -> 0.002248) \u2014 despite moving the batch size in the opposite direction", "reasoning": "both directions hurt link rmse, so 8192 is a genuine optimum and batch size is closed; that both directions nudged trip_rmse down by a similar sliver says those trip movements are at the resolution floor of the metric rather than a real response, and is a caution against reading sub-0.2% trip changes as signal", "tags": ["hypertuning", "optimizer", "dead-end"]}
{"exp": 29, "commit": "058816f", "parent_best": "4fffafa", "status": "discard", "started_at": "2026-08-26T18:27:50Z", "ended_at": "2026-08-26T18:30:20Z", "model_family": "MLP", "features": ["speed_mph", "grade_percent", "miles", "prev_speed_mph", "ke_delta_per_mile", "sinuosity", "junction_turn_degrees", "prev_grade_percent", "prev_miles", "prev_sinuosity"], "metrics": {"rmse": 0.006877, "trip_rmse": 0.00225}, "best_before": {"rmse": 0.006859, "trip_rmse": 0.002252}, "delta_pct": {"rmse": 0.262, "trip_rmse": -0.089}, "description": "LEARNING_RATE 1e-3 -> 2e-3", "hypothesis": "batch size is settled but the learning rate it pairs with was never tuned, and a larger step under the cosine schedule may reach a better basin", "observation": "the metrics split in the same shape yet again \u2014 rmse +0.26% (0.006859 -> 0.006877) against trip_rmse -0.09% (0.002252 -> 0.002250)", "reasoning": "three optimizer knobs in four experiments (batch down, batch up, lr up) all produced the same signature of slightly worse link rmse and a sliver better trip_rmse, so the current settings sit at a local optimum and optimizer tuning is closed as a direction; combined with architecture being closed at exp25, everything except information is now exhausted", "tags": ["hypertuning", "optimizer", "dead-end"]}
{"exp": 30, "commit": "9ff5e20", "parent_best": "4fffafa", "status": "keep", "started_at": "2026-08-26T18:30:53Z", "ended_at": "2026-08-26T18:33:08Z", "model_family": "MLP", "features": ["speed_mph", "grade_percent", "miles", "prev_speed_mph", "ke_delta_per_mile", "sinuosity", "junction_turn_degrees", "prev_grade_percent", "prev_miles", "prev_sinuosity", "vertices_per_mile"], "metrics": {"rmse": 0.006837, "trip_rmse": 0.002248}, "best_before": {"rmse": 0.006859, "trip_rmse": 0.002252}, "delta_pct": {"rmse": -0.321, "trip_rmse": -0.178}, "description": "add vertices_per_mile, how finely the road geometry is drawn", "hypothesis": "sinuosity is a length ratio while vertex density is a different statistic that stands in for road class, and the exp25 diagnostic put 46% of the remaining error below 23 mph where urban-versus-highway character matters most", "observation": "both metrics improved, rmse -0.32% (0.006859 -> 0.006837) and trip_rmse -0.18% (0.002252 -> 0.002248)", "reasoning": "modest but a genuine keep, and it matters more as evidence than as a gain: after five straight architecture and optimizer failures, the first thing to work again was new information, confirming the information-limited diagnosis holds even this late; it also shows the geometry column was not exhausted by sinuosity, since a second statistic over the same vertices still had something to add", "tags": ["feature-engineering", "geometry"]}
{"exp": 31, "commit": "0a5ad2d", "parent_best": "9ff5e20", "status": "discard", "started_at": "2026-08-26T18:33:32Z", "ended_at": "2026-08-26T18:35:54Z", "model_family": "MLP", "features": ["speed_mph", "grade_percent", "miles", "prev_speed_mph", "ke_delta_per_mile", "sinuosity", "junction_turn_degrees", "prev_miles", "prev_sinuosity", "vertices_per_mile"], "metrics": {"rmse": 0.006857, "trip_rmse": 0.002253}, "best_before": {"rmse": 0.006837, "trip_rmse": 0.002248}, "delta_pct": {"rmse": 0.293, "trip_rmse": 0.222}, "description": "drop prev_grade_percent, a tree-era feature originally kept on a 0.16% gain", "hypothesis": "prev_grade_percent was added under the RandomForest for a marginal 0.16% and the model family has changed twice since, so it may now be dead weight like speed_delta was in exp13", "observation": "both metrics regressed, rmse +0.29% (0.006837 -> 0.006857) and trip_rmse +0.22% (0.002248 -> 0.002253) \u2014 it is worth roughly twice as much now as when it was added", "reasoning": "a feature that was marginal under the forest became clearly worthwhile under the network, the opposite trajectory to speed_delta; entry grade only pays once the model can combine it smoothly with the rest of the lookback, so marginal keeps should be re-tested rather than pruned after a family change \u2014 value moves in both directions", "tags": ["simplification", "lookback", "feature-engineering"]}
