{"exp": 13, "commit": "befc1d2", "parent_best": "f70b745", "status": "keep", "started_at": "2026-09-01T00:57:36Z", "ended_at": "2026-09-01T01:03:47Z", "model_family": "PhysicsMLP", "features": ["speed_mph", "prev_speed_mph", "next_speed_mph", "prev_miles", "next_miles", "prev2_speed_mph", "next2_speed_mph", "prev_grade_percent", "grade_percent", "miles"], "metrics": {"rmse": 0.006478, "trip_rmse": 0.002218, "physics_pass": 1.0, "physics_violation_rate": 0.0, "long_link_violation_rate": 0.0, "length_invariance": 0.134359}, "best_before": {"rmse": 0.006488, "trip_rmse": 0.002238, "physics_pass": 1.0, "physics_violation_rate": 0.0, "long_link_violation_rate": 0.0, "length_invariance": 0.056387}, "delta_pct": {"rmse": -0.15, "trip_rmse": -0.89, "physics_pass": 0.0, "physics_violation_rate": 0.0, "long_link_violation_rate": 0.0, "length_invariance": 138.28}, "description": "add prev_grade_percent (the terrain behind the vehicle)", "hypothesis": "the current link's grade is structural and cannot enter the heads, but the previous link's grade can, and it says whether the vehicle arrived carrying momentum off a descent - information the neighbour speeds average away", "observation": "rmse -0.15% but trip_rmse -0.89%, six times the link-level gain; the unguided tree measured prev_grade at roughly zero", "reasoning": "the lopsided split is the signature of removing systematic bias rather than adding information: terrain is spatially correlated, so a whole trip through hills was being biased the same direction on every link, and correcting that shows up at trip level - which is also why the unguided tree, scoring an unstructured rate, could not find it", "tags": ["feature-engineering", "trip-context"]}
{"exp": 14, "commit": "57a01d3", "parent_best": "befc1d2", "status": "discard", "started_at": "2026-09-01T01:04:08Z", "ended_at": "2026-09-01T01:11:09Z", "model_family": "PhysicsMLP", "features": ["speed_mph", "prev_speed_mph", "next_speed_mph", "prev_miles", "next_miles", "prev2_speed_mph", "next2_speed_mph", "prev_grade_percent", "next_grade_percent", "grade_percent", "miles"], "metrics": {"rmse": 0.00648, "trip_rmse": 0.002218, "physics_pass": 1.0, "physics_violation_rate": 0.0, "long_link_violation_rate": 0.0, "length_invariance": 0.060994}, "best_before": {"rmse": 0.006478, "trip_rmse": 0.002218, "physics_pass": 1.0, "physics_violation_rate": 0.0, "long_link_violation_rate": 0.0, "length_invariance": 0.134359}, "delta_pct": {"rmse": 0.03, "trip_rmse": 0.0, "physics_pass": 0.0, "physics_violation_rate": 0.0, "long_link_violation_rate": 0.0, "length_invariance": -54.6}, "description": "add next_grade_percent (the terrain ahead)", "hypothesis": "the exit-side analogue of prev_grade_percent, which was worth -0.89% trip_rmse one experiment earlier", "observation": "an exact tie on trip_rmse and 0.03% worse on rmse - the first paired feature this session where the exit side was worth nothing at all rather than a third of the entry side", "reasoning": "grade breaks the entry/exit symmetry that speed and length both follow, and the asymmetry is causal: the terrain behind determines the momentum the vehicle actually arrives with, while the terrain ahead only matters through the exit speed, which next_speed_mph and next2_speed_mph already state directly", "tags": ["feature-engineering", "dead-end"]}
{"exp": 15, "commit": "e5afb12", "parent_best": "befc1d2", "status": "discard", "started_at": "2026-09-01T01:11:28Z", "ended_at": "2026-09-01T01:19:07Z", "model_family": "PhysicsMLP", "features": ["speed_mph", "prev_speed_mph", "next_speed_mph", "prev_miles", "next_miles", "prev2_speed_mph", "next2_speed_mph", "prev_grade_percent", "grade_percent", "miles"], "metrics": {"rmse": 0.00653, "trip_rmse": 0.002204, "physics_pass": 1.0, "physics_violation_rate": 0.0, "long_link_violation_rate": 0.0, "length_invariance": 1.224864}, "best_before": {"rmse": 0.006478, "trip_rmse": 0.002218, "physics_pass": 1.0, "physics_violation_rate": 0.0, "long_link_violation_rate": 0.0, "length_invariance": 0.134359}, "delta_pct": {"rmse": 0.8, "trip_rmse": -0.63, "physics_pass": 0.0, "physics_violation_rate": 0.0, "long_link_violation_rate": 0.0, "length_invariance": 811.7}, "description": "widen the network 128 -> 256", "hypothesis": "nine network inputs against 128 hidden units, and the sibling tree found 256 optimal at eleven features, so the model may be capacity-limited", "observation": "rmse +0.8% and trip_rmse -0.6%, the exact split the unguided tree reported for every capacity increase it tried; length_invariance jumped an order of magnitude to 1.22", "reasoning": "capacity past its optimum chases per-link noise, which the equally-weighted rmse punishes and the mileage-weighted trip_rmse averages away; the length_invariance jump is the mechanism made visible - the wider net spent its extra capacity making the fixed cost T vary more sharply, which is exactly per-link noise-fitting", "tags": ["architecture", "dead-end"]}
{"exp": 16, "commit": "aaa4cba", "parent_best": "befc1d2", "status": "discard", "started_at": "2026-09-01T01:19:34Z", "ended_at": "2026-09-01T01:21:15Z", "model_family": "PhysicsMLP", "features": ["speed_mph", "prev_speed_mph", "next_speed_mph", "prev_miles", "next_miles", "prev2_speed_mph", "next2_speed_mph", "prev_grade_percent", "grade_percent", "miles"], "metrics": {"rmse": 0.006508, "trip_rmse": 0.002247, "physics_pass": 1.0, "physics_violation_rate": 0.0, "long_link_violation_rate": 0.0, "length_invariance": 0.511776}, "best_before": {"rmse": 0.006478, "trip_rmse": 0.002218, "physics_pass": 1.0, "physics_violation_rate": 0.0, "long_link_violation_rate": 0.0, "length_invariance": 0.134359}, "delta_pct": {"rmse": 0.46, "trip_rmse": 1.31, "physics_pass": 0.0, "physics_violation_rate": 0.0, "long_link_violation_rate": 0.0, "length_invariance": 280.9}, "description": "halve the epoch budget 300 -> 150", "hypothesis": "run for half the epochs to find out whether the fit is converged, and if it is, spend the freed budget on a second ensemble member - ensembling is free in this tree because inference cost is not an objective here", "observation": "both metrics regressed (rmse +0.5%, trip_rmse +1.3%), so 300 epochs is not slack; separately the run took 98s where identical code took 429s at exp12, a 2.4x swing in machine load", "reasoning": "the ensemble plan dies on the load variance rather than on the metrics - two 300-epoch members would fit comfortably at the fast end and truncate against TRAIN_SECONDS_CAP at the slow end, making the result depend on who else is using the GPU; a single model is the only reproducible option, and the epoch count stays where it is", "tags": ["hypertuning", "dead-end", "protocol"]}
{"exp": 17, "commit": "8934f3f", "parent_best": "befc1d2", "status": "keep", "started_at": "2026-09-01T01:22:07Z", "ended_at": "2026-09-01T01:29:22Z", "model_family": "PhysicsMLP", "features": ["speed_mph", "prev_speed_mph", "next_speed_mph", "prev_miles", "next_miles", "prev2_speed_mph", "next2_speed_mph", "prev_grade_percent", "entry_kinetic_gge", "grade_percent", "miles"], "metrics": {"rmse": 0.006466, "trip_rmse": 0.002215, "physics_pass": 1.0, "physics_violation_rate": 0.0, "long_link_violation_rate": 0.0, "length_invariance": 0.498236}, "best_before": {"rmse": 0.006478, "trip_rmse": 0.002218, "physics_pass": 1.0, "physics_violation_rate": 0.0, "long_link_violation_rate": 0.0, "length_invariance": 0.134359}, "delta_pct": {"rmse": -0.19, "trip_rmse": -0.14, "physics_pass": 0.0, "physics_violation_rate": 0.0, "long_link_violation_rate": 0.0, "length_invariance": 270.8}, "description": "add entry_kinetic_gge (signed kinetic work of entering the link)", "hypothesis": "the sibling rule is to hand-engineer only what the network cannot cheaply approximate; the structure already divides a fixed energy by distance, but squaring a speed is not free, so the difference of squares should be given directly", "observation": "rmse -0.19% and trip_rmse -0.14%, a weak Pareto win", "reasoning": "kept but marginal - far smaller than the same feature was worth in the sibling trees, because there it also carried the division by distance that made it hard; here the structure already performs that division, so all that is left is the squaring, and a 128-unit ReLU net approximates a square well enough that handing it over is worth almost nothing", "tags": ["feature-engineering", "marginal"]}
{"exp": 18, "commit": "a32fc1e", "parent_best": "8934f3f", "status": "keep", "started_at": "2026-09-01T01:30:08Z", "ended_at": "2026-09-01T01:37:12Z", "model_family": "PhysicsMLP", "features": ["speed_mph", "prev_speed_mph", "next_speed_mph", "prev_miles", "next_miles", "prev2_speed_mph", "next2_speed_mph", "prev_grade_percent", "entry_kinetic_gge", "sinuosity", "grade_percent", "miles"], "metrics": {"rmse": 0.006346, "trip_rmse": 0.002166, "physics_pass": 1.0, "physics_violation_rate": 0.0, "long_link_violation_rate": 0.0, "length_invariance": 0.148062}, "best_before": {"rmse": 0.006466, "trip_rmse": 0.002215, "physics_pass": 1.0, "physics_violation_rate": 0.0, "long_link_violation_rate": 0.0, "length_invariance": 0.498236}, "delta_pct": {"rmse": -1.86, "trip_rmse": -2.21, "physics_pass": 0.0, "physics_violation_rate": 0.0, "long_link_violation_rate": 0.0, "length_invariance": -70.28}, "description": "add sinuosity (path length over straight-line endpoint distance)", "hypothesis": "the domain-guided tree got -1.3% on both metrics from sinuosity, and a winding link makes the vehicle corner, which is speed variation the link average hides - exactly what the transient heads are for", "observation": "rmse -1.9% and trip_rmse -2.2%, larger than in the sibling tree and the biggest feature gain since exp9", "reasoning": "worth more here than there because the structure gives it somewhere specific to go - cornering is kinetic energy given up and recovered, which is now a signed term rather than something to be absorbed into a general-purpose rate; note the sweep has no geometry column, so predict() supplies sinuosity 1.0, which is correct because a synthetic link is straight", "tags": ["feature-engineering", "geometry"]}
{"exp": 19, "commit": "b9df6ca", "parent_best": "a32fc1e", "status": "keep", "started_at": "2026-09-01T01:46:02Z", "ended_at": "2026-09-01T01:53:10Z", "model_family": "PhysicsMLP", "features": ["speed_mph", "prev_speed_mph", "next_speed_mph", "prev_miles", "next_miles", "prev2_speed_mph", "next2_speed_mph", "prev_grade_percent", "entry_kinetic_gge", "sinuosity", "junction_turn_degrees", "grade_percent", "miles"], "metrics": {"rmse": 0.006278, "trip_rmse": 0.002161, "physics_pass": 1.0, "physics_violation_rate": 0.0, "long_link_violation_rate": 0.0, "length_invariance": 0.416988}, "best_before": {"rmse": 0.006346, "trip_rmse": 0.002166, "physics_pass": 1.0, "physics_violation_rate": 0.0, "long_link_violation_rate": 0.0, "length_invariance": 0.148062}, "delta_pct": {"rmse": -1.07, "trip_rmse": -0.23, "physics_pass": 0.0, "physics_violation_rate": 0.0, "long_link_violation_rate": 0.0, "length_invariance": 181.6}, "description": "add junction_turn_degrees (the turn into the link)", "hypothesis": "the heading change from the previous link's exit segment into this link's entry segment was worth -4.3% rmse in the domain-guided tree, and a sharp turn is a deceleration no link average shows", "observation": "rmse -1.1% and trip_rmse -0.2%; the first run also revealed that decoding the geometry twice had pushed training into its time cap, so the decode was made once-per-frame and the experiment re-run - identical metrics, 47s recovered", "reasoning": "a quarter of what it was worth in the sibling tree, and the reason is that this model already has both neighbour speeds and both neighbour lengths, so most of what a turn implies about the speed profile is already stated; the run-time lesson is separate and worth keeping - a feature's decode cost competes with the training budget, so shared preprocessing has to be shared in fact and not just in intent", "tags": ["feature-engineering", "geometry", "protocol"]}
{"exp": 20, "commit": "438336b", "parent_best": "b9df6ca", "status": "discard", "started_at": "2026-09-01T01:54:56Z", "ended_at": "2026-09-01T02:02:42Z", "model_family": "PhysicsMLP", "features": ["speed_mph", "prev_speed_mph", "next_speed_mph", "prev_miles", "next_miles", "prev2_speed_mph", "next2_speed_mph", "prev_grade_percent", "entry_kinetic_gge", "sinuosity", "junction_turn_degrees", "grade_percent", "miles"], "metrics": {"rmse": 0.006284, "trip_rmse": 0.002149, "physics_pass": 1.0, "physics_violation_rate": 0.0, "long_link_violation_rate": 0.0, "length_invariance": 0.478644}, "best_before": {"rmse": 0.006278, "trip_rmse": 0.002161, "physics_pass": 1.0, "physics_violation_rate": 0.0, "long_link_violation_rate": 0.0, "length_invariance": 0.416988}, "delta_pct": {"rmse": 0.1, "trip_rmse": -0.56, "physics_pass": 0.0, "physics_violation_rate": 0.0, "long_link_violation_rate": 0.0, "length_invariance": 14.79}, "description": "raise the learning rate 1e-3 -> 2e-3", "hypothesis": "the learning rate has never been touched and both sibling trees found it mattered; with cosine annealing to zero a larger initial step may reach a better basin within the same 300 epochs", "observation": "rmse +0.10% and trip_rmse -0.56% - the same trade the width increase produced at exp15, in the same direction and roughly the same ratio", "reasoning": "step size behaves like capacity in this model, which closes the size axis without a third run: width up and learning rate up both buy trip_rmse with rmse, so 128 units at 1e-3 is the Pareto knee and narrowing or slowing would only make the same trade in reverse; note this is the opposite of the unguided tree, where raising the tree learning rate at fixed rounds went the other way", "tags": ["hypertuning", "dead-end"]}
{"exp": 21, "commit": "dd7abad", "parent_best": "b9df6ca", "status": "discard", "started_at": "2026-09-01T02:03:10Z", "ended_at": "2026-09-01T02:11:04Z", "model_family": "PhysicsMLP", "features": ["speed_mph", "prev_speed_mph", "next_speed_mph", "prev_miles", "next_miles", "prev2_speed_mph", "next2_speed_mph", "prev_grade_percent", "entry_kinetic_gge", "sinuosity", "junction_turn_degrees", "grade_percent", "miles"], "metrics": {"rmse": 0.0063, "trip_rmse": 0.002136, "physics_pass": 1.0, "physics_violation_rate": 0.0, "long_link_violation_rate": 0.0, "length_invariance": 0.334494}, "best_before": {"rmse": 0.006278, "trip_rmse": 0.002161, "physics_pass": 1.0, "physics_violation_rate": 0.0, "long_link_violation_rate": 0.0, "length_invariance": 0.416988}, "delta_pct": {"rmse": 0.35, "trip_rmse": -1.16, "physics_pass": 0.0, "physics_violation_rate": 0.0, "long_link_violation_rate": 0.0, "length_invariance": -19.79}, "description": "a third hidden layer", "hypothesis": "depth is an inductive-bias change rather than a size change, so it may not reproduce the trade that width and learning rate both produced", "observation": "it reproduced it exactly - rmse +0.35%, trip_rmse -1.16% - and trip_rmse has now improved monotonically across all three capacity-shaped changes (0.002161 -> 0.002149 -> 0.002136) while rmse worsened each time", "reasoning": "three different knobs giving one signature is a mechanism, not a coincidence: extra capacity reduces regional bias, which trip_rmse rewards, while fitting per-link noise, which rmse punishes; the fix implied is variance reduction without added bias, i.e. averaging - and that can be tested at constant compute by splitting the epoch budget across two members instead of buying more capacity", "tags": ["architecture", "dead-end"]}
{"exp": 22, "commit": "02ad218", "parent_best": "b9df6ca", "status": "discard", "started_at": "2026-09-01T02:11:49Z", "ended_at": "2026-09-01T02:19:43Z", "model_family": "PhysicsMLP", "features": ["speed_mph", "prev_speed_mph", "next_speed_mph", "prev_miles", "next_miles", "prev2_speed_mph", "next2_speed_mph", "prev_grade_percent", "entry_kinetic_gge", "sinuosity", "junction_turn_degrees", "grade_percent", "miles"], "metrics": {"rmse": 0.00627, "trip_rmse": 0.002171, "physics_pass": 1.0, "physics_violation_rate": 0.0, "long_link_violation_rate": 0.0, "length_invariance": 0.453474}, "best_before": {"rmse": 0.006278, "trip_rmse": 0.002161, "physics_pass": 1.0, "physics_violation_rate": 0.0, "long_link_violation_rate": 0.0, "length_invariance": 0.416988}, "delta_pct": {"rmse": -0.13, "trip_rmse": 0.46, "physics_pass": 0.0, "physics_violation_rate": 0.0, "long_link_violation_rate": 0.0, "length_invariance": 8.75}, "description": "average 2 members at half the epochs each (constant compute)", "hypothesis": "three capacity-shaped changes all bought trip_rmse with rmse, which says the limit is variance on one metric and bias on the other; averaging cuts variance without adding bias, and it can be paid for at constant compute by halving the epochs per member - worth noting every physics check is a linear inequality in the prediction, so an average of legal models is legal", "observation": "the trade reversed - rmse -0.13% and trip_rmse +0.46% - which is exactly what exp16 predicted for half-length training", "reasoning": "this brackets the frontier from the other side: adding capacity buys trip_rmse with rmse, and cutting convergence buys rmse with trip_rmse, so the current single 300-epoch 128-unit model sits on the knee and no reallocation of the same compute improves both; a joint win now has to come from information or structure, not from tuning", "tags": ["architecture", "dead-end", "ensembling"]}
{"exp": 23, "commit": "e007655", "parent_best": "b9df6ca", "status": "keep", "started_at": "2026-09-01T02:20:47Z", "ended_at": "2026-09-01T02:28:40Z", "model_family": "PhysicsMLP", "features": ["speed_mph", "prev_speed_mph", "next_speed_mph", "prev_miles", "next_miles", "prev2_speed_mph", "next2_speed_mph", "prev_grade_percent", "entry_kinetic_gge", "sinuosity", "junction_turn_degrees", "prev_sinuosity", "grade_percent", "miles"], "metrics": {"rmse": 0.006246, "trip_rmse": 0.002153, "physics_pass": 1.0, "physics_violation_rate": 0.0, "long_link_violation_rate": 0.0, "length_invariance": 0.544715}, "best_before": {"rmse": 0.006278, "trip_rmse": 0.002161, "physics_pass": 1.0, "physics_violation_rate": 0.0, "long_link_violation_rate": 0.0, "length_invariance": 0.416988}, "delta_pct": {"rmse": -0.51, "trip_rmse": -0.37, "physics_pass": 0.0, "physics_violation_rate": 0.0, "long_link_violation_rate": 0.0, "length_invariance": 30.63}, "description": "add prev_sinuosity (the shape of the road behind)", "hypothesis": "sinuosity was the best feature since exp9, and the entry side has beaten the exit side for every paired feature, so the previous link's shape should carry the same kind of signal - a winding approach means the vehicle arrives having already given up speed to corner", "observation": "rmse -0.51% and trip_rmse -0.37%, both real; run time 469s against a 470s training cap", "reasoning": "a quarter of what the link's own sinuosity was worth, which is the usual entry-side ratio, so the geometry family is behaving like the speed and length families; separately the run time is now brushing the cap and needs watching before a truncated run is mistaken for a bad idea", "tags": ["feature-engineering", "geometry"]}
{"exp": 24, "commit": "2ca2121", "parent_best": "e007655", "status": "discard", "started_at": "2026-09-01T02:29:23Z", "ended_at": "2026-09-01T02:37:17Z", "model_family": "PhysicsMLP", "features": ["speed_mph", "prev_speed_mph", "next_speed_mph", "prev_miles", "next_miles", "prev2_speed_mph", "next2_speed_mph", "prev_grade_percent", "entry_kinetic_gge", "sinuosity", "junction_turn_degrees", "prev_sinuosity", "next_junction_turn_degrees", "grade_percent", "miles"], "metrics": {"rmse": 0.006213, "trip_rmse": 0.002149, "physics_pass": 0.0, "physics_violation_rate": 0.001786, "long_link_violation_rate": 0.0, "length_invariance": 1.235567}, "best_before": {"rmse": 0.006246, "trip_rmse": 0.002153, "physics_pass": 1.0, "physics_violation_rate": 0.0, "long_link_violation_rate": 0.0, "length_invariance": 0.544715}, "delta_pct": {"rmse": -0.53, "trip_rmse": -0.19, "physics_pass": -100.0, "physics_violation_rate": null, "long_link_violation_rate": 0.0, "length_invariance": 126.8}, "description": "add next_junction_turn_degrees (the turn waiting at the link's end)", "hypothesis": "the turn recorded against the next link is the turn at the end of this one, and braking for it happens during this link and is billed to it", "observation": "both metrics improved (-0.53% / -0.19%) but physics_pass went to 0.0 - flat_energy_positive failed on 2.9% of cases, worst -1.3e-05 GGE on a 0.01 mi link at 20 mph, all of it at short distances", "reasoning": "the feature is not the culprit; it exposed a latent defect introduced at exp10. Widening the release gate to max(ke(prev), ke(v)) - ke(next) broke the invariant the whole guarantee rests on: under the 0-fill convention a synthetic sweep link has prev = next = 0, so the widened gate evaluates to ke(v) rather than zero, and the model has been free to predict negative flat-ground energy since exp10 without happening to do so. A discard under rule 1, and the defect is fixed next rather than the feature abandoned", "tags": ["feature-engineering", "physics", "regression"]}
