{"exp": 32, "commit": "4dd2ca7", "parent_best": "9ff5e20", "status": "discard", "started_at": "2026-08-26T18:36:27Z", "ended_at": "2026-08-26T18:38:58Z", "model_family": "MLP", "features": ["speed_mph", "grade_percent", "miles", "prev_speed_mph", "ke_delta_per_mile", "sinuosity", "junction_turn_degrees", "prev_grade_percent", "prev_miles", "prev_sinuosity", "vertices_per_mile", "corner_energy_per_mile"], "metrics": {"rmse": 0.006847, "trip_rmse": 0.002247}, "best_before": {"rmse": 0.006837, "trip_rmse": 0.002248}, "delta_pct": {"rmse": 0.146, "trip_rmse": -0.044}, "description": "add corner_energy_per_mile = v^2 * turn / miles, the junction braking term", "hypothesis": "the speed a driver sheds into a turn and rebuilds out of it scales with v^2 and turn sharpness spread over the link, giving the same three-input nonlinear shape as ke_delta_per_mile \u2014 the one feature form that has kept paying", "observation": "the metrics split, rmse +0.15% (0.006837 -> 0.006847) against trip_rmse -0.04% (0.002248 -> 0.002247)", "reasoning": "the three-input nonlinear *shape* is not itself what made ke_delta_per_mile valuable \u2014 that term works because it is the dominant physics of the target, not because of its functional form; copying the form onto a secondary effect gains nothing, so the exp14 rule is necessary but not sufficient and physical importance has to come first", "tags": ["feature-engineering", "physics", "dead-end"]}
{"exp": 33, "commit": "dff8dbb", "parent_best": "9ff5e20", "status": "discard", "started_at": "2026-08-26T18:39:52Z", "ended_at": "2026-08-26T18:42:16Z", "model_family": "MLP", "features": ["speed_mph", "grade_percent", "miles", "prev_speed_mph", "ke_delta_per_mile", "sinuosity", "junction_turn_degrees", "prev_grade_percent", "prev_miles", "prev_sinuosity", "vertices_per_mile"], "metrics": {"rmse": 0.00685, "trip_rmse": 0.002251}, "best_before": {"rmse": 0.006837, "trip_rmse": 0.002248}, "delta_pct": {"rmse": 0.19, "trip_rmse": 0.133}, "description": "signed-log compress ke_delta_per_mile to fix its conditioning", "hypothesis": "the raw term spans several orders of magnitude so standardizing it sets the scale from rare outliers and squashes typical values against zero; a signed log keeps ordering and sign while giving the network a resolvable input", "observation": "both metrics regressed, rmse +0.19% (0.006837 -> 0.006850) and trip_rmse +0.13% (0.002248 -> 0.002251)", "reasoning": "the conditioning argument was wrong because it ignored what the tail means: a large speed change over a very short link genuinely is a large energy rate, so the raw term is close to linear in the target and compressing it destroys exactly that relationship; with a heavy-tailed target, matching the targets own scale behaviour beats making the input well-conditioned", "tags": ["data-representation", "dead-end"]}
{"exp": 34, "commit": "ae58ae8", "parent_best": "9ff5e20", "status": "discard", "started_at": "2026-08-26T18:42:49Z", "ended_at": "2026-08-26T18:45:42Z", "model_family": "MLP", "features": ["speed_mph", "grade_percent", "miles", "prev_speed_mph", "ke_delta_per_mile", "sinuosity", "junction_turn_degrees", "prev_grade_percent", "prev_miles", "prev_sinuosity", "vertices_per_mile"], "metrics": {"rmse": 0.006841, "trip_rmse": 0.002246}, "best_before": {"rmse": 0.006837, "trip_rmse": 0.002248}, "delta_pct": {"rmse": 0.059, "trip_rmse": -0.089}, "description": "add a linear skip connection from inputs straight to the output", "hypothesis": "much of the physics is close to linear in the right variables \u2014 grade is potential energy per mile, ke_delta_per_mile is acceleration energy per mile \u2014 so a skip lets a linear model carry that exactly while the hidden layers fit only the nonlinear remainder", "observation": "the metrics split, rmse +0.06% (0.006837 -> 0.006841) against trip_rmse -0.09% (0.002248 -> 0.002246)", "reasoning": "the hidden layers were already representing the linear part accurately, so factoring it out changed nothing worth having; taken with exp24, exp25 and exp34 the architecture is now closed against inductive-bias changes as well as against size changes", "tags": ["architecture", "dead-end"]}
{"exp": 35, "commit": "04912e1", "parent_best": "9ff5e20", "status": "discard", "started_at": "2026-08-26T18:46:14Z", "ended_at": "2026-08-26T18:48:31Z", "model_family": "MLP", "features": ["speed_mph", "grade_percent", "miles", "prev_speed_mph", "ke_delta_per_mile", "sinuosity", "junction_turn_degrees", "prev_grade_percent", "prev_miles", "prev_sinuosity", "vertices_per_mile", "link_bend_degrees"], "metrics": {"rmse": 0.006837, "trip_rmse": 0.002248}, "best_before": {"rmse": 0.006837, "trip_rmse": 0.002248}, "delta_pct": {"rmse": 0.0, "trip_rmse": 0.0}, "description": "add link_bend_degrees, the links own net heading change from entry to exit", "hypothesis": "a link can be long and gently curving with low sinuosity yet still swing the vehicle through a large net heading change, so net bend is distinct from both sinuosity and the exp7 summed interior turns", "observation": "an exact tie to six decimals on both metrics for one extra input", "reasoning": "with links averaging 3.7 vertices the net bend is nearly determined by sinuosity, so this is the exp7 result reached by a second route and it closes intra-link shape for good; the geometry column now has exactly two useful statistics, sinuosity and vertices_per_mile, plus the junction turn that needs the lookback", "tags": ["feature-engineering", "geometry", "dead-end"]}
{"exp": 36, "commit": "653f2d8", "parent_best": "9ff5e20", "status": "keep", "started_at": "2026-08-26T18:49:43Z", "ended_at": "2026-08-26T18:52:06Z", "model_family": "MLP", "features": ["speed_mph", "grade_percent", "miles", "prev_speed_mph", "ke_delta_per_mile", "sinuosity", "junction_turn_degrees", "prev_grade_percent", "prev_miles", "prev_sinuosity", "vertices_per_mile"], "metrics": {"rmse": 0.006837, "trip_rmse": 0.002242}, "best_before": {"rmse": 0.006837, "trip_rmse": 0.002248}, "delta_pct": {"rmse": 0.0, "trip_rmse": -0.267}, "description": "AdamW with weight decay 1e-4", "hypothesis": "regularization is the one model-side knob never tested, and decoupled weight decay is its cleanest form; per the structural rule a better-regularized fit should show up mainly in trip_rmse", "observation": "rmse tied exactly at 0.006837 while trip_rmse fell 0.27% (0.002248 -> 0.002242)", "reasoning": "kept because it is Pareto-dominant at literally zero cost \u2014 a one-word optimizer swap, no extra inference work, no new feature; the metric split is the predicted signature again, with regularization buying trip_rmse and leaving link rmse alone, and it is the first thing to work since exp30 which makes weight decay worth pushing further", "tags": ["hypertuning", "optimizer", "regularization"]}
{"exp": 37, "commit": "75a76ee", "parent_best": "653f2d8", "status": "discard", "started_at": "2026-08-26T18:52:25Z", "ended_at": "2026-08-26T18:54:49Z", "model_family": "MLP", "features": ["speed_mph", "grade_percent", "miles", "prev_speed_mph", "ke_delta_per_mile", "sinuosity", "junction_turn_degrees", "prev_grade_percent", "prev_miles", "prev_sinuosity", "vertices_per_mile"], "metrics": {"rmse": 0.00684, "trip_rmse": 0.00224}, "best_before": {"rmse": 0.006837, "trip_rmse": 0.002242}, "delta_pct": {"rmse": 0.044, "trip_rmse": -0.089}, "description": "WEIGHT_DECAY 1e-4 -> 1e-3", "hypothesis": "weight decay at 1e-4 was the first thing to help since exp30, so more of it may buy more of the same trip_rmse gain", "observation": "the metrics split, rmse +0.04% (0.006837 -> 0.006840) against trip_rmse -0.09% (0.002242 -> 0.002240), and the trip movement is below the resolution floor established in exp28", "reasoning": "1e-4 is the right magnitude and an order of magnitude more starts trading link accuracy away; the trip gain here is smaller than the one from the first 1e-4 despite ten times the decay, so the mechanism has saturated rather than scaling", "tags": ["hypertuning", "regularization", "dead-end"]}
{"exp": 38, "commit": "13ed14f", "parent_best": "653f2d8", "status": "discard", "started_at": "2026-08-26T18:55:08Z", "ended_at": "2026-08-26T18:57:07Z", "model_family": "MLP", "features": ["speed_mph", "grade_percent", "miles", "prev_speed_mph", "ke_delta_per_mile", "sinuosity", "junction_turn_degrees", "prev_grade_percent", "prev_miles", "prev_sinuosity", "vertices_per_mile"], "metrics": {"rmse": 0.006816, "trip_rmse": 0.002315}, "best_before": {"rmse": 0.006837, "trip_rmse": 0.002242}, "delta_pct": {"rmse": -0.307, "trip_rmse": 3.256}, "description": "add dropout 0.1 between the hidden layers", "hypothesis": "weight decay helped in exp36, so a second and stronger form of regularization should help too and should again show up mainly in trip_rmse", "observation": "the sharpest divergence since exp9 \u2014 rmse improved 0.31% (0.006837 -> 0.006816) while trip_rmse regressed 3.26% (0.002242 -> 0.002315)", "reasoning": "dropout trains an average over subnetworks but predicts with the full scaled network, and that mismatch is a *systematic* offset rather than random per-link noise, which is precisely what accumulates when a journeys links are summed; regularization is therefore not one direction \u2014 weight decay shrinks weights without biasing the prediction and helps trip, dropout biases it and is the worst thing tried all session for trip_rmse", "tags": ["regularization", "smoothness", "dead-end"]}
{"exp": 39, "commit": "69b3cfb", "parent_best": "653f2d8", "status": "discard", "started_at": "2026-08-26T18:57:33Z", "ended_at": "2026-08-26T18:58:56Z", "model_family": "MLP", "features": ["speed_mph", "grade_percent", "miles", "prev_speed_mph", "ke_delta_per_mile", "junction_turn_degrees", "prev_grade_percent", "prev_miles", "prev_sinuosity", "vertices_per_mile"], "metrics": {"rmse": 0.006999, "trip_rmse": 0.002262}, "best_before": {"rmse": 0.006837, "trip_rmse": 0.002242}, "delta_pct": {"rmse": 2.369, "trip_rmse": 0.892}, "description": "drop sinuosity, testing whether vertices_per_mile subsumes it", "hypothesis": "sinuosity and vertices_per_mile are both computed from the same vertices and both stand in for road character, so the newer one may have made the older redundant", "observation": "both metrics regressed sharply, rmse +2.37% (0.006837 -> 0.006999) and trip_rmse +0.89% (0.002242 -> 0.002262) \u2014 the largest regression from removing a single feature all session", "reasoning": "the two geometry features measure genuinely different things and are complements rather than substitutes \u2014 sinuosity is how bent the path is, vertex density is how finely it is drawn, and a straight highway drawn with many points is not a winding street; sinuosity is the more valuable of the two by roughly seven times", "tags": ["simplification", "geometry", "feature-engineering"]}
{"exp": 40, "commit": "61d270a", "parent_best": "653f2d8", "status": "discard", "started_at": "2026-08-26T18:59:20Z", "ended_at": "2026-08-26T19:02:25Z", "model_family": "MLP", "features": ["speed_mph", "grade_percent", "miles", "prev_speed_mph", "ke_delta_per_mile", "sinuosity", "junction_turn_degrees", "prev_grade_percent", "prev_miles", "prev_sinuosity", "vertices_per_mile"], "metrics": {"rmse": 0.006842, "trip_rmse": 0.002241}, "best_before": {"rmse": 0.006837, "trip_rmse": 0.002242}, "delta_pct": {"rmse": 0.073, "trip_rmse": -0.045}, "description": "add LayerNorm after each hidden layer", "hypothesis": "normalization should ease optimization, and unlike dropout or BatchNorm a LayerNorm is a deterministic per-sample transform so it carries none of the train-versus-predict mismatch that wrecked trip_rmse in exp38", "observation": "the metrics split, rmse +0.07% (0.006837 -> 0.006842) against trip_rmse -0.04% (0.002242 -> 0.002241), both below the resolution floor", "reasoning": "the mismatch reasoning held \u2014 LayerNorm did not damage trip_rmse the way dropout did \u2014 but there was no optimization problem to fix in a two-layer network on standardized inputs, so it bought nothing either; architecture and normalization are now comprehensively closed", "tags": ["architecture", "regularization", "dead-end"]}
{"exp": 41, "commit": "4e27c0a", "parent_best": "653f2d8", "status": "discard", "started_at": "2026-08-26T19:03:10Z", "ended_at": "2026-08-26T19:05:29Z", "model_family": "MLP", "features": ["speed_mph", "grade_percent", "miles", "prev_speed_mph", "ke_delta_per_mile", "sinuosity", "junction_turn_degrees", "prev_grade_percent", "prev_miles", "prev_sinuosity", "vertices_per_mile"], "metrics": {"rmse": 0.006838, "trip_rmse": 0.002247}, "best_before": {"rmse": 0.006837, "trip_rmse": 0.002242}, "delta_pct": {"rmse": 0.015, "trip_rmse": 0.223}, "description": "fill first-link prev_speed_mph with the links own speed instead of 0", "hypothesis": "a 0 fill tells the model the whole first link was one long acceleration from rest, whereas the vehicle is at its average speed for most of the link, so an own-speed fill implying zero acceleration should describe the average better", "observation": "both metrics regressed slightly, rmse +0.01% (0.006837 -> 0.006838) and trip_rmse +0.22% (0.002242 -> 0.002247)", "reasoning": "the original from-rest fill is right and the reasoning behind the change was wrong: a trip start genuinely is an acceleration from rest, that is real physics the model can use, and flattening it to zero acceleration throws the information away; only 0.9% of rows are trip starts yet the choice still moved trip_rmse measurably, because every trip has exactly one", "tags": ["data-representation", "dead-end"]}
{"exp": 42, "commit": "2c51a61", "parent_best": "653f2d8", "status": "discard", "started_at": "2026-08-26T19:05:51Z", "ended_at": "2026-08-26T19:09:09Z", "model_family": "MLP", "features": ["speed_mph", "grade_percent", "miles", "prev_speed_mph", "ke_delta_per_mile", "sinuosity", "junction_turn_degrees", "prev_grade_percent", "prev_miles", "prev_sinuosity", "vertices_per_mile"], "metrics": {"rmse": 0.006856, "trip_rmse": 0.002245}, "best_before": {"rmse": 0.006837, "trip_rmse": 0.002242}, "delta_pct": {"rmse": 0.278, "trip_rmse": 0.134}, "description": "MAX_EPOCHS 200 -> 300 now that weight decay regularizes", "hypothesis": "exp12 found 200 epochs optimal without regularization, and weight decay should push the overfitting point later, so the two settings ought to interact", "observation": "both metrics regressed, rmse +0.28% (0.006837 -> 0.006856) and trip_rmse +0.13% (0.002242 -> 0.002245)", "reasoning": "they do not interact \u2014 200 epochs is optimal with and without weight decay, so the limit is not overfitting capacity being reached but the cosine schedule being tuned to complete over exactly the epochs it is given; that makes epochs and schedule one setting rather than two, and it is settled", "tags": ["hypertuning", "optimizer", "dead-end"]}
{"exp": 43, "commit": "02bf0ee", "parent_best": "653f2d8", "status": "discard", "started_at": "2026-08-26T19:09:44Z", "ended_at": "2026-08-26T19:11:45Z", "model_family": "MLP", "features": ["speed_mph", "grade_percent", "miles", "prev_speed_mph", "ke_delta_per_mile", "sinuosity", "junction_turn_degrees", "prev_grade_percent", "prev_miles", "prev_sinuosity", "vertices_per_mile", "is_decelerating"], "metrics": {"rmse": 0.00685, "trip_rmse": 0.00225}, "best_before": {"rmse": 0.006837, "trip_rmse": 0.002242}, "delta_pct": {"rmse": 0.19, "trip_rmse": 0.357}, "description": "add an is_decelerating flag for the regen/propulsion efficiency kink", "hypothesis": "a BEV recovers energy at a different efficiency from the one it spends it at, so the target has a real kink at zero acceleration, and a step is the shape a ReLU stack approximates worst", "observation": "both metrics regressed, rmse +0.19% (0.006837 -> 0.006850) and trip_rmse +0.36% (0.002242 -> 0.002250)", "reasoning": "the premise was backwards \u2014 ke_delta_per_mile is signed and crosses zero at exactly the propulsion/regen boundary, and a kink at zero of an existing input is the *easiest* thing for a ReLU stack to place, since that is literally what a ReLU is; the flag was redundant with the sign already present and only added a noisy input", "tags": ["feature-engineering", "physics", "dead-end"]}
{"exp": 44, "commit": "e77972b", "parent_best": "653f2d8", "status": "discard", "started_at": "2026-08-26T19:12:20Z", "ended_at": "2026-08-26T19:14:49Z", "model_family": "MLP", "features": ["speed_mph", "grade_percent", "miles", "prev_speed_mph", "ke_delta_per_mile", "sinuosity", "junction_turn_degrees", "prev_grade_percent", "prev_miles", "prev_sinuosity", "vertices_per_mile", "centroid_lon", "centroid_lat"], "metrics": {"rmse": 0.006856, "trip_rmse": 0.002248}, "best_before": {"rmse": 0.006837, "trip_rmse": 0.002242}, "delta_pct": {"rmse": 0.278, "trip_rmse": 0.268}, "description": "add link centroid lat/lon as a bounded diagnostic of region-specific signal", "hypothesis": "run to measure rather than to keep \u2014 the random row split puts the same roads in train and test, so position should let the model memorize per-road energy and post a gain that would not survive on unseen roads; the question was how large that inflation is", "observation": "both metrics regressed, rmse +0.28% (0.006837 -> 0.006856) and trip_rmse +0.27% (0.002242 -> 0.002248) \u2014 position did not help even with memorization available", "reasoning": "the best possible outcome for this test: there is no exploitable region-specific signal left once the physics and geometry features are present, so the discard costs nothing real and the model is genuinely physics-driven rather than leaning on where it is; it also means the residual 46%-below-23mph error is not local traffic character the model could look up, which strengthens the reading that it is genuinely unobservable at link-average resolution", "tags": ["feature-engineering", "diagnostic", "dead-end"]}
{"exp": 45, "commit": "08abeef", "parent_best": "653f2d8", "status": "keep", "started_at": "2026-08-26T19:15:31Z", "ended_at": "2026-08-26T19:17:43Z", "model_family": "MLP", "features": ["speed_mph", "grade_percent", "miles", "prev_speed_mph", "ke_delta_per_mile", "sinuosity", "junction_turn_degrees", "prev_grade_percent", "prev_miles", "prev_sinuosity", "vertices_per_mile"], "metrics": {"rmse": 0.006836, "trip_rmse": 0.002242}, "best_before": {"rmse": 0.006837, "trip_rmse": 0.002242}, "delta_pct": {"rmse": -0.015, "trip_rmse": 0.0}, "description": "replace the single 256-wide net with a 2x128 ensemble at half the inference cost", "hypothesis": "exp17 showed narrowing to 128 costs only ~0.15% and exp26 showed averaging independent fits gains ~0.6%, and two 128s cost 2*128^2 against 256^2 in the hidden-hidden layer, so the combination should hold accuracy at roughly half the inference cost", "observation": "rmse fell a hair to 0.006836 and trip_rmse held exactly at 0.002242 \u2014 accuracy unchanged, while the model went from 68,608 to 35,840 multiply-accumulates per link", "reasoning": "the two earlier negatives were each rejected on the same axis they failed \u2014 narrowing lost accuracy, ensembling cost too much \u2014 but composing them cancels those objections against each other, which is worth remembering as a pattern: a discarded result is a measured tradeoff, not a dead end, and two of them can compose into a win neither could reach alone; on domain.mds competing-objectives clause this is the most deployment-relevant result of the session", "tags": ["architecture", "inference-cost", "ensembling", "breakthrough"]}
{"exp": 46, "commit": "b7b2f37", "parent_best": "08abeef", "status": "discard", "started_at": "2026-08-26T19:18:10Z", "ended_at": "2026-08-26T19:23:47Z", "model_family": "MLP", "features": ["speed_mph", "grade_percent", "miles", "prev_speed_mph", "ke_delta_per_mile", "sinuosity", "junction_turn_degrees", "prev_grade_percent", "prev_miles", "prev_sinuosity", "vertices_per_mile"], "metrics": {"rmse": 0.006845, "trip_rmse": 0.002243}, "best_before": {"rmse": 0.006836, "trip_rmse": 0.002242}, "delta_pct": {"rmse": 0.132, "trip_rmse": 0.045}, "description": "3x96 ensemble instead of 2x128", "hypothesis": "if two narrow members beat one wide net, three narrower ones should push the same tradeoff further and land cheaper still at 31k multiply-accumulates against 36k", "observation": "both metrics regressed slightly, rmse +0.13% (0.006836 -> 0.006845) and trip_rmse +0.04% (0.002242 -> 0.002243), and the run took 333s against 129s", "reasoning": "more members do not compensate for members that are individually too small \u2014 averaging cancels variance between fits but cannot recover capacity none of them has, so there is a width floor per member somewhere between 96 and 128 that the ensemble count cannot buy its way under", "tags": ["architecture", "ensembling", "dead-end"]}
