{"exp": 37, "commit": "23c179e", "parent_best": "52b9c48", "status": "discard", "started_at": "2026-09-01T04:17:03Z", "ended_at": "2026-09-01T04:26:08Z", "model_family": "PhysicsMLP", "features": ["speed_mph", "prev_speed_mph", "next_speed_mph", "prev_miles", "next_miles", "prev2_miles", "prev2_speed_mph", "next2_speed_mph", "prev_grade_percent", "entry_kinetic_gge", "exit_kinetic_gge", "sinuosity", "junction_turn_degrees", "prev_sinuosity", "next_junction_turn_degrees", "grade_percent", "miles"], "metrics": {"rmse": 0.0059, "trip_rmse": 0.002087, "physics_pass": 1.0, "physics_violation_rate": 0.0, "long_link_violation_rate": 0.0, "length_invariance": 0.782778}, "best_before": {"rmse": 0.005915, "trip_rmse": 0.002084, "physics_pass": 1.0, "physics_violation_rate": 0.0, "long_link_violation_rate": 0.0, "length_invariance": 0.500424}, "delta_pct": {"rmse": -0.25, "trip_rmse": 0.14, "physics_pass": 0.0, "physics_violation_rate": 0.0, "long_link_violation_rate": 0.0, "length_invariance": 56.45}, "description": "a second regen channel, gated on the turn ahead", "hypothesis": "braking for a corner at the link's far end is regen the neighbour speeds cannot show, and unlike exp10's attempt at the same physics this gate vanishes on the sweep by construction, because a synthetic link has no geometry and therefore exactly zero turn", "observation": "rmse -0.25% and trip_rmse +0.14%, a 1.8:1 split that does not dominate; the run also completed only 291/300 epochs against exp34's 300/300, which on exp16's evidence is itself worth a little trip_rmse", "reasoning": "discarded on the ratio - I kept exp29 at 44:1 and discarded exp5 at 6:1, and 1.8:1 is not close. The construction is still the right pattern and is recorded as such: it is the safe way to reach the intra-link physics exp10 reached unsafely, and if the corner channel is ever worth revisiting this is the form to use. The epoch truncation is a genuine confound at this run length and is the reason not to read the trip movement too hard either way", "tags": ["architecture", "physics", "near-miss"]}
{"exp": 38, "commit": "bf10010", "parent_best": "52b9c48", "status": "discard", "started_at": "2026-09-01T04:26:41Z", "ended_at": "2026-09-01T04:35:45Z", "model_family": "PhysicsMLP", "features": ["speed_mph", "prev_speed_mph", "next_speed_mph", "prev_miles", "next_miles", "prev2_miles", "prev2_speed_mph", "prev_grade_percent", "entry_kinetic_gge", "exit_kinetic_gge", "sinuosity", "junction_turn_degrees", "prev_sinuosity", "next_junction_turn_degrees", "grade_percent", "miles"], "metrics": {"rmse": 0.005987, "trip_rmse": 0.002102, "physics_pass": 1.0, "physics_violation_rate": 0.0, "long_link_violation_rate": 0.0, "length_invariance": 0.580279}, "best_before": {"rmse": 0.005915, "trip_rmse": 0.002084, "physics_pass": 1.0, "physics_violation_rate": 0.0, "long_link_violation_rate": 0.0, "length_invariance": 0.500424}, "delta_pct": {"rmse": 1.22, "trip_rmse": 0.86, "physics_pass": 0.0, "physics_violation_rate": 0.0, "long_link_violation_rate": 0.0, "length_invariance": 16.0}, "description": "removal screen - drop next2_speed_mph", "hypothesis": "next2_miles was actively harmful at exp35 and prev3_speed failed at exp30, so the exit side of the +/-2 window may have become dead weight now that the length-dependent transient explains more", "observation": "both metrics clearly worse (rmse +1.22%, trip_rmse +0.86%) - it is worth about as much to remove as it was to add", "reasoning": "second removal screen, second confirmation that the feature set is minimal rather than padded; the useful distinction is that next2_*speed* carries the departure profile while next2_*miles* only carries context for it, and context two links out is where the chain has faded even though the speed itself has not", "tags": ["feature-engineering", "removal-screen"]}
{"exp": 39, "commit": "fbdca36", "parent_best": "52b9c48", "status": "discard", "started_at": "2026-09-01T04:36:15Z", "ended_at": "2026-09-01T04:45:20Z", "model_family": "PhysicsMLP", "features": ["speed_mph", "prev_speed_mph", "next_speed_mph", "prev_miles", "next_miles", "prev2_miles", "prev2_speed_mph", "next2_speed_mph", "prev_grade_percent", "prev2_grade_percent", "entry_kinetic_gge", "exit_kinetic_gge", "sinuosity", "junction_turn_degrees", "prev_sinuosity", "next_junction_turn_degrees", "grade_percent", "miles"], "metrics": {"rmse": 0.005949, "trip_rmse": 0.002094, "physics_pass": 1.0, "physics_violation_rate": 0.0, "long_link_violation_rate": 0.0, "length_invariance": 0.84988}, "best_before": {"rmse": 0.005915, "trip_rmse": 0.002084, "physics_pass": 1.0, "physics_violation_rate": 0.0, "long_link_violation_rate": 0.0, "length_invariance": 0.500424}, "delta_pct": {"rmse": 0.57, "trip_rmse": 0.48, "physics_pass": 0.0, "physics_violation_rate": 0.0, "long_link_violation_rate": 0.0, "length_invariance": 69.8}, "description": "add prev2_grade_percent (two links of terrain behind)", "hypothesis": "prev_grade_percent was worth -0.89% trip_rmse as a bias correction on hilly trips, and terrain is spatially correlated, so a second link of terrain behind may sharpen it", "observation": "both metrics worse (rmse +0.57%, trip_rmse +0.48%)", "reasoning": "the grade family stops at one link back, unlike speed and length which reach two - consistent with prev_grade working as a *bias* correction rather than as information: one link is enough to say which way the terrain is running, and a second only adds noise to a correction that was already the right size", "tags": ["feature-engineering", "dead-end"]}
{"exp": 40, "commit": "b4de37b", "parent_best": "52b9c48", "status": "keep", "started_at": "2026-09-01T04:45:46Z", "ended_at": "2026-09-01T04:54:00Z", "model_family": "PhysicsMLP", "features": ["speed_mph", "prev_speed_mph", "next_speed_mph", "prev_miles", "next_miles", "prev2_miles", "prev2_speed_mph", "next2_speed_mph", "prev_grade_percent", "entry_kinetic_gge", "exit_kinetic_gge", "sinuosity", "junction_turn_degrees", "prev_sinuosity", "next_junction_turn_degrees", "grade_percent", "miles"], "metrics": {"rmse": 0.005915, "trip_rmse": 0.002084, "physics_pass": 1.0, "physics_violation_rate": 0.0, "long_link_violation_rate": 0.0, "length_invariance": 0.500424}, "best_before": {"rmse": 0.005915, "trip_rmse": 0.002084, "physics_pass": 1.0, "physics_violation_rate": 0.0, "long_link_violation_rate": 0.0, "length_invariance": 0.500424}, "delta_pct": {"rmse": 0.0, "trip_rmse": 0.0, "physics_pass": 0.0, "physics_violation_rate": 0.0, "long_link_violation_rate": 0.0, "length_invariance": 0.0}, "description": "control - re-run the incumbent unchanged to measure run-to-run variance", "hypothesis": "exp36-39 all completed 291-297 epochs against the incumbent's 300 because of sustained machine load, which biases every recent comparison; re-running the incumbent unchanged separates run-to-run variance from the changes being judged", "observation": "bit-identical on every metric to six decimals including length_invariance 0.500424, at 300/300 epochs in 490s", "reasoning": "run-to-run variance is exactly zero when the epoch count matches, so sub-0.5% deltas are real and the only confound is truncation; quantifying it from exp16, halving the epochs cost 0.46% rmse and 1.31% trip_rmse, so the 2-3% shortfall in exp36-39 is worth roughly 0.02%/0.05% - an order of magnitude below the deltas that decided them, so those verdicts stand. The one experiment this does not clear is exp37, whose split was small enough for it to matter", "tags": ["protocol", "control"]}
{"exp": 41, "commit": "3dac934", "parent_best": "b4de37b", "status": "discard", "started_at": "2026-09-01T04:54:32Z", "ended_at": "2026-09-01T05:03:37Z", "model_family": "PhysicsMLP", "features": ["speed_mph", "prev_speed_mph", "next_speed_mph", "prev_miles", "next_miles", "prev2_miles", "prev2_speed_mph", "next2_speed_mph", "prev_grade_percent", "entry_kinetic_gge", "exit_kinetic_gge", "sinuosity", "junction_turn_degrees", "prev_sinuosity", "next_junction_turn_degrees", "grade_percent", "miles"], "metrics": {"rmse": 0.005901, "trip_rmse": 0.002089, "physics_pass": 1.0, "physics_violation_rate": 0.0, "long_link_violation_rate": 0.0, "length_invariance": 0.768946}, "best_before": {"rmse": 0.005915, "trip_rmse": 0.002084, "physics_pass": 1.0, "physics_violation_rate": 0.0, "long_link_violation_rate": 0.0, "length_invariance": 0.500424}, "delta_pct": {"rmse": -0.24, "trip_rmse": 0.24, "physics_pass": 0.0, "physics_violation_rate": 0.0, "long_link_violation_rate": 0.0, "length_invariance": 53.66}, "description": "re-test the corner-gated regen channel at matched epochs", "hypothesis": "exp37 lost trip_rmse by 0.14% while running 291 epochs against a 300-epoch incumbent; with exp40 showing zero run-to-run variance at matched epochs, a matched re-run should give a clean verdict", "observation": "the load got worse rather than better - 269/300 epochs, a 10% shortfall - and the result was rmse -0.24% with trip_rmse +0.24%; scaling exp16 (50% shortfall cost 1.31% trip) a 10% shortfall is worth roughly 0.26% trip, which is the entire regression", "reasoning": "discarded because dominance was not demonstrated, not because it was disproved - corrected for truncation this looks like a weak genuine win, and it is the honest reading that I could not get a matched run in two attempts. Recorded as the session's one unresolved question. The alternative, cutting the epoch count until runs always complete, was rejected because it would degrade the delivered model to settle a 0.3% question", "tags": ["architecture", "physics", "near-miss", "protocol"]}
{"exp": 42, "commit": "ac5bf31", "parent_best": "b4de37b", "status": "discard", "started_at": "2026-09-01T05:04:12Z", "ended_at": "2026-09-01T05:11:09Z", "model_family": "PhysicsMLP", "features": ["speed_mph", "prev_speed_mph", "next_speed_mph", "prev_miles", "next_miles", "prev2_miles", "prev2_speed_mph", "next2_speed_mph", "prev_grade_percent", "entry_kinetic_gge", "exit_kinetic_gge", "sinuosity", "junction_turn_degrees", "prev_sinuosity", "next_sinuosity", "next_junction_turn_degrees", "grade_percent", "miles"], "metrics": {"rmse": 0.005919, "trip_rmse": 0.002085, "physics_pass": 1.0, "physics_violation_rate": 0.0, "long_link_violation_rate": 0.0, "length_invariance": 0.56057}, "best_before": {"rmse": 0.005915, "trip_rmse": 0.002084, "physics_pass": 1.0, "physics_violation_rate": 0.0, "long_link_violation_rate": 0.0, "length_invariance": 0.500424}, "delta_pct": {"rmse": 0.07, "trip_rmse": 0.05, "physics_pass": 0.0, "physics_violation_rate": 0.0, "long_link_violation_rate": 0.0, "length_invariance": 12.0}, "description": "add next_sinuosity (the shape of the road ahead)", "hypothesis": "prev_sinuosity kept at -0.51%/-0.37%, so the exit-side partner should carry roughly a third of that on the session's consistent entry-over-exit ratio", "observation": "an exact tie in practice - both metrics 0.05-0.07% worse - at a matched 300/300 epochs, so this is a clean verdict rather than a truncated one", "reasoning": "geometry follows grade rather than speed in the asymmetry: the shape behind matters because it determines the speed the vehicle arrives with, and the shape ahead is already fully accounted for by next_speed_mph and the turn at the far end. Both the geometry and grade families are one-sided; only speed and length are two-sided", "tags": ["feature-engineering", "geometry", "dead-end"]}
{"exp": 43, "commit": "ab58f0b", "parent_best": "b4de37b", "status": "discard", "started_at": "2026-09-01T05:11:30Z", "ended_at": "2026-09-01T05:20:36Z", "model_family": "PhysicsMLP", "features": ["speed_mph", "prev_speed_mph", "next_speed_mph", "prev_miles", "next_miles", "prev2_miles", "prev2_speed_mph", "next2_speed_mph", "prev_grade_percent", "entry_kinetic_gge", "exit_kinetic_gge", "sinuosity", "junction_turn_degrees", "prev_sinuosity", "next_junction_turn_degrees", "grade_percent", "miles"], "metrics": {"rmse": 0.005901, "trip_rmse": 0.002087, "physics_pass": 1.0, "physics_violation_rate": 0.0, "long_link_violation_rate": 0.0, "length_invariance": 0.781821}, "best_before": {"rmse": 0.005915, "trip_rmse": 0.002084, "physics_pass": 1.0, "physics_violation_rate": 0.0, "long_link_violation_rate": 0.0, "length_invariance": 0.500424}, "delta_pct": {"rmse": -0.24, "trip_rmse": 0.14, "physics_pass": 0.0, "physics_violation_rate": 0.0, "long_link_violation_rate": 0.0, "length_invariance": 56.23}, "description": "corner-gated regen channel, third attempt at a matched-epoch verdict", "hypothesis": "a third run may land at 300/300 and settle whether exp37's trip regression was the feature or the truncation", "observation": "292/300, but the three runs of this configuration settle it a better way - at 291, 269 and 292 epochs it returned rmse 0.005900/0.005901/0.005901 and trip_rmse 0.002087/0.002089/0.002087, so it is nearly insensitive to a 10% epoch shortfall", "reasoning": "the truncation correction I proposed at exp41 was wrong, and this configuration's own insensitivity disproves it rather than a matched run doing so: the trade is real at about 1.7:1 and the corner channel is a genuine discard. The method lesson is that when a confound cannot be removed, measuring the model's sensitivity to it beats estimating the correction from a different experiment - exp16's epoch scaling did not transfer here", "tags": ["architecture", "physics", "dead-end", "protocol"]}
{"exp": 44, "commit": "e4386bd", "parent_best": "b4de37b", "status": "discard", "started_at": "2026-09-01T05:21:07Z", "ended_at": "2026-09-01T05:29:39Z", "model_family": "PhysicsMLP", "features": ["speed_mph", "prev_speed_mph", "next_speed_mph", "prev_miles", "next_miles", "prev2_miles", "prev2_speed_mph", "next2_speed_mph", "prev_grade_percent", "entry_kinetic_gge", "exit_kinetic_gge", "sinuosity", "junction_turn_degrees", "prev_sinuosity", "next_junction_turn_degrees", "grade_percent", "miles"], "metrics": {"rmse": 0.005916, "trip_rmse": 0.00209, "physics_pass": 1.0, "physics_violation_rate": 0.0, "long_link_violation_rate": 0.0, "length_invariance": 0.530005}, "best_before": {"rmse": 0.005915, "trip_rmse": 0.002084, "physics_pass": 1.0, "physics_violation_rate": 0.0, "long_link_violation_rate": 0.0, "length_invariance": 0.500424}, "delta_pct": {"rmse": 0.02, "trip_rmse": 0.29, "physics_pass": 0.0, "physics_violation_rate": 0.0, "long_link_violation_rate": 0.0, "length_invariance": 5.91}, "description": "simplification screen - drop weight decay", "hypothesis": "weight decay was inherited from the sibling tree's tuned MLP and never tested here; if it ties, removing it is a simplification win under the program's simplicity criterion", "observation": "rmse tied and trip_rmse +0.29% at a matched 300/300, so the regularization earns its place", "reasoning": "consistent with the capacity picture rather than a surprise: weight decay reduces effective capacity, and every capacity reduction this session has bought rmse with trip_rmse - here it went the other way, which means 1e-4 is small enough to be acting on the fit's bias rather than on its capacity, and is doing the job it was inherited for", "tags": ["hypertuning", "removal-screen", "dead-end"]}
{"exp": 45, "commit": "2b5c37e", "parent_best": "b4de37b", "status": "keep", "started_at": "2026-09-01T05:30:16Z", "ended_at": "2026-09-01T05:37:17Z", "model_family": "PhysicsMLP", "features": ["speed_mph", "prev_speed_mph", "next_speed_mph", "prev_miles", "next_miles", "prev2_miles", "prev2_speed_mph", "next2_speed_mph", "prev_grade_percent", "entry_kinetic_gge", "exit_kinetic_gge", "sinuosity", "junction_turn_degrees", "prev_sinuosity", "next_junction_turn_degrees", "grade_percent", "miles"], "metrics": {"rmse": 0.005915, "trip_rmse": 0.002084, "physics_pass": 1.0, "physics_violation_rate": 0.0, "long_link_violation_rate": 0.0, "length_invariance": 0.500424}, "best_before": {"rmse": 0.005915, "trip_rmse": 0.002084, "physics_pass": 1.0, "physics_violation_rate": 0.0, "long_link_violation_rate": 0.0, "length_invariance": 0.500424}, "delta_pct": {"rmse": 0.0, "trip_rmse": 0.0, "physics_pass": 0.0, "physics_violation_rate": 0.0, "long_link_violation_rate": 0.0, "length_invariance": 0.0}, "description": "format-only cleanup of train.py, verified bit-identical", "hypothesis": "train.py had drifted out of `ruff format` compliance across 45 edits, and the repo should be left passing its own checks; the run verifies that the reformat is semantics-preserving rather than assuming it", "observation": "bit-identical on every metric to six decimals at 300/300 epochs, and `pixi run check` now passes on the tree", "reasoning": "kept so that main's train.py is both the best model and a file the project's own tooling accepts; run rather than assumed because the protocol's guarantee is that main carries the best commit's model, and a textual change to that file should be demonstrated inert rather than argued to be", "tags": ["protocol", "housekeeping"]}
