{"exp": 0, "commit": "eeb388b", "parent_best": null, "status": "keep", "started_at": "2026-08-31T23:24:30Z", "ended_at": "2026-08-31T23:24:43Z", "model_family": "RandomForest", "features": ["speed_mph", "grade_percent", "miles"], "metrics": {"rmse": 0.013345, "trip_rmse": 0.003037, "physics_pass": 0.0, "physics_violation_rate": 0.098493, "long_link_violation_rate": 0.095871, "length_invariance": 8.826788}, "best_before": null, "delta_pct": null, "description": "baseline (scaffold RandomForest, 3 features)", "hypothesis": "the scaffold reproduces the sibling trees' accuracy exactly (same split, same model) and fails physics, because a tree is piecewise constant and saturates outside the 0.5 mi training range while the sweep runs to 5 mi", "observation": "rmse 0.013345 / trip_rmse 0.003037, identical to both sibling trees; 6 of 9 checks fail, led by climb_floor at 81.1% and round_trip_convexity at 45.7%, with implied eta_drive 1.290 and length_invariance 8.83", "reasoning": "the dominant failure is not extrapolation but the grade response itself: an implied drivetrain efficiency of 1.29 means the forest bills a climb for less than the height it gains at every distance, so no amount of range extension fixes it - the functional form has to encode gravity", "tags": ["baseline"]}
{"exp": 1, "commit": "0a3584f", "parent_best": "eeb388b", "status": "keep", "started_at": "2026-08-31T23:33:18Z", "ended_at": "2026-08-31T23:40:11Z", "model_family": "PhysicsMLP", "features": ["speed_mph", "grade_percent", "miles"], "metrics": {"rmse": 0.013397, "trip_rmse": 0.00306, "physics_pass": 1.0, "physics_violation_rate": 0.0, "long_link_violation_rate": 0.0, "length_invariance": 0.0}, "best_before": {"rmse": 0.013345, "trip_rmse": 0.003037, "physics_pass": 0.0, "physics_violation_rate": 0.098493, "long_link_violation_rate": 0.095871, "length_invariance": 8.826788}, "delta_pct": {"rmse": 0.39, "trip_rmse": 0.76, "physics_pass": null, "physics_violation_rate": -100.0, "long_link_violation_rate": -100.0, "length_invariance": -100.0}, "description": "structured physics parametrization: 4 bounded heads (A,B,C,T) driven by an MLP", "hypothesis": "predicting E = d*(A + B*g+ - C*g-) + T with each head squashed into its physically legal interval satisfies all nine checks by construction, because the ceiling in physics.py decomposes into exactly the same d-proportional and d-fixed parts", "observation": "physics_pass 1.0 with every violation rate at 0.0 and length_invariance exactly 0.0, at rmse 0.013397 (+0.39%) and trip_rmse 0.003060 (+0.76%) against the unconstrained forest; 389s of the 600s budget", "reasoning": "the guarantee held algebraically on the first try, and the accuracy cost of being physically legal is under 1% even with the network seeing only speed - grade and length are carried entirely by the structure, so all the remaining capacity is free for information the baseline never had", "tags": ["architecture", "breakthrough", "physics"]}
{"exp": 2, "commit": "06bd94d", "parent_best": "0a3584f", "status": "keep", "started_at": "2026-08-31T23:41:36Z", "ended_at": "2026-08-31T23:48:05Z", "model_family": "PhysicsMLP", "features": ["speed_mph", "prev_speed_mph", "grade_percent", "miles"], "metrics": {"rmse": 0.010816, "trip_rmse": 0.003008, "physics_pass": 1.0, "physics_violation_rate": 0.0, "long_link_violation_rate": 0.0, "length_invariance": 3.312173}, "best_before": {"rmse": 0.013397, "trip_rmse": 0.00306, "physics_pass": 1.0, "physics_violation_rate": 0.0, "long_link_violation_rate": 0.0, "length_invariance": 0.0}, "delta_pct": {"rmse": -19.27, "trip_rmse": -1.7, "physics_pass": 0.0, "physics_violation_rate": 0.0, "long_link_violation_rate": 0.0, "length_invariance": null}, "description": "add prev_speed_mph to the network inputs", "hypothesis": "acceleration is the dominant unmeasured driver of link energy (both sibling trees), and the T head is exactly the per-link transient energy, so the entry speed should feed it directly without needing a per-mile kinetic term", "observation": "rmse -19.3% and trip_rmse -1.7%, physics still passing on every check; length_invariance moved 0.0 -> 3.31 because T became non-zero", "reasoning": "the split is the classic information signature - a large rmse gain with almost none at trip level - and the length_invariance move is the structure working as intended, since a non-zero fixed cost T makes the per-mile rate genuinely higher on short links", "tags": ["feature-engineering"]}
{"exp": 3, "commit": "b72184e", "parent_best": "06bd94d", "status": "keep", "started_at": "2026-08-31T23:49:01Z", "ended_at": "2026-08-31T23:55:04Z", "model_family": "PhysicsMLP", "features": ["speed_mph", "prev_speed_mph", "next_speed_mph", "grade_percent", "miles"], "metrics": {"rmse": 0.010305, "trip_rmse": 0.002871, "physics_pass": 1.0, "physics_violation_rate": 0.0, "long_link_violation_rate": 0.0, "length_invariance": 2.631165}, "best_before": {"rmse": 0.010816, "trip_rmse": 0.003008, "physics_pass": 1.0, "physics_violation_rate": 0.0, "long_link_violation_rate": 0.0, "length_invariance": 3.312173}, "delta_pct": {"rmse": -4.72, "trip_rmse": -4.55, "physics_pass": 0.0, "physics_violation_rate": 0.0, "long_link_violation_rate": 0.0, "length_invariance": -20.56}, "description": "add next_speed_mph (the exit half of the kinetic delta)", "hypothesis": "this tree has no one-link-lookback restriction, so the exit speed is available; the unguided tree's best single feature was two-sided, so the exit half should still carry signal after the entry half is in", "observation": "rmse -4.7% and trip_rmse -4.6%, moving together for the first time this session; physics still clean", "reasoning": "the exit-side gain is about a quarter of the entry-side gain, matching the sibling trees' 2-4x entry-over-exit ratio, and the fact that trip_rmse moved as far as rmse suggests the exit speed removes a *systematic* bias - links that end in braking were previously overbilled everywhere", "tags": ["feature-engineering", "trip-context"]}
{"exp": 4, "commit": "c9b5a10", "parent_best": "b72184e", "status": "discard", "started_at": "2026-08-31T23:55:44Z", "ended_at": "2026-09-01T00:02:15Z", "model_family": "PhysicsMLP", "features": ["speed_mph", "prev_speed_mph", "next_speed_mph", "prev_miles", "grade_percent", "miles"], "metrics": {"rmse": 0.009984, "trip_rmse": 0.00288, "physics_pass": 1.0, "physics_violation_rate": 0.0, "long_link_violation_rate": 0.0, "length_invariance": 0.585244}, "best_before": {"rmse": 0.010305, "trip_rmse": 0.002871, "physics_pass": 1.0, "physics_violation_rate": 0.0, "long_link_violation_rate": 0.0, "length_invariance": 2.631165}, "delta_pct": {"rmse": -3.12, "trip_rmse": 0.31, "physics_pass": 0.0, "physics_violation_rate": 0.0, "long_link_violation_rate": 0.0, "length_invariance": -77.76}, "description": "add prev_miles (reliability context for prev_speed_mph)", "hypothesis": "prev_miles tells the model how much to trust prev_speed_mph as an estimate of the speed at the previous link's end, and was a top-3 feature in both sibling trees", "observation": "rmse -3.1% but trip_rmse +0.31%, so not Pareto-dominant; length_invariance collapsed 2.63 -> 0.59, meaning the model moved a lot of its explanation out of the fixed T term and into the per-mile rate A", "reasoning": "the length_invariance collapse is the tell: prev_miles lets the model resolve per-link error by re-attributing energy from T to A, which sharpens individual links but shifts a small systematic bias into every link of a trip at once - exactly the error mode trip_rmse is sensitive to; worth re-testing once something else has moved trip_rmse", "tags": ["feature-engineering", "near-miss"]}
{"exp": 5, "commit": "9aa25ee", "parent_best": "b72184e", "status": "discard", "started_at": "2026-09-01T00:03:26Z", "ended_at": "2026-09-01T00:07:39Z", "model_family": "PhysicsMLP", "features": ["speed_mph", "prev_speed_mph", "next_speed_mph", "prev2_speed_mph", "grade_percent", "miles"], "metrics": {"rmse": 0.010262, "trip_rmse": 0.002873, "physics_pass": 1.0, "physics_violation_rate": 0.0, "long_link_violation_rate": 0.0, "length_invariance": 0.972822}, "best_before": {"rmse": 0.010305, "trip_rmse": 0.002871, "physics_pass": 1.0, "physics_violation_rate": 0.0, "long_link_violation_rate": 0.0, "length_invariance": 2.631165}, "delta_pct": {"rmse": -0.42, "trip_rmse": 0.07, "physics_pass": 0.0, "physics_violation_rate": 0.0, "long_link_violation_rate": 0.0, "length_invariance": -63.03}, "description": "add prev2_speed_mph (the approach profile)", "hypothesis": "the speed two links back describes how the vehicle approached, and was worth -4.6% in the unguided tree", "observation": "rmse -0.42% and trip_rmse +0.07%, so a near-tie that is not Pareto-dominant", "reasoning": "worth ten times less here than in the unguided tree, and the reason is structural: there the second-order approach information had to be inferred from raw speeds, while here T is already an explicit per-link transient energy that prev_speed and next_speed pin down directly - the second-order term has almost nothing left to add", "tags": ["feature-engineering", "dead-end"]}
{"exp": 6, "commit": "db730bd", "parent_best": "b72184e", "status": "keep", "started_at": "2026-09-01T00:09:30Z", "ended_at": "2026-09-01T00:15:57Z", "model_family": "PhysicsMLP", "features": ["speed_mph", "prev_speed_mph", "next_speed_mph", "grade_percent", "miles"], "metrics": {"rmse": 0.010287, "trip_rmse": 0.002867, "physics_pass": 1.0, "physics_violation_rate": 0.0, "long_link_violation_rate": 0.0, "length_invariance": 2.244151}, "best_before": {"rmse": 0.010305, "trip_rmse": 0.002871, "physics_pass": 1.0, "physics_violation_rate": 0.0, "long_link_violation_rate": 0.0, "length_invariance": 2.631165}, "delta_pct": {"rmse": -0.17, "trip_rmse": -0.14, "physics_pass": 0.0, "physics_violation_rate": 0.0, "long_link_violation_rate": 0.0, "length_invariance": -14.71}, "description": "let the climb term spend the flat rate's unused ceiling headroom", "hypothesis": "pinning the climb slope to [k_pot, k_pot/eta_peak] says a climb never costs more than mgh at peak drivetrain efficiency, but a real climb runs the motor off its peak; if that bound binds it is a signed bias on every graded link, which is exactly what trip_rmse punishes", "observation": "both metrics improved but only by ~0.15%; implied_eta_drive moved from 1.000 (pinned at the old bound) to 0.895, so the extra headroom is genuinely being spent", "reasoning": "keep, but the small size is the more useful result: the climb slope was barely binding, so the remaining trip_rmse error is not in the grade response - the diagnostic value of this experiment exceeded its accuracy value", "tags": ["architecture", "physics"]}
{"exp": 7, "commit": "fef4f62", "parent_best": "db730bd", "status": "keep", "started_at": "2026-09-01T00:18:05Z", "ended_at": "2026-09-01T00:25:18Z", "model_family": "PhysicsMLP", "features": ["speed_mph", "prev_speed_mph", "next_speed_mph", "grade_percent", "miles"], "metrics": {"rmse": 0.007597, "trip_rmse": 0.002439, "physics_pass": 1.0, "physics_violation_rate": 0.0, "long_link_violation_rate": 0.0, "length_invariance": 1.191992}, "best_before": {"rmse": 0.010287, "trip_rmse": 0.002867, "physics_pass": 1.0, "physics_violation_rate": 0.0, "long_link_violation_rate": 0.0, "length_invariance": 2.244151}, "delta_pct": {"rmse": -26.15, "trip_rmse": -14.93, "physics_pass": 0.0, "physics_violation_rate": 0.0, "long_link_violation_rate": 0.0, "length_invariance": -46.88}, "description": "signed transient: let a link give back the kinetic energy it releases", "hypothesis": "with T >= 0 and A >= res/2, a flat link could never be predicted below half its road load, yet a quarter of the data is at or below zero - the model was structurally unable to express regen, and gating a negative T on the kinetic energy actually released (zero at steady state, so zero on the sweep) unlocks it without touching the guarantee", "observation": "rmse -26.2% and trip_rmse -14.9%, the largest move of the session, with every physics check still passing", "reasoning": "this was a missing *sign*, not missing information - the same three speeds were already inputs, and all that changed is that the structure now lets their difference come out negative; the lesson is to audit a constrained parametrization for what it cannot represent before adding features to it", "tags": ["architecture", "breakthrough", "physics"]}
{"exp": 8, "commit": "ab9d0b6", "parent_best": "fef4f62", "status": "keep", "started_at": "2026-09-01T00:25:53Z", "ended_at": "2026-09-01T00:31:30Z", "model_family": "PhysicsMLP", "features": ["speed_mph", "prev_speed_mph", "next_speed_mph", "prev_miles", "grade_percent", "miles"], "metrics": {"rmse": 0.006932, "trip_rmse": 0.002315, "physics_pass": 1.0, "physics_violation_rate": 0.0, "long_link_violation_rate": 0.0, "length_invariance": 0.986948}, "best_before": {"rmse": 0.007597, "trip_rmse": 0.002439, "physics_pass": 1.0, "physics_violation_rate": 0.0, "long_link_violation_rate": 0.0, "length_invariance": 1.191992}, "delta_pct": {"rmse": -8.75, "trip_rmse": -5.08, "physics_pass": 0.0, "physics_violation_rate": 0.0, "long_link_violation_rate": 0.0, "length_invariance": -17.2}, "description": "re-test prev_miles under the signed-transient structure", "hypothesis": "prev_miles was discarded at exp4 for a 0.31% trip_rmse regression, and the sibling trees' rule is that a marginal feature is tuned against an architecture rather than against the problem; the signed transient changed the architecture materially, so it should be re-measured", "observation": "rmse -8.8% and trip_rmse -5.1%, where the same feature previously bought -3.1% rmse at the cost of trip_rmse", "reasoning": "prev_miles says how much to trust prev_speed as the speed at the previous link's end, and that only pays once the model has something quantitative to do with the entry speed - before exp7 it could only add energy, so a sharper entry estimate had nowhere useful to go", "tags": ["feature-engineering", "re-test"]}
{"exp": 9, "commit": "8996a55", "parent_best": "ab9d0b6", "status": "keep", "started_at": "2026-09-01T00:31:51Z", "ended_at": "2026-09-01T00:38:04Z", "model_family": "PhysicsMLP", "features": ["speed_mph", "prev_speed_mph", "next_speed_mph", "prev_miles", "next_miles", "grade_percent", "miles"], "metrics": {"rmse": 0.006757, "trip_rmse": 0.002287, "physics_pass": 1.0, "physics_violation_rate": 0.0, "long_link_violation_rate": 0.0, "length_invariance": 0.458303}, "best_before": {"rmse": 0.006932, "trip_rmse": 0.002315, "physics_pass": 1.0, "physics_violation_rate": 0.0, "long_link_violation_rate": 0.0, "length_invariance": 0.986948}, "delta_pct": {"rmse": -2.52, "trip_rmse": -1.21, "physics_pass": 0.0, "physics_violation_rate": 0.0, "long_link_violation_rate": 0.0, "length_invariance": -53.56}, "description": "add next_miles (the exit-side reliability context)", "hypothesis": "next_miles is to next_speed_mph what prev_miles is to prev_speed_mph - how far the neighbour ran is how much to trust its average as the speed at the shared boundary - and the exit side matters more here than in the sibling trees because the released-kinetic term reads next_speed directly", "observation": "rmse -2.5% and trip_rmse -1.2%, about a third of what prev_miles was worth", "reasoning": "the entry-over-exit ratio is holding at roughly 3x across every paired feature this session (speed, miles), which matches the sibling trees and the physics: acceleration into a link is billed to it in full, while braking out of it is split with the next link by regen", "tags": ["feature-engineering", "trip-context"]}
{"exp": 10, "commit": "6303efb", "parent_best": "8996a55", "status": "keep", "started_at": "2026-09-01T00:38:33Z", "ended_at": "2026-09-01T00:41:34Z", "model_family": "PhysicsMLP", "features": ["speed_mph", "prev_speed_mph", "next_speed_mph", "prev_miles", "next_miles", "grade_percent", "miles"], "metrics": {"rmse": 0.006757, "trip_rmse": 0.002277, "physics_pass": 1.0, "physics_violation_rate": 0.0, "long_link_violation_rate": 0.0, "length_invariance": 0.608788}, "best_before": {"rmse": 0.006757, "trip_rmse": 0.002287, "physics_pass": 1.0, "physics_violation_rate": 0.0, "long_link_violation_rate": 0.0, "length_invariance": 0.458303}, "delta_pct": {"rmse": 0.0, "trip_rmse": -0.44, "physics_pass": 0.0, "physics_violation_rate": 0.0, "long_link_violation_rate": 0.0, "length_invariance": 32.83}, "description": "size the kinetic release from the link's own peak, not just its entry", "hypothesis": "a link that accelerates above both neighbours and then brakes releases kinetic energy that max(ke(prev) - ke(next), 0) scores as zero, so widening the gate to the link's own average speed should let those links be predicted lower", "observation": "rmse tied to six decimals and trip_rmse -0.44%, so a weak Pareto win; run time also fell to 178s, which is machine load rather than the model", "reasoning": "kept because it is one extra maximum() for a real trip-level gain, but the size says most released energy is already visible in the entry-to-exit difference - the accelerate-then-brake link is a minority case, and it moves trip_rmse rather than rmse because it corrects a small bias spread over many links", "tags": ["architecture", "physics"]}
{"exp": 11, "commit": "394bc00", "parent_best": "6303efb", "status": "keep", "started_at": "2026-09-01T00:42:25Z", "ended_at": "2026-09-01T00:49:38Z", "model_family": "PhysicsMLP", "features": ["speed_mph", "prev_speed_mph", "next_speed_mph", "prev_miles", "next_miles", "prev2_speed_mph", "grade_percent", "miles"], "metrics": {"rmse": 0.006583, "trip_rmse": 0.002258, "physics_pass": 1.0, "physics_violation_rate": 0.0, "long_link_violation_rate": 0.0, "length_invariance": 0.063861}, "best_before": {"rmse": 0.006757, "trip_rmse": 0.002277, "physics_pass": 1.0, "physics_violation_rate": 0.0, "long_link_violation_rate": 0.0, "length_invariance": 0.608788}, "delta_pct": {"rmse": -2.57, "trip_rmse": -0.83, "physics_pass": 0.0, "physics_violation_rate": 0.0, "long_link_violation_rate": 0.0, "length_invariance": -89.51}, "description": "re-test prev2_speed_mph under the signed-transient structure", "hypothesis": "prev2_speed_mph tied at exp5 under the old structure; the same re-test rule that made prev_miles pay at exp8 should apply, since the model can now do something signed with an approach profile", "observation": "rmse -2.6% and trip_rmse -0.8%, where it was a tie before; length_invariance also fell an order of magnitude to 0.064", "reasoning": "second re-test to flip from tie to keep after exp7 - the signed transient did not just add accuracy, it changed which features are worth anything, and every feature screened before exp7 is now stale; the length_invariance collapse says the model is explaining more with the per-mile rate and less with the fixed cost, i.e. it is resolving *which* links really accelerate", "tags": ["feature-engineering", "re-test"]}
{"exp": 12, "commit": "f70b745", "parent_best": "394bc00", "status": "keep", "started_at": "2026-09-01T00:49:58Z", "ended_at": "2026-09-01T00:57:10Z", "model_family": "PhysicsMLP", "features": ["speed_mph", "prev_speed_mph", "next_speed_mph", "prev_miles", "next_miles", "prev2_speed_mph", "next2_speed_mph", "grade_percent", "miles"], "metrics": {"rmse": 0.006488, "trip_rmse": 0.002238, "physics_pass": 1.0, "physics_violation_rate": 0.0, "long_link_violation_rate": 0.0, "length_invariance": 0.056387}, "best_before": {"rmse": 0.006583, "trip_rmse": 0.002258, "physics_pass": 1.0, "physics_violation_rate": 0.0, "long_link_violation_rate": 0.0, "length_invariance": 0.063861}, "delta_pct": {"rmse": -1.44, "trip_rmse": -0.89, "physics_pass": 0.0, "physics_violation_rate": 0.0, "long_link_violation_rate": 0.0, "length_invariance": -11.7}, "description": "add next2_speed_mph (the departure profile)", "hypothesis": "the exit-side analogue of prev2_speed_mph: whether braking continues past the next link says how much of this link's exit speed is really given back rather than carried on", "observation": "rmse -1.4% and trip_rmse -0.9%, about half of what prev2 was worth", "reasoning": "the entry-over-exit ratio has now held at 2-3x for three matched pairs, and the +/-2 window is still paying about half of what +/-1 did, so the chain has not been exhausted at two links out", "tags": ["feature-engineering", "trip-context"]}
