{"exp": 25, "commit": "b07f17b", "parent_best": "e007655", "status": "keep", "started_at": "2026-09-01T02:38:21Z", "ended_at": "2026-09-01T02:44:32Z", "model_family": "PhysicsMLP", "features": ["speed_mph", "prev_speed_mph", "next_speed_mph", "prev_miles", "next_miles", "prev2_speed_mph", "next2_speed_mph", "prev_grade_percent", "entry_kinetic_gge", "sinuosity", "junction_turn_degrees", "prev_sinuosity", "grade_percent", "miles"], "metrics": {"rmse": 0.00624, "trip_rmse": 0.002162, "physics_pass": 1.0, "physics_violation_rate": 0.0, "long_link_violation_rate": 0.0, "length_invariance": 0.761848}, "best_before": {"rmse": 0.006246, "trip_rmse": 0.002153, "physics_pass": 1.0, "physics_violation_rate": 0.0, "long_link_violation_rate": 0.0, "length_invariance": 0.544715}, "delta_pct": {"rmse": -0.1, "trip_rmse": 0.42, "physics_pass": 0.0, "physics_violation_rate": 0.0, "long_link_violation_rate": 0.0, "length_invariance": 39.86}, "description": "narrow the release gate back to the neighbours, restoring the by-construction guarantee", "hypothesis": "reverting exp10's widened gate should restore released == 0 on the sweep, making flat_energy_positive true by construction again, at the cost of roughly the 0.44% trip_rmse exp10 bought", "observation": "rmse -0.10% and trip_rmse +0.42%, the mirror image of exp10 as expected, with physics passing; neither version dominates the other on the metrics", "reasoning": "kept on the tiebreak rather than on the metrics. The two are non-dominated, and the deciding fact is that exp24 showed the wider gate lets the model predict negative level-ground energy the moment the feature set changes - e007655 was passing by accident, not by construction. In a tree whose whole point is enforced physics, a guarantee that holds for any input beats 0.42% of trip_rmse that holds until the next experiment", "tags": ["physics", "architecture", "judgement"]}
{"exp": 26, "commit": "149d104", "parent_best": "b07f17b", "status": "keep", "started_at": "2026-09-01T02:45:05Z", "ended_at": "2026-09-01T02:53:00Z", "model_family": "PhysicsMLP", "features": ["speed_mph", "prev_speed_mph", "next_speed_mph", "prev_miles", "next_miles", "prev2_speed_mph", "next2_speed_mph", "prev_grade_percent", "entry_kinetic_gge", "sinuosity", "junction_turn_degrees", "prev_sinuosity", "next_junction_turn_degrees", "grade_percent", "miles"], "metrics": {"rmse": 0.006216, "trip_rmse": 0.002157, "physics_pass": 1.0, "physics_violation_rate": 0.0, "long_link_violation_rate": 0.0, "length_invariance": 0.360035}, "best_before": {"rmse": 0.00624, "trip_rmse": 0.002162, "physics_pass": 1.0, "physics_violation_rate": 0.0, "long_link_violation_rate": 0.0, "length_invariance": 0.761848}, "delta_pct": {"rmse": -0.38, "trip_rmse": -0.23, "physics_pass": 0.0, "physics_violation_rate": 0.0, "long_link_violation_rate": 0.0, "length_invariance": -52.74}, "description": "re-test next_junction_turn_degrees under the restored guarantee", "hypothesis": "exp24's physics failure was caused by the exp10 gate, not by this feature, so with the gate narrowed the same feature should keep cleanly", "observation": "rmse -0.38% and trip_rmse -0.23% with physics passing - the feature was innocent, and it is worth about a third of the entry-side turn", "reasoning": "confirms the exp24 diagnosis rather than merely working around it; the general lesson is that a physics failure names the check, not the change, and the change that surfaces a latent defect is usually not the change that introduced it", "tags": ["feature-engineering", "geometry", "re-test"]}
{"exp": 27, "commit": "613e657", "parent_best": "149d104", "status": "discard", "started_at": "2026-09-01T02:54:23Z", "ended_at": "2026-09-01T03:01:09Z", "model_family": "PhysicsMLP", "features": ["speed_mph", "prev_speed_mph", "next_speed_mph", "prev_miles", "next_miles", "prev2_speed_mph", "next2_speed_mph", "prev_grade_percent", "entry_kinetic_gge", "sinuosity", "junction_turn_degrees", "prev_sinuosity", "next_junction_turn_degrees", "grade_percent", "miles"], "metrics": {"rmse": 0.006215, "trip_rmse": 0.00216, "physics_pass": 1.0, "physics_violation_rate": 0.0, "long_link_violation_rate": 0.0, "length_invariance": 1.033541}, "best_before": {"rmse": 0.006216, "trip_rmse": 0.002157, "physics_pass": 1.0, "physics_violation_rate": 0.0, "long_link_violation_rate": 0.0, "length_invariance": 0.360035}, "delta_pct": {"rmse": -0.02, "trip_rmse": 0.14, "physics_pass": 0.0, "physics_violation_rate": 0.0, "long_link_violation_rate": 0.0, "length_invariance": 187.1}, "description": "give the descent the saturating shape regen_ceiling itself uses", "hypothesis": "regen saturates - a descent recovers road-load work at 1/eta but leftover height only at eta, so the marginal return bends once the hill outruns the road load it offsets, and a linear C*g cannot bend; capping by the climb cost at the same grade magnitude keeps round_trip_convexity", "observation": "rmse tied and trip_rmse +0.14%, so a discard; epochs completed 300/300, confirming the raised time cap no longer binds", "reasoning": "the descent side is now closed from two directions - exp6 showed the climb bound was barely binding, and this shows the descent *shape* does not matter either, both consistent with implied_eta_regen sitting at 0.82 against a 0.917 cap; grade is simply well determined by the potential-energy term and there is nothing left for the model to learn about it", "tags": ["architecture", "physics", "dead-end"]}
{"exp": 28, "commit": "e79d8de", "parent_best": "149d104", "status": "discard", "started_at": "2026-09-01T03:02:23Z", "ended_at": "2026-09-01T03:10:05Z", "model_family": "PhysicsMLP", "features": ["speed_mph", "prev_speed_mph", "next_speed_mph", "prev_miles", "next_miles", "prev2_speed_mph", "next2_speed_mph", "prev_grade_percent", "sinuosity", "junction_turn_degrees", "prev_sinuosity", "next_junction_turn_degrees", "grade_percent", "miles"], "metrics": {"rmse": 0.006222, "trip_rmse": 0.002167, "physics_pass": 1.0, "physics_violation_rate": 0.0, "long_link_violation_rate": 0.0, "length_invariance": 0.233654}, "best_before": {"rmse": 0.006216, "trip_rmse": 0.002157, "physics_pass": 1.0, "physics_violation_rate": 0.0, "long_link_violation_rate": 0.0, "length_invariance": 0.360035}, "delta_pct": {"rmse": 0.1, "trip_rmse": 0.46, "physics_pass": 0.0, "physics_violation_rate": 0.0, "long_link_violation_rate": 0.0, "length_invariance": -35.1}, "description": "removal screen - drop entry_kinetic_gge", "hypothesis": "entry_kinetic_gge was worth only -0.19%/-0.14% when added at exp17 and six features have arrived since; the sibling trees both found marginal features become removable once the model changes, and a simplification win counts", "observation": "both metrics got worse (rmse +0.10%, trip_rmse +0.46%), so the feature still earns its place - and it is worth more now (0.46% trip) than when it was added (0.14%)", "reasoning": "a feature can gain value from its successors as well as lose it: the neighbour lengths and turns that arrived after exp17 tell the model when the entry kinetic term is trustworthy, which is the same conditioning effect the unguided tree measured in reverse; the removal screen is the only way to see it, since a one-at-a-time probe measured it before its conditioners existed", "tags": ["feature-engineering", "removal-screen"]}
{"exp": 29, "commit": "563435c", "parent_best": "149d104", "status": "keep", "started_at": "2026-09-01T03:10:30Z", "ended_at": "2026-09-01T03:16:21Z", "model_family": "PhysicsMLP", "features": ["speed_mph", "prev_speed_mph", "next_speed_mph", "prev_miles", "next_miles", "prev2_speed_mph", "next2_speed_mph", "prev_grade_percent", "entry_kinetic_gge", "exit_kinetic_gge", "sinuosity", "junction_turn_degrees", "prev_sinuosity", "next_junction_turn_degrees", "grade_percent", "miles"], "metrics": {"rmse": 0.006217, "trip_rmse": 0.002138, "physics_pass": 1.0, "physics_violation_rate": 0.0, "long_link_violation_rate": 0.0, "length_invariance": 0.752265}, "best_before": {"rmse": 0.006216, "trip_rmse": 0.002157, "physics_pass": 1.0, "physics_violation_rate": 0.0, "long_link_violation_rate": 0.0, "length_invariance": 0.360035}, "delta_pct": {"rmse": 0.02, "trip_rmse": -0.88, "physics_pass": 0.0, "physics_violation_rate": 0.0, "long_link_violation_rate": 0.0, "length_invariance": 108.9}, "description": "add exit_kinetic_gge", "hypothesis": "exp28 showed the entry kinetic term still earns its place and is worth more than when it was added, so its exit-side analogue - what the link hands on rather than what it was handed - should carry the braking half of the same physics", "observation": "trip_rmse -0.88% against rmse +0.02%, which is one unit in the last printed digit (0.006216 -> 0.006217)", "reasoning": "kept as a judgement call and flagged as one. The rmse movement is 1.6e-4 relative, an order of magnitude below anything else treated as signal this session and at the resolution of the reported figure, against a trip gain 44x larger; contrast exp5, discarded at a 6:1 ratio where the gain itself was also negligible. Read this as a tie plus an improvement, not as a Pareto violation", "tags": ["feature-engineering", "judgement"]}
{"exp": 30, "commit": "c8f9dbd", "parent_best": "563435c", "status": "discard", "started_at": "2026-09-01T03:16:54Z", "ended_at": "2026-09-01T03:21:09Z", "model_family": "PhysicsMLP", "features": ["speed_mph", "prev_speed_mph", "next_speed_mph", "prev_miles", "next_miles", "prev2_speed_mph", "next2_speed_mph", "prev3_speed_mph", "prev_grade_percent", "entry_kinetic_gge", "exit_kinetic_gge", "sinuosity", "junction_turn_degrees", "prev_sinuosity", "next_junction_turn_degrees", "grade_percent", "miles"], "metrics": {"rmse": 0.006203, "trip_rmse": 0.002157, "physics_pass": 1.0, "physics_violation_rate": 0.0, "long_link_violation_rate": 0.0, "length_invariance": 0.252542}, "best_before": {"rmse": 0.006217, "trip_rmse": 0.002138, "physics_pass": 1.0, "physics_violation_rate": 0.0, "long_link_violation_rate": 0.0, "length_invariance": 0.752265}, "delta_pct": {"rmse": -0.23, "trip_rmse": 0.89, "physics_pass": 0.0, "physics_violation_rate": 0.0, "long_link_violation_rate": 0.0, "length_invariance": -66.4}, "description": "add prev3_speed_mph (does the chain reach three links?)", "hypothesis": "prev2 was worth -2.6% and next2 -1.4%, so the chain may not be exhausted at two links out", "observation": "rmse -0.23% and trip_rmse +0.89% - the split that says a feature is adding more noise than signal", "reasoning": "the chain is exhausted at +/-2. This closes the wide-context direction for the session and retroactively justifies not building a sequence model over the whole trip: both sibling trees reported the signal is local, and a third link of lookback is already past the point where it pays", "tags": ["feature-engineering", "dead-end", "trip-context"]}
{"exp": 31, "commit": "23da290", "parent_best": "563435c", "status": "keep", "started_at": "2026-09-01T03:22:10Z", "ended_at": "2026-09-01T03:31:15Z", "model_family": "PhysicsMLP", "features": ["speed_mph", "prev_speed_mph", "next_speed_mph", "prev_miles", "next_miles", "prev2_speed_mph", "next2_speed_mph", "prev_grade_percent", "entry_kinetic_gge", "exit_kinetic_gge", "sinuosity", "junction_turn_degrees", "prev_sinuosity", "next_junction_turn_degrees", "grade_percent", "miles"], "metrics": {"rmse": 0.005921, "trip_rmse": 0.002091, "physics_pass": 1.0, "physics_violation_rate": 0.0, "long_link_violation_rate": 0.0, "length_invariance": 0.666939}, "best_before": {"rmse": 0.006217, "trip_rmse": 0.002138, "physics_pass": 1.0, "physics_violation_rate": 0.0, "long_link_violation_rate": 0.0, "length_invariance": 0.752265}, "delta_pct": {"rmse": -4.76, "trip_rmse": -2.2, "physics_pass": 0.0, "physics_violation_rate": 0.0, "long_link_violation_rate": 0.0, "length_invariance": -11.35}, "description": "let the transient cost grow with link length (monotone, so still legal)", "hypothesis": "the heads were barred from depending on link length to protect energy_grows_with_distance, but that check only needs the added distance to be paid for, and A >= res/2 already pays it - so *any* T non-decreasing in length is legal, and a half-mile link plausibly contains more acceleration events than a hundred-foot one at the same average speed", "observation": "rmse -4.8% and trip_rmse -2.2%, the second largest move of the session, physics clean; 295/300 epochs, so the run was very slightly truncated by the time cap", "reasoning": "the same move as exp7 and it paid the same way: the constraint that looked structural was stronger than the check that motivated it. The rule generalising from both is that a by-construction guarantee should be re-derived from the *checks*, not inherited from the first sufficient condition that happened to work - the first version of a safe parametrization is usually safe by more than it needs to be", "tags": ["architecture", "breakthrough", "physics"]}
{"exp": 32, "commit": "787db11", "parent_best": "23da290", "status": "discard", "started_at": "2026-09-01T03:32:52Z", "ended_at": "2026-09-01T03:40:48Z", "model_family": "PhysicsMLP", "features": ["speed_mph", "prev_speed_mph", "next_speed_mph", "prev_miles", "next_miles", "prev2_speed_mph", "next2_speed_mph", "prev_grade_percent", "entry_kinetic_gge", "exit_kinetic_gge", "sinuosity", "junction_turn_degrees", "prev_sinuosity", "next_junction_turn_degrees", "grade_percent", "miles"], "metrics": {"rmse": 0.00592, "trip_rmse": 0.002097, "physics_pass": 1.0, "physics_violation_rate": 0.0, "long_link_violation_rate": 0.0, "length_invariance": 0.51755}, "best_before": {"rmse": 0.005921, "trip_rmse": 0.002091, "physics_pass": 1.0, "physics_violation_rate": 0.0, "long_link_violation_rate": 0.0, "length_invariance": 0.666939}, "delta_pct": {"rmse": -0.02, "trip_rmse": 0.29, "physics_pass": 0.0, "physics_violation_rate": 0.0, "long_link_violation_rate": 0.0, "length_invariance": -22.4}, "description": "let the road-load rate grow with link length too", "hypothesis": "the same monotone relaxation that made the transient length-dependent at exp31 is equally legal for A, since energy_grows_with_distance is satisfied by A >= res/2 whatever A does with length", "observation": "rmse tied and trip_rmse +0.29%, so the extra freedom bought nothing and cost a little; a first attempt also crashed on a shadowed local name and was fixed and re-run", "reasoning": "the more useful reading is that exp31's win was physically specific rather than just extra parameters - a cruise rate should not depend on how the road was segmented, and a transient cost should, and the data agrees with both; it also means the exp31 result is not an artifact of adding two head outputs, since adding two more here did nothing", "tags": ["architecture", "physics", "dead-end"]}
{"exp": 33, "commit": "b2521a4", "parent_best": "23da290", "status": "discard", "started_at": "2026-09-01T03:41:20Z", "ended_at": "2026-09-01T03:50:19Z", "model_family": "PhysicsMLP", "features": ["speed_mph", "prev_speed_mph", "next_speed_mph", "prev_miles", "next_miles", "prev2_speed_mph", "next2_speed_mph", "prev_grade_percent", "entry_kinetic_gge", "exit_kinetic_gge", "sinuosity", "junction_turn_degrees", "prev_sinuosity", "next_junction_turn_degrees", "grade_percent", "miles"], "metrics": {"rmse": 0.00598, "trip_rmse": 0.002079, "physics_pass": 1.0, "physics_violation_rate": 0.0, "long_link_violation_rate": 0.0, "length_invariance": 0.633862}, "best_before": {"rmse": 0.005921, "trip_rmse": 0.002091, "physics_pass": 1.0, "physics_violation_rate": 0.0, "long_link_violation_rate": 0.0, "length_invariance": 0.666939}, "delta_pct": {"rmse": 1.0, "trip_rmse": -0.57, "physics_pass": 0.0, "physics_violation_rate": 0.0, "long_link_violation_rate": 0.0, "length_invariance": -4.96}, "description": "re-test width 256 under the length-dependent transient", "hypothesis": "the re-test rule has flipped three verdicts this session (exp8, exp11, exp26) and exp31 was the largest structural change since exp7, so the width verdict may be stale too", "observation": "identical verdict and nearly identical magnitudes to exp15 - rmse +1.0%, trip_rmse -0.57%", "reasoning": "the re-test rule has limits worth recording: it flipped every *feature* verdict it was applied to but neither capacity verdict, which fits the mechanism - a feature's value depends on what the model can do with it, while the capacity trade is a property of the two metrics themselves and does not move when the model does", "tags": ["architecture", "dead-end", "re-test"]}
{"exp": 34, "commit": "52b9c48", "parent_best": "23da290", "status": "keep", "started_at": "2026-09-01T03:51:06Z", "ended_at": "2026-09-01T03:58:33Z", "model_family": "PhysicsMLP", "features": ["speed_mph", "prev_speed_mph", "next_speed_mph", "prev_miles", "next_miles", "prev2_miles", "prev2_speed_mph", "next2_speed_mph", "prev_grade_percent", "entry_kinetic_gge", "exit_kinetic_gge", "sinuosity", "junction_turn_degrees", "prev_sinuosity", "next_junction_turn_degrees", "grade_percent", "miles"], "metrics": {"rmse": 0.005915, "trip_rmse": 0.002084, "physics_pass": 1.0, "physics_violation_rate": 0.0, "long_link_violation_rate": 0.0, "length_invariance": 0.500424}, "best_before": {"rmse": 0.005921, "trip_rmse": 0.002091, "physics_pass": 1.0, "physics_violation_rate": 0.0, "long_link_violation_rate": 0.0, "length_invariance": 0.666939}, "delta_pct": {"rmse": -0.1, "trip_rmse": -0.33, "physics_pass": 0.0, "physics_violation_rate": 0.0, "long_link_violation_rate": 0.0, "length_invariance": -24.9}, "description": "add prev2_miles", "hypothesis": "prev_miles is reliability context for prev_speed_mph and was worth -8.8%/-5.1%; the same pairing should hold one link further out, where prev2_speed is already a kept feature", "observation": "rmse -0.10% and trip_rmse -0.33%, both real but an order of magnitude smaller than the +/-1 pairing", "reasoning": "the pair-with-its-reliability-context rule holds at two links out but at a tenth the size, which is consistent with prev3_speed failing outright at exp30 - the chain does not stop abruptly, it fades, and +/-2 is where it stops being worth a feature", "tags": ["feature-engineering"]}
{"exp": 35, "commit": "288fd8d", "parent_best": "52b9c48", "status": "discard", "started_at": "2026-09-01T03:58:52Z", "ended_at": "2026-09-01T04:06:15Z", "model_family": "PhysicsMLP", "features": ["speed_mph", "prev_speed_mph", "next_speed_mph", "prev_miles", "next_miles", "prev2_miles", "next2_miles", "prev2_speed_mph", "next2_speed_mph", "prev_grade_percent", "entry_kinetic_gge", "exit_kinetic_gge", "sinuosity", "junction_turn_degrees", "prev_sinuosity", "next_junction_turn_degrees", "grade_percent", "miles"], "metrics": {"rmse": 0.005935, "trip_rmse": 0.002093, "physics_pass": 1.0, "physics_violation_rate": 0.0, "long_link_violation_rate": 0.0, "length_invariance": 0.726082}, "best_before": {"rmse": 0.005915, "trip_rmse": 0.002084, "physics_pass": 1.0, "physics_violation_rate": 0.0, "long_link_violation_rate": 0.0, "length_invariance": 0.500424}, "delta_pct": {"rmse": 0.34, "trip_rmse": 0.43, "physics_pass": 0.0, "physics_violation_rate": 0.0, "long_link_violation_rate": 0.0, "length_invariance": 45.09}, "description": "add next2_miles", "hypothesis": "the exit-side partner of prev2_miles, which kept one experiment earlier at -0.10%/-0.33%", "observation": "both metrics worse (rmse +0.34%, trip_rmse +0.43%) - the first paired feature this session where the exit side is actively harmful rather than merely smaller", "reasoning": "at two links out the entry-over-exit ratio has crossed zero: prev2_miles is worth a tenth of prev_miles and next2_miles is worth less than nothing, which puts the edge of the useful window between them and matches prev3_speed failing at exp30", "tags": ["feature-engineering", "dead-end"]}
{"exp": 36, "commit": "336a1ab", "parent_best": "52b9c48", "status": "discard", "started_at": "2026-09-01T04:07:09Z", "ended_at": "2026-09-01T04:16:13Z", "model_family": "PhysicsMLP", "features": ["speed_mph", "prev_speed_mph", "next_speed_mph", "prev_miles", "next_miles", "prev2_miles", "prev2_speed_mph", "next2_speed_mph", "prev_grade_percent", "entry_kinetic_gge", "exit_kinetic_gge", "sinuosity", "junction_turn_degrees", "prev_sinuosity", "next_junction_turn_degrees", "grade_percent", "miles"], "metrics": {"rmse": 0.005937, "trip_rmse": 0.002098, "physics_pass": 1.0, "physics_violation_rate": 0.0, "long_link_violation_rate": 0.0, "length_invariance": 0.74884}, "best_before": {"rmse": 0.005915, "trip_rmse": 0.002084, "physics_pass": 1.0, "physics_violation_rate": 0.0, "long_link_violation_rate": 0.0, "length_invariance": 0.500424}, "delta_pct": {"rmse": 0.37, "trip_rmse": 0.67, "physics_pass": 0.0, "physics_violation_rate": 0.0, "long_link_violation_rate": 0.0, "length_invariance": 49.64}, "description": "open the climb-slack gate at 0.25% grade instead of 1%", "hypothesis": "the median link has grade 0 and most have |grade| < 1%, so gating the climb slack at 1% pins the grade response to almost exactly k_pot*g over the bulk of the data; opening the gate earlier should free it where most of the data lives", "observation": "both metrics worse (rmse +0.37%, trip_rmse +0.67%)", "reasoning": "third independent result saying the grade response is not the limitation - exp6 (slack barely binding), exp27 (descent shape irrelevant) and now this. Potential energy determines the grade term almost completely, which is the one part of the physics the link average does not hide, and extra freedom there only lets the model fit noise", "tags": ["hypertuning", "physics", "dead-end"]}
