{"exp": 49, "commit": "e91bf5e", "parent_best": "bc07466", "status": "discard", "started_at": "2026-08-26T04:32:20Z", "ended_at": "2026-08-26T04:40:52Z", "model_family": "GBDT+CNN", "features": ["speed_mph", "grade_percent", "miles", "dke_per_mile", "dke_in_link", "gap_seconds", "prev_miles", "next_miles", "next_gap_seconds", "prev2_speed", "dv_out", "journey_rate", "journey_gge_per_mile"], "metrics": {"rmse": 0.004797, "trip_rmse": 0.001244}, "best_before": {"rmse": 0.004785, "trip_rmse": 0.001231}, "delta_pct": {"rmse": 0.25, "trip_rmse": 1.06}, "description": "raise the sequence learning rate from 4.5e-3 to 7e-3", "hypothesis": "3e-3 -> 4.5e-3 paid on both metrics, so the time-starved member may want a larger step still", "observation": "both metrics worse (rmse +0.25%, trip +1.06%)", "reasoning": "4.5e-3 is an interior optimum -- the fourth of the session, after the blend weight, the receptive field and the batch size. Past it the steps are large enough to cost stability, which the short cosine schedule has no room to recover from.", "tags": ["hypertuning", "dead-end"]}
