{"exp": 32, "commit": "ab5fdba", "parent_best": "2fa4068", "status": "discard", "started_at": "2026-08-26T02:01:02Z", "ended_at": "2026-08-26T02:09:19Z", "model_family": "GBDT+CNN", "features": ["speed_mph", "grade_percent", "miles", "dke_per_mile", "dke_in_link", "gap_seconds", "prev_miles", "next_miles", "next_gap_seconds", "prev2_speed", "dv_out", "journey_rate", "journey_gge_per_mile"], "metrics": {"rmse": 0.00485, "trip_rmse": 0.001278}, "best_before": {"rmse": 0.004855, "trip_rmse": 0.001272}, "delta_pct": {"rmse": -0.1, "trip_rmse": 0.47}, "description": "raise the journey-offset shrinkage from 20 to 30 links", "hypothesis": "the offset is measured from tree-only residuals but applied to a blend that predicts better than those trees, so the correction it prescribes should now be an over-correction and want more shrinkage", "observation": "rmse -0.10% (tie band) and trip_rmse +0.47% (worse)", "reasoning": "The premise was wrong: the blend beats the trees by 2%, which is far too small to shift the optimal shrinkage of a correction that is already shrunk by a factor of ~5. Two shrinkage experiments either side of 20 (exp26 at 40, this at 30) have now both come back worse -- the parameter is at its optimum and should be left alone.", "tags": ["hypertuning", "dead-end"]}
{"exp": 33, "commit": "34e6a6d", "parent_best": "2fa4068", "status": "keep", "started_at": "2026-08-26T02:09:38Z", "ended_at": "2026-08-26T02:18:07Z", "model_family": "GBDT+CNN", "features": ["speed_mph", "grade_percent", "miles", "dke_per_mile", "dke_in_link", "gap_seconds", "prev_miles", "next_miles", "next_gap_seconds", "prev2_speed", "dv_out", "journey_rate", "journey_gge_per_mile"], "metrics": {"rmse": 0.004842, "trip_rmse": 0.001269}, "best_before": {"rmse": 0.004855, "trip_rmse": 0.001272}, "delta_pct": {"rmse": -0.27, "trip_rmse": -0.24}, "description": "narrow the sequence member from 128 to 96 channels", "hypothesis": "the sequence member is squeezed twice over -- it gets only ~45s of leftover budget and it overfits 15,247 journeys if trained longer -- so a narrower net should fit more epochs into the time it has and overfit less in each", "observation": "rmse -0.27% (0.004855 -> 0.004842) and trip_rmse -0.24% (0.001272 -> 0.001269)", "reasoning": "Small but on both metrics, and it confirms the member was capacity-rich rather than capacity-poor -- the same diagnosis as exp15, where the long CNN run lost to the short one. Worth pushing narrower.", "tags": ["architecture", "hypertuning"]}
{"exp": 34, "commit": "691aa62", "parent_best": "34e6a6d", "status": "keep", "started_at": "2026-08-26T02:18:23Z", "ended_at": "2026-08-26T02:27:05Z", "model_family": "GBDT+CNN", "features": ["speed_mph", "grade_percent", "miles", "dke_per_mile", "dke_in_link", "gap_seconds", "prev_miles", "next_miles", "next_gap_seconds", "prev2_speed", "dv_out", "journey_rate", "journey_gge_per_mile"], "metrics": {"rmse": 0.00484, "trip_rmse": 0.001267}, "best_before": {"rmse": 0.004842, "trip_rmse": 0.001269}, "delta_pct": {"rmse": -0.04, "trip_rmse": -0.16}, "description": "narrow the sequence member from 96 to 64 channels", "hypothesis": "exp33 showed the member is capacity-rich for the time it gets, so narrowing further should keep paying", "observation": "rmse -0.04% and trip_rmse -0.16% -- both improved, but both inside the 0.25% noise band, so this is the end of the trend rather than more of it", "reasoning": "Kept on the 'both improve' clause and because a 64-channel net is a smaller model than a 96-channel one, but honestly reported as a wash: 128 -> 96 was worth 0.27% and 96 -> 64 is worth 0.04%. Capacity in the sequence member is now exhausted as a lever; its receptive field, not its width, is the remaining axis.", "tags": ["architecture", "hypertuning"]}
{"exp": 35, "commit": "6d78677", "parent_best": "691aa62", "status": "keep", "started_at": "2026-08-26T02:27:31Z", "ended_at": "2026-08-26T02:36:01Z", "model_family": "GBDT+CNN", "features": ["speed_mph", "grade_percent", "miles", "dke_per_mile", "dke_in_link", "gap_seconds", "prev_miles", "next_miles", "next_gap_seconds", "prev2_speed", "dv_out", "journey_rate", "journey_gge_per_mile"], "metrics": {"rmse": 0.004832, "trip_rmse": 0.001264}, "best_before": {"rmse": 0.00484, "trip_rmse": 0.001267}, "delta_pct": {"rmse": -0.17, "trip_rmse": -0.24}, "description": "drop the dilation-8 block, shrinking the sequence receptive field from +/-30 links to +/-14", "hypothesis": "every probe says the signal is local -- rolling +/-5 window features were worth ~1% and trip aggregates nothing -- so the widest block is spending parameters and epochs on context that is not there", "observation": "rmse -0.17% and trip_rmse -0.24%, with one fewer block to train", "reasoning": "Removing capacity improved both metrics and made the model smaller, which is the cleanest kind of result: the wide receptive field was never earning anything. Consistent with the whole session's evidence that link energy is set by its immediate neighbours.", "tags": ["architecture", "simplification"]}
{"exp": 36, "commit": "04b5a99", "parent_best": "6d78677", "status": "keep", "started_at": "2026-08-26T02:36:18Z", "ended_at": "2026-08-26T02:44:51Z", "model_family": "GBDT+CNN", "features": ["speed_mph", "grade_percent", "miles", "dke_per_mile", "dke_in_link", "gap_seconds", "prev_miles", "next_miles", "next_gap_seconds", "prev2_speed", "dv_out", "journey_rate", "journey_gge_per_mile"], "metrics": {"rmse": 0.004814, "trip_rmse": 0.001263}, "best_before": {"rmse": 0.004832, "trip_rmse": 0.001264}, "delta_pct": {"rmse": -0.37, "trip_rmse": -0.08}, "description": "drop the dilation-4 block too, shrinking the sequence receptive field from +/-14 links to +/-6", "hypothesis": "if +/-30 was too wide, +/-14 probably is too", "observation": "rmse -0.37% and trip_rmse -0.08%, and the gain is bigger than the previous shrink's, not smaller", "reasoning": "Two blocks removed, both times an improvement, and accelerating -- the sequence member's value is not wide context at all. It is a smooth local function estimator whose errors happen to be decorrelated from the trees'. That reframes what this member is for and says to keep shrinking until it stops paying.", "tags": ["architecture", "simplification"]}
{"exp": 37, "commit": "7604287", "parent_best": "04b5a99", "status": "discard", "started_at": "2026-08-26T02:45:08Z", "ended_at": "2026-08-26T02:53:41Z", "model_family": "GBDT+CNN", "features": ["speed_mph", "grade_percent", "miles", "dke_per_mile", "dke_in_link", "gap_seconds", "prev_miles", "next_miles", "next_gap_seconds", "prev2_speed", "dv_out", "journey_rate", "journey_gge_per_mile"], "metrics": {"rmse": 0.004875, "trip_rmse": 0.00127}, "best_before": {"rmse": 0.004814, "trip_rmse": 0.001263}, "delta_pct": {"rmse": 1.27, "trip_rmse": 0.55}, "description": "drop the dilation-2 block as well, shrinking the sequence receptive field from +/-6 links to +/-2", "hypothesis": "two successive shrinks both paid and the second paid more, so the optimum may be narrower still", "observation": "rmse +1.27% and trip_rmse +0.55% -- the first shrink that lost, and by more than the last two gained", "reasoning": "+/-6 links is a genuine interior optimum, which is worth more than the 0.4% it earned: the shrink series 30 -> 14 -> 6 -> 2 turned around exactly where the hand-cut features stop (the trees see +/-2), so the sequence member is contributing precisely the band from three to six links out that nothing else covers.", "tags": ["architecture", "hypertuning"]}
{"exp": 38, "commit": "aa40eb2", "parent_best": "04b5a99", "status": "discard", "started_at": "2026-08-26T02:54:02Z", "ended_at": "2026-08-26T03:02:30Z", "model_family": "GBDT+CNN", "features": ["speed_mph", "grade_percent", "miles", "dke_per_mile", "dke_in_link", "gap_seconds", "prev_miles", "next_miles", "next_gap_seconds", "prev2_speed", "dv_out", "journey_rate", "journey_gge_per_mile"], "metrics": {"rmse": 0.004833, "trip_rmse": 0.001261}, "best_before": {"rmse": 0.004814, "trip_rmse": 0.001263}, "delta_pct": {"rmse": 0.39, "trip_rmse": -0.16}, "description": "widen the now two-block sequence member from 64 back to 128 channels", "hypothesis": "the width optimum was found with four blocks; with only two, capacity may be better spent on width than it was", "observation": "rmse +0.39%, trip_rmse -0.16% -- the familiar split, extra capacity buying the trip metric at the link metric's expense", "reasoning": "Same pattern as exp5 and exp12 in the trees: past the optimum, capacity fits per-link noise, which the mileage-weighted metric averages out and the equally-weighted one does not. It appears in a neural net for the same reason it appears in a boosted tree, so it is a property of the target, not of the learner.", "tags": ["architecture", "hypertuning", "dead-end"]}
{"exp": 39, "commit": "36340e9", "parent_best": "04b5a99", "status": "keep", "started_at": "2026-08-26T03:02:57Z", "ended_at": "2026-08-26T03:11:29Z", "model_family": "GBDT+CNN", "features": ["speed_mph", "grade_percent", "miles", "dke_per_mile", "dke_in_link", "gap_seconds", "prev_miles", "next_miles", "next_gap_seconds", "prev2_speed", "dv_out", "journey_rate", "journey_gge_per_mile"], "metrics": {"rmse": 0.004807, "trip_rmse": 0.001263}, "best_before": {"rmse": 0.004814, "trip_rmse": 0.001263}, "delta_pct": {"rmse": -0.15, "trip_rmse": 0.0}, "description": "re-test the blend weight at 0.30 now that the sequence member is smaller and better", "hypothesis": "the weight was tuned against the old 128-channel four-block member; four architecture keeps later that member is stronger, so it should now earn a larger share -- the same re-measure-after-a-keep rule that caught dke_out_link", "observation": "rmse -0.15% and trip_rmse unchanged to six decimals, where the same weight change on the old member (exp31, 0.32) cost 0.55% of trip_rmse", "reasoning": "Kept because nothing regressed and the primary improved -- the 'both improve' clause is about avoiding paid-for gains, and there is nothing paid here. The substantive point is that the blend weight and the member's architecture are coupled, so tuning them in one pass each was never going to land on the joint optimum.", "tags": ["hypertuning", "ensembling"]}
{"exp": 40, "commit": "2465c97", "parent_best": "36340e9", "status": "discard", "started_at": "2026-08-26T03:11:54Z", "ended_at": "2026-08-26T03:20:19Z", "model_family": "GBDT+CNN", "features": ["speed_mph", "grade_percent", "miles", "dke_per_mile", "dke_in_link", "gap_seconds", "prev_miles", "next_miles", "next_gap_seconds", "prev2_speed", "dv_out", "journey_rate", "journey_gge_per_mile"], "metrics": {"rmse": 0.0048, "trip_rmse": 0.001274}, "best_before": {"rmse": 0.004807, "trip_rmse": 0.001263}, "delta_pct": {"rmse": -0.15, "trip_rmse": 0.87}, "description": "raise the blend weight from 0.30 to 0.35", "hypothesis": "0.30 improved on 0.25 with nothing paid, so the joint optimum may be further out still", "observation": "rmse -0.15% again but trip_rmse +0.87% -- the same rmse gain as the last step, now with a real price attached", "reasoning": "0.30 is the edge: rmse keeps drifting down through 0.35 because the blend's variance reduction is still working, while trip_rmse turns over because the sequence member carries more per-trip bias than the trees do (it has no journey offset of its own). The primary metric alone would keep walking this weight up; the secondary is what stops it.", "tags": ["hypertuning", "ensembling", "dead-end"]}
{"exp": 41, "commit": "6d59a91", "parent_best": "36340e9", "status": "discard", "started_at": "2026-08-26T03:20:42Z", "ended_at": "2026-08-26T03:29:15Z", "model_family": "GBDT+CNN", "features": ["speed_mph", "grade_percent", "miles", "dke_per_mile", "dke_in_link", "gap_seconds", "prev_miles", "next_miles", "next_gap_seconds", "prev2_speed", "dv_out", "journey_rate", "journey_gge_per_mile"], "metrics": {"rmse": 0.004823, "trip_rmse": 0.001269}, "best_before": {"rmse": 0.004807, "trip_rmse": 0.001263}, "delta_pct": {"rmse": 0.33, "trip_rmse": 0.48}, "description": "halve the sequence batch size from 32768 to 16384 tokens", "hypothesis": "the sequence member is time-starved at ~45s, so twice as many gradient updates per epoch should get it further down the curve in the time it has", "observation": "both metrics worse (rmse +0.33%, trip +0.48%)", "reasoning": "Smaller batches did not buy more progress: on a P100 these kernels are already small enough that halving the batch mostly halves GPU utilisation rather than doubling useful updates, so the epoch count barely moved while each update got noisier. Worth testing the other direction.", "tags": ["hypertuning", "dead-end"]}
{"exp": 42, "commit": "d54ed67", "parent_best": "36340e9", "status": "discard", "started_at": "2026-08-26T03:29:32Z", "ended_at": "2026-08-26T03:38:08Z", "model_family": "GBDT+CNN", "features": ["speed_mph", "grade_percent", "miles", "dke_per_mile", "dke_in_link", "gap_seconds", "prev_miles", "next_miles", "next_gap_seconds", "prev2_speed", "dv_out", "journey_rate", "journey_gge_per_mile"], "metrics": {"rmse": 0.004834, "trip_rmse": 0.001272}, "best_before": {"rmse": 0.004807, "trip_rmse": 0.001263}, "delta_pct": {"rmse": 0.56, "trip_rmse": 0.71}, "description": "double the sequence batch size from 32768 to 65536 tokens", "hypothesis": "if halving the batch lost by trading updates for utilisation, doubling it may win the trade back", "observation": "worse than halving it: rmse +0.56%, trip +0.71%", "reasoning": "Both directions lose, so 32768 is an interior optimum -- the third of the session (blend weight, receptive field, batch size), which is a reasonable sign the sequence member is genuinely tuned rather than sitting on a plateau I have not explored.", "tags": ["hypertuning", "dead-end"]}
{"exp": 43, "commit": "4f355fe", "parent_best": "36340e9", "status": "discard", "started_at": "2026-08-26T03:38:40Z", "ended_at": "2026-08-26T03:47:08Z", "model_family": "GBDT+CNN", "features": ["speed_mph", "grade_percent", "miles", "dke_per_mile", "dke_in_link", "gap_seconds", "prev_miles", "next_miles", "next_gap_seconds", "prev2_speed", "dv_out", "journey_rate", "journey_gge_per_mile"], "metrics": {"rmse": 0.004794, "trip_rmse": 0.00127}, "best_before": {"rmse": 0.004807, "trip_rmse": 0.001263}, "delta_pct": {"rmse": -0.27, "trip_rmse": 0.55}, "description": "raise the tree learning rate from 0.10 to 0.12 at the same 2000 iterations", "hypothesis": "exp11/exp12 bracket the effective-capacity optimum between 2000 and 8000 rounds at lr 0.10, and more rounds are unaffordable, so a higher rate buys some of that capacity for free", "observation": "rmse -0.27% but trip_rmse +0.55%", "reasoning": "The metrics split again, but in the *opposite* direction to every previous capacity experiment -- exp5, exp12 and exp38 all made rmse worse and trip_rmse better with more capacity, and this does the reverse. So the recurring split is not simply 'capacity trades the metrics': raising the step size is not the same knob as adding rounds or widening trees, and I do not have a mechanism that explains the sign. Recording it as an unexplained split rather than fitting a story to it.", "tags": ["hypertuning", "metric-tension", "dead-end"]}
{"exp": 44, "commit": "01dbfe0", "parent_best": "36340e9", "status": "discard", "started_at": "2026-08-26T03:47:42Z", "ended_at": "2026-08-26T03:56:10Z", "model_family": "GBDT+CNN", "features": ["speed_mph", "grade_percent", "miles", "dke_per_mile", "dke_in_link", "gap_seconds", "prev_miles", "next_miles", "next_gap_seconds", "prev2_speed", "dv_out", "journey_rate", "journey_gge_per_mile"], "metrics": {"rmse": 0.004806, "trip_rmse": 0.001281}, "best_before": {"rmse": 0.004807, "trip_rmse": 0.001263}, "delta_pct": {"rmse": -0.02, "trip_rmse": 1.43}, "description": "lower the journey-offset shrinkage from 20 to 12 links", "hypothesis": "exp40 showed the sequence member carries per-trip bias the trees do not (it gets no journey information at all), so the single tree-derived offset should now be under-correcting and want less shrinkage", "observation": "rmse flat, trip_rmse +1.43% -- the worst of the three shrinkage experiments", "reasoning": "Shrinkage is now bracketed on both sides (12 worse, 30 worse, 40 worse) so 20 is a confirmed interior optimum, and the under-correction hypothesis is wrong in this form: the offset's magnitude is not the problem. If the sequence member's trip bias is the issue, the fix has to be measuring the offset against the *blend's* residual rather than the trees'.", "tags": ["hypertuning", "dead-end"]}
{"exp": 45, "commit": "2c30f2c", "parent_best": "36340e9", "status": "keep", "started_at": "2026-08-26T03:56:48Z", "ended_at": "2026-08-26T04:05:19Z", "model_family": "GBDT+CNN", "features": ["speed_mph", "grade_percent", "miles", "dke_per_mile", "dke_in_link", "gap_seconds", "prev_miles", "next_miles", "next_gap_seconds", "prev2_speed", "dv_out", "journey_rate", "journey_gge_per_mile"], "metrics": {"rmse": 0.004797, "trip_rmse": 0.00124}, "best_before": {"rmse": 0.004807, "trip_rmse": 0.001263}, "delta_pct": {"rmse": -0.21, "trip_rmse": -1.82}, "description": "measure the journey offset against the blend's training residual instead of the trees' alone", "hypothesis": "exp44 ruled out the offset being the wrong *size*; if the sequence member's uncorrected trip bias is the problem then the offset is being fitted to the wrong *quantity* -- it should see the residual of what is actually predicted", "observation": "trip_rmse -1.82% (0.001263 -> 0.001240) and rmse -0.21%, from one line that reweights the residual the offset is built from", "reasoning": "Same idea as exp44 and the opposite result, which is the useful part: the offset was mis-targeted, not mis-scaled, and scaling it could never have fixed that -- lowering the shrinkage just amplified a correction pointed at the wrong residual. Also predicts that the blend weight's ceiling has moved, since exp40's trip penalty at 0.35 was exactly this uncorrected bias.", "tags": ["target-encoding", "architecture"]}
{"exp": 46, "commit": "bfaf3ea", "parent_best": "2c30f2c", "status": "discard", "started_at": "2026-08-26T04:05:42Z", "ended_at": "2026-08-26T04:14:15Z", "model_family": "GBDT+CNN", "features": ["speed_mph", "grade_percent", "miles", "dke_per_mile", "dke_in_link", "gap_seconds", "prev_miles", "next_miles", "next_gap_seconds", "prev2_speed", "dv_out", "journey_rate", "journey_gge_per_mile"], "metrics": {"rmse": 0.004816, "trip_rmse": 0.001245}, "best_before": {"rmse": 0.004797, "trip_rmse": 0.00124}, "delta_pct": {"rmse": 0.4, "trip_rmse": 0.4}, "description": "re-test the blend weight at 0.35 now that the journey offset is measured against the blend", "hypothesis": "exp40's trip penalty at 0.35 was the sequence member's uncorrected trip bias, which exp45 has now removed, so the weight's ceiling should have risen", "observation": "worse on both metrics (+0.40% each), where the same weight under the old offset was rmse -0.15% / trip +0.87%", "reasoning": "The prediction was half right in an instructive way: the trip penalty did shrink from 0.87% to 0.40%, so the uncorrected bias was real. But the rmse gain flipped sign, because the blend-aware offset now absorbs some of what a heavier sequence weight used to contribute. The two knobs overlap, and 0.30 is the joint optimum for both.", "tags": ["hypertuning", "ensembling", "dead-end"]}
{"exp": 47, "commit": "8ee170b", "parent_best": "2c30f2c", "status": "discard", "started_at": "2026-08-26T04:14:38Z", "ended_at": "2026-08-26T04:23:11Z", "model_family": "GBDT+CNN", "features": ["speed_mph", "grade_percent", "miles", "dke_per_mile", "dke_in_link", "gap_seconds", "prev_miles", "next_miles", "next_gap_seconds", "prev2_speed", "dv_out", "journey_rate", "journey_gge_per_mile"], "metrics": {"rmse": 0.004798, "trip_rmse": 0.00125}, "best_before": {"rmse": 0.004797, "trip_rmse": 0.00124}, "delta_pct": {"rmse": 0.02, "trip_rmse": 0.81}, "description": "lower the offset shrinkage from 20 to 15 now that the residual it is built from is part in-sample", "hypothesis": "the sequence member's share of the blend residual is in-sample and therefore optimistically small, so the combined residual under-states the correction and less shrinkage should compensate", "observation": "rmse flat, trip_rmse +0.81%", "reasoning": "Fourth shrinkage experiment, fourth loss -- 12, 15, 30 and 40 have all lost to 20, across two different definitions of the residual. The parameter is insensitive to what feeds it and simply wants 20, so the in-sample optimism is evidently small next to the shrinkage itself.", "tags": ["hypertuning", "dead-end"]}
{"exp": 48, "commit": "bc07466", "parent_best": "2c30f2c", "status": "keep", "started_at": "2026-08-26T04:23:33Z", "ended_at": "2026-08-26T04:32:02Z", "model_family": "GBDT+CNN", "features": ["speed_mph", "grade_percent", "miles", "dke_per_mile", "dke_in_link", "gap_seconds", "prev_miles", "next_miles", "next_gap_seconds", "prev2_speed", "dv_out", "journey_rate", "journey_gge_per_mile"], "metrics": {"rmse": 0.004785, "trip_rmse": 0.001231}, "best_before": {"rmse": 0.004797, "trip_rmse": 0.00124}, "delta_pct": {"rmse": -0.25, "trip_rmse": -0.73}, "description": "raise the sequence learning rate from 3e-3 to 4.5e-3", "hypothesis": "the sequence member gets only ~45s of leftover budget and its cosine schedule decays over exactly that, so it is limited by how far it gets rather than by where it converges -- a larger step should get further", "observation": "rmse -0.25% and trip_rmse -0.73%", "reasoning": "The learning rate was inherited unchanged from exp15, where the member had four blocks, 128 channels and 430 seconds. Three architecture keeps and a much shorter schedule later it was the last parameter still tuned for a model that no longer exists -- the same re-measure-after-a-keep lesson as exp39, found by working through which constants had never been revisited.", "tags": ["hypertuning"]}
